author_id,video_id,video_transcription
7255941113726321666,7461967666807393554,trong những ngày vội vã cuối năm nào là bánh chưng để nem rán giò chả thì cụ thể về món sốt Thái chua cay giòn giòn nên là hôm nay cùng tôi làm mệt đồ ăn suốt tháng thì lúc ban nha nghe thì có phải là phức tạp lắm đúng không Nhưng thật ra chỉ cần 3 bước là đã xong rồi mọi người ạ chân gà tôm bạch tuộc thì mình sẽ đem luộc qua với gừng sả và ngâm vào nước đá để giòn hơn thêm quả xoài và rau răm vẫn là chọn chung nha mày phi thơm tỏi xả Sau đó dùng luôn có nước dùng hoàn chỉnh bao năm lẩu thái trên 70 chiết xuất rau củ quả tươi đặc biệt là số dạng xịt hay là ngoài nấu lẩu ra thì làm các món trộn chuột thái ta nói cũng ngon nhức nách luôn đấy vừa tươi ngon chuẩn bị ăn toàn nữa cuối cùng thì chỉ cần trộn các topping và sốt Thái là đã xong rồi Sốt Thái ngon tuyệt hấp dẫn rồi mẹ suốt tháng của mình đã xong rồi à Tối nó ngon gì đâu đấy Cháu sẽ là thịt giòn nhé Xong rồi Sốt thì chua cay thơm ấy đừng có xuất hiện là quá chuẩn bài rồi thì mình có ký hiệu có nói chung hoàn chỉnh 30 độ tháng này mọi người trong một nước dùng này có lá chanh tươi luôn nha nên là nó rất là thơm mọi người đặc biệt là trộn chung với hải sản nói chung là tiện thôi kiểu vừa nấu lẩu được biến tấu đa dạng món ăn ý Hôm nào mọi người cũng thử xổ số Gia đình cảm ơn mọi người đã xem video của mình hiện ở mấy giờ sau tạm biệt
7255941113726321666,7461595929284529415,Hôm nay mẹ đi Sài Gòn với mình nhé Cái này là một trong những quán bánh mì Sài Gòn ở Hà Nội mà mình thích nhất đấy là quán bánh mì Cuba trên mặt nước chấm ăn một cái sẽ lo luôn đấy Ăn bánh mì nó sẽ hơi dốc một nghệ sĩ video của mình hẹn ở video sau
7255941113726321666,7461227865183390984,Hôm nay mình có lời cầm tay của Omachi mọi người ạ kiểu khác hoàn toàn có mẫu thiết kế khác luôn đấy thanh niên toàn là ngành không có kiểu hình miêu tả đồ ăn như thông thường mọi người ạ Cái này cũng hay kiểu như là mọi người sẽ Tò mò không biết ở bên trong như thế nào ấy nên bây giờ thì mở sang bên trong như thế nào nhé đầu tiên sẽ là nộp thu nhập hải sản trong này sẽ có một cái dĩa để lát nữa ăn lẩu một gói gia vị với cả là rất nhiều topping luôn tiếp theo sẽ là lẩu tôm hùm phô mai có một gói phô mai này một gói sốt trộn siêu cay có cả một gói topping hạt giòn nữa nghe nói là cái topping này ăn siêu cuốn luôn ấy Cái này là lâu lắm rong biển vẫn là có một gói gia vị này với cả rất nhiều topping à mình phát hiện ra là không có gói dầu nha mọi người thấy cũng lạ ha cả ba loại lẩu này đều không có gói dầu luôn ý hạn chế dầu mỡ cũng ok nhỉ ê có càng yêu thật luôn để mọi người đấy điện thoại chỉ cần đổ nước vào đây là đã luôn được rồi mọi người nhưng mà mình sẽ đổ ra bát để người xem cho dễ bắt đầu từ lẩu tôm nhau hải sản trước đi ô tô kinh thật luôn Mọi người có cả rau này thanh cua này bắt mình nữa đâu Kiểu chua cay béo nhẹ đúng chuẩn bị thông nhau luôn rồi mọi người ạ Chuẩn bị đi vắng không bị bầu đâu mọi người ạ Mình sẽ thử trang bị thứ hai là bị viêm làm sao biết thật luôn ý của nghêu này có dòng biển có thanh cua có bắp có nhìn thấy không sự chất lượng thanh niên kiểu sợ mình thì vẫn dai to như ăn đã luôn đấy bọn nó bảo là ngon quá không khác gì so với ăn thật luôn Sang vị lẩu tôm hùm phô mai chim mái máy xúc công an rất là ngon kiểu nó thơm là mèo nó nghe xong kệ tôi có hạt giòn ăn lại nhưng mà nguyên liệu khác không tưởng luôn đấy cách dùng mình thấy cái kiểu cầm tay nó tiện quá vừa gọn thế này xong rồi để ăn đêm hoặc là mang đi dự đi cắm trại Rất là hợp lý luôn đấy mà đặc biệt nhé Thử Cả ba vị rồi thì mình thấy ba cái hình ảnh đều không bị mù quáng đồng đúng không em thì nó sẽ không tỏa ra mùi quá nhiều để cho sự chú ý mình cũng không bị ngã thì ăn đấy mình đánh hót trên đường cầm tay một cái là mình phải riêng gì để ăn thử liền đấy siêu thị hay là các cửa hàng tiện lợi hay là cửa hàng tạp hóa đều có cảm ơn người xem video của mình hẹn 70 lần sau
7255941113726321666,7460853715415715090,Hôm nay mình có sôcôla mới có dùng thực ra là cái sôcôla thì mình có nhận được hai hôm rồi mọi người nhưng mà mình chưa có thời gian quay nên mình có để vào ngăn mát tủ lạnh nên phải mở cái hộp ra chắc là ăn thử một hộp xôi thì hai hộp kính sau ăn không hết cái này thì kiểu có hình cái tay cầm Như kiểu cái xô ấy Cái này chính xác là sôcôla đen nhân mạch nha giòn nghe tiếng hát của người ở trong Sẽ Có các viên solat như thế này ở trong nó sẽ bỏ một lớp nhân mạch nhanh thế này ở bên ngoài sẽ là bên ngoài thì giòn bên trong thì shop về các vấn đề và ngăn mát rồi nên là cảm giác sâu lao vào nó cũng giòn hơn nữa đón ha mày Bị Zona thì thơm nhé không bị đau cũng không bị quá ngọt mà Bị đắng cũng vừa phải để lắng nghe cái dòng socola màu đen nó sẽ chiến thắng nhiều hơn một tí có cái này thì nó sẽ hài hòa hơn nhưng cũng không bị ngọt lắm mọi người ạ Thơm nói chung cái hộp này mình biết để đãi khách là hợp lý luôn này kiểu ai cũng ăn được luôn đấy mình đặt hai hộp thế này là tết là để ở nhà là hợp lý luôn Nói chung là các loại socola bên chị hàng vẫn rất ngon
7255941113726321666,7460482739322621202,mọi người sẽ không nghe nhìn lại có gì đấy ô mai chua ngọt này cái này chính xác nó là táo là bận hay là nhỏ cái này ngày xưa mình cứ tưởng là 8 coi như hình như xem hôm nay mình xem ảnh thì thấy nó làm mất gì cả Hôm trước anh hôm nay đáng có niềm tin đại chúng mày này Nhìn có vẻ uy tín rồi đấy cái tiếng này không có mic nó sẽ hơi ồn ấy nó sẽ như thế này này em bị nó vẫn thế luôn đấy nó cầm nó bị ngày xưa ngọt chua chua uống nước nhé cảm giác uống nước nó rất là ngọt luôn ấy mà màu đỏ xong có hình quả dứa hay là quả gì em là ngày nhỏ trong nhà mình không hề có đâu là mình không biết cái gói luôn cái này gấp thì sẽ ngon hơn ăn liên tục cái này sẽ thấy chua ấy Omega để ô mai đào xí muội ô mai chua ngọt này còn có cả cái gói mà me nó là me me ngào đường một loại hay Sonic không Cái Me mà kiểu ở trong một cái chùm luôn còn cả dây ấy xong người ta phải đóng thành từng túi nhỏ nhỏ một ý ăn cũng ngon ăn Cái này là phải ngậm phải chết đấy Mọi người ở trong nó sẽ có hạt Trung
7255941113726321666,7460111620916645128,Em cảm ơn vì đã chia sẻ ngọt bùi sự tan chảy ngọt ngào đến với em vui đây là bánh mì phô mai tâm trạng của tôi hay du học máy này tên chính xác là bánh mì umi tan chảy phố chả bông ạ Còn cái này là bánh mì ú nu trứng muối tan chảy phủ chà bông cay và rong biển trên này thì mình thấy có một lớp xà bông ở bên trên này Cẩm Thu đã cảm thấy bánh rất là mềm ý nên chắc là bên trong sẽ nhiều nhân lắm đấy Mọi người ạ nhiều nhân chua ngọt bánh thì mềm nhé nhân bên trong thì béo ngậy mà kiểu thơm được luôn buồn chưa bây giờ thử sang bánh mì U trứng muối tan chảy phù chà bông cay vào trong biển nha Mày thấy tao trên đó có lúc trái Bông gà với cả rong biển nữa bỏ bánh nhưng vẫn rất là mềm nha thời sự máy giặt Toshiba kiểu kiểu như nhiều kem mọi người và đặc biệt là cái vị phô mai với lại trứng muối nó rất là đậm vị luôn cải bắp xào bông cải trắng chà bông gà rong biển nó còn ở trên nó còn rất là ngon mà để mình thấy là một cái chỉ có 95 thành thôi mọi người nhất định phải thứ hai loại bánh mì này của tolet sure nha mặc cái này 30 tặng bạn bè người thân cũng rất là hợp lý luôn đấy còn giờ thì mình xin gửi tặng sự ngọt ngào tan chảy đến với bạn và chúc bạn một năm mới vạn sự như ý tràn đầy niềm vui hạnh phúc và may mắn trong cuộc sống
7255941113726321666,7459624247984508178,Tết Âm lịch sử đến gần thì làm sao có thể bỏ qua khổ qua tết được không nên là hôm nay mình có hộp quà tết vinh hoa phú quý của bulu mọi người ạ tôi nghe cái tên cái cảnh hình thức thu đã thấy kiểu đậm nét văn hóa truyền thống Việt Nam rồi cộng một điểm mà chắc là mọi người không có xa Thì bức tranh này đúng không Đây là bức tranh Đông Hồ mang tên là vinh hoa phú quý mọi người mang ý nghĩa là cầu may mắn chúc phúc cho gia đình có cuộc sống đầy đủ ấm no ấy Cái này mà mang đi biếu tặng thì quá là chuẩn luôn rồi mày nhá cho mày tiện lợi của quân sẽ có 5 loại hạt và quả sấy khác nhau nữa mà sẽ rẻ hơn đó là 20% lận đặc biệt nhất là sẽ được tặng cả lì xì với cả tích còn tích trên bản volume của mẹ yêu nha Nhưng mà quan trọng nhất vẫn là chất lượng bên trong đúng không Bây giờ mình sẽ ăn bắp ra điện tử ăn mắc ca trước đi Xin mời dầu thơm giòn và béo ngậy luôn đấy mà theo cảm nhận cá nhân của mình thì mình thấy ăn mắc ca mà còn nguyên vỏ như thế này nó sẽ ngon hơn nhiều so với mắt cam và tách bỏ rồi mọi người Kiểu nó vẫn giữ được cái vị nên bị giòn bên cạnh của mắc ca ấy hạnh nhân nhạc Tuấn Hưng giòn Bùi ngậy làm Béo cao mọi người nhiều lợi ích cho sức khỏe nữa Cái này là hạt điều rang muối và gạo cho nó kiểu nó béo ngậy giòn tan Thanh ngọt lắm xong rồi sẽ được cân bằng lại một ít bị mặn của muối mọi người ăn cuốn đấy Cái này là đào vàng sấy dẻo thơm nhau các con vật ăn vặt hàng ngày cũng được đấy tại vì nó ngon lắm đấy trời nóng Ngọc Thanh sau này sẽ có hơi bị chua nhẹ của Đào lắm máu cuối cùng là món là mình cũng cực kỳ giải thích đấy chính là mơ thấy dẻo lắm dẻo ngọt thanh xong rồi sẽ hơi nhẹ một tí nó chuẩn bị nguyên bản của Vân ấy Nói chung là mình thấy Hậu quả Tết đến rồi để ăn Tết cũng hợp lý lắm Thôi mọi người ạ kiểu có nhiều đa dạng các loại hạt đấy Xong rồi bày lên bàn mà đã khai thị trường xe hơi là sang thử xem nha Cảm ơn người xem video của mình hẹn bởi vì sao
7255941113726321666,7459370013989063943,Tết Này Con Sẽ Về đâu Ở đâu con cũng sẽ khổ về đêm khuya chuyện kể ba nghe đến giao thừa phố Bến Tre đêm nay mình sẽ ăn bánh chưng rán cùng với cả du hành muối và giò gà tiến vua mỗi cái giò này là hôm nọ tình cờ mình biết được rằng mình đặc biệt ăn thử cái giò gà này là làm từ gà Đông Tảo của Hưng Yên cho mọi người kiểu nghe cái tên thôi đã thấy làm ăn vào là mình cũng sang đến mấy phần rồi mình sẽ chấm cùng với cả nước mắm ớt ăn thử cái giò này trước đi nha Tại tò mò ý điện thoại thấy nó rất là thơm luôn bạn ạ Sau này có lẫn cả nấm nữa nhưng mà cảm nhận rất rõ với chị gà luôn nhé tưởng nó đậm đà này xong nó giòn nó ngọt nó có cái nút này của gió mọi người ngủ ngon nhé Mọi người cảm giác nó biết là nó nặng miệng rất là gần gũi luôn đấy chắc mình phải làm thêm mấy cây nữa để Tết mang lại khách rồi mất cái giò gà chiên muối xong vừa tiếp tục nữa Cái loại đúng kiểu vừa truyền thống nhưng mà vừa hiện đại đúng chuẩn là rất ngon lại khách rồi đấy Mọi người xem video của mình hẹn với đầu sau tạm biệt
7255941113726321666,7459253252522036498,Xin chào mọi người hôm nay của mẹ đối diện với mình nha Thật sự là bận quá mọi người nên là cũng không biết quay gì đấy thế là thôi là một mẹ đồ chiên ăn trở lại trên này cũng hợp lý ha mà ăn đồ chiên Tất nhiên là không thể thiếu tương ớt được hôm nay mình sẽ chấm bằng tiếng Hàn ăn phô mai que giúp đi chắc là nó có con kéo sợi cơ bản mấy cái món chiên này mà không chấm cùng tương ớt Hà Nội khóa nó hợp với nhau cùng các bộ đồ hoàn hảo 10 điểm ăn nó cay nhưng mà nó say đắm mình sẽ có giáo viên này nem chua rán phô mai que bò viên hot dog xúc xích xiên thịt cá rô phi không để mình mới phát hiện ra ở đây thôi mọi người ạ nhưng mà ăn thử không có khẩu vị mình không tưởng luôn đấy Ăn cuốn nhá Đây là mọi người cũng thử xem nhé ngon cho mọi người xem video của mình hẹn đến nơi sau
7255941113726321666,7458998316089609479,Xin chào mọi người một trong những món mà không thể thiếu trong mâm cỗ Tết miền Bắc chính là nem rán bằng gạo nên là hôm nay ăn nem rán khổng lồ mình nha bạn nên dán thì mình sợ ngán nên mình sẽ uống cùng với cả trà ô long time mình thấy lần này có hai vị mới là ô long tim rất xanh với cả ô long kim rất cao nhiệt đới là từ cả hai luôn nha mình sẽ chồng cung Cấn là mình cuốn theo khẩu vị của gia đình nhà mình thôi xin mời to như chuột cắn vào miệng luôn đấy Chuẩn ăn nem nhà đấy ngủ 65 km/h ô long xanh này thì có màu nước tươi mát nhà nước trà mới pha với mọi người xong lại có vị chua chua nhẹ nhẹ của chanh nữa Nói chung là sự kết hợp giữa trà ô long này với cải xanh sau đó cực kỳ sáng quá bởi vì phát sinh luôn ấy ăn xong cái này chắc là no luôn mọi người ngon mọi người ạ kiểm tra từ chiết xuất từ trái cây thật đấy là khi uống sẽ cảm nhận rõ được độ thơm cũng là độ tươi mát ấy có vị ngọt tự nhiên từ trái cây ngon thế uống loại thế này mà ăn mấy món đồ Tết là quá chuẩn bài luôn này Mình thấy hai vị mới của Team Plus rất hợp để ăn chung với các loại bánh mứt đồ ăn mùa tết như là bánh chưng chiên thịt kho tàu thịt kho đông hay là xôi nó cũng rất là hợp luôn ấy ăn một cái là cũng no no Tết nhẹ dán dây cùng trà ô long tia chớp mấy thùng ở nhà để không xảy ra tình huống mà còn đem ra chỗ khác nha mọi người ơi cảm ơn mọi người xem video của mình hẹn ở video sau tạm biệt
7255941113726321666,7458627206864981256,nay mình có đồ ăn của con son cho những ai chưa biết thì Bon sau là thương hiệu nào dài Hàn Quốc nổi tiếng toàn cầu và được mệnh danh là cánh gà ngon nhất với nhiều chi nhánh toàn quốc ở đây thì mình thấy nổi tiếng nhất với cả gà rán sốt thủ công dưới thời tiết ở phần da gà nên là mình gõ order Combo 3 vị khác nhau để ăn thử ngoài ra thì nhìn rõ được tình cảm của bò với cả tấm gương chả cá nữa Bây giờ tôi ăn nha Cái này nghĩa là gà rán sốt tỏi giòn Này còn cái này là gà rán sốt tương tỏi Còn cái này là gà rán sốt cay ăn từ xúc tương tỏi sẽ đi chị mở chuột cắn một miếng thôi nhưng mà cảm giác là lớp vỏ nó mỏng mà nó siêu giòn nghe đã tai luôn Mọi người ạ thì bên trong thì mềm mại nhé bên ngoài của lớp da gà nó có cùng lớp sốt ăn khá đậm vị ấy mình không được về nhà nó giòn lắm rồi đấy nhé bên ngoài cái thùng của lớp tỏi giòn luôn mà mình thấy gà của con trai được quét suốt bên
7255941113726321666,7458255996209909010,tiếp tục cùng mình trải nghiệm các loại trà sữa thay vì đang hot nhất gần đây nha hôm nay thì mình có trà sữa của Lan Tràm ạ Cái điểm ấn tượng mà mình quyết định đặt trà sữa Ở đây là cái logo màu hồng trông rất là xinh mọi người Đúng cái màu mình thích luôn đấy ở đấy thì mình có gọi bốn vị best solo của quán đấy là 5 bông lan xanh lam thu và Lan trà Uống làm bông trước đi Cái này chính xác là trà sữa bông hoa mọi người cái này thì mình có gọi thêm Thạch Lam và đây là Thạch Lam nha Cái này nó thơm lắm luôn đấy Kiểu cảm giác cái mùi thơm nó Lan tỏa khắp miệng luôn Mọi người ạ Mà bị trào ra mềm mã hậu vệ tỉnh Quảng Trị Cái thằng nó kiểu thơm Cho nó thanh thanh ấy mọi người tiếp theo mình sẽ uống sang Lang xanh cái này tên chính xác sẽ là trà sữa kem chanh mọi người đây cũng là đầu tiên mình uống trà sữa mà còn có kem chanh như thế nào trên hay là mình sẽ thử cái phần kem chanh này nấu canh chanh nó kiểu rất là thơm luôn mọi người xong rồi Kiểu nó béo Mị liên kết tranh này ngon nhé tên lửa sẽ là cháu Long Kiếm tranh với cả 65 cỗ lăng kết hợp với các em xem mọi người tươi mát Xong rồi nó thơm bị hạ Nam Trà nhá kiểu nó rất là mới lạ luôn mà cái trân châu cũng ngon cơ kiểu dai dai dẻo xong rồi thơm tiếp theo sẽ là lang thu mọi người cái này chính xác là trà sữa kem cốm dẹp cái này là kem cốm dẻo thử cái phần kem của mèo này trước nhá xong rồi cho vào trà sữa cảm thấy rất là cốm tươi luôn cái nào dưới đây vẫn là trà ô long Kiểu cái kem cùng lúc nào trong kết hợp với trà ô long nhé nghe thì có vẻ kiểu không liên quan lắm đâu nhưng mà uống Thấy hợp lý lắm mới ngon đấy Mọi người ạ thật sự là ở đây nhiều vị trà sữa lạ mà kiểu Lần đầu tiên mình uống thấy nó ngon nha Cuối cùng thì mình sẽ uống Lan Chàng Cái này là hồng trà mình cũng có gọi thêm một phần trân châu đen dẻo nữa kiểu vị Trà nó rất là êm luôn Nó rất là thanh nữa Cái này nó như kiểu là cái dòng trà thôi nhưng mà ngon Thơm sau khi mình trải nghiệm bốn loại trà sữa uống làm chả 10 thì bị ấn tượng ở đây 72 Điều đầu tiên là rất là thơm luôn Mọi người kiểm tra kết hợp với cả hương hoa xong kiểu thơm nhẹ nhàng rất là sang nhá và thứ hai đấy là Thanh đây Hình như là dòng trà thanh thuộc địa vị nên là không có cảm giác mất ngủ là sẽ phù hợp với đa số là mọi người ai cũng có thể uống được và đặc biệt là những người uống trà và dễ mất ngủ như mình thì đây Đúng là lựa chọn quá hợp lý luôn rồi Nói chung là ngon bạn nên đáng liên tục đặc biệt lần này làm chả đang có chương trình combo bánh sữa chỉ 65 cành giảm 10% thì mọi người check in like và Follow fanpage comment feedback ngay dưới post check in đánh giá 5 sao Khi nào mọi người cũng thử trải nghiệm xem nha Cảm ơn người xem video của mình sau tạm biệt
7255941113726321666,7457889129666186504,Xin chào mọi người Hôm nay mình có bánh kẹo Tuổi Thơ mọi người cùng với nhau phần này nó chỉ là một phần thôi mọi người ạ Còn rất là nhiều loại nữa nhưng mà mình không tìm thấy đầu tiên mình sẽ ăn mày chú hề chú đánh anh ngày trước khi nhà mình hay là chỉ có chết thôi mọi người thế này nó sẽ có mặt trời ở trên này như thế này này Đấy hai mặt mày là gì kiểu làm bánh quy xong ở trong có kem thôi xin mời Cái này là vị socola này có gói bánh như thế này mà màu hồng nhuộm màu xanh lá cây nữa rồi Tiếp theo sẽ là kẹo cao su hình quả nhất kiểm tra kết quả xổ số Ngọc Minh cái thằng bạn nó đi gọi là bảo kê còn ga to gọi bảo trước đi hai quả cầu này hình như là hai loại đồ ăn vặt mà rẻ nhất là nhỏ có nghĩa là kiểu nó có nhiều mức giá để mua hai cái bảo mật này là được nhiều nhất là rẻ nhất để ăn được nhiều ấy Cái này thì chắc là mình lại bảo kê nhưng không phải như không phải là bằng cây xăng nó vẫn là gạo hay sao ấy tiếp theo sẽ là kẹo sữa mẹ nó chậm dẻo thơm thơm anh Bảo Ngọc Cuối cùng là cái này con này mới có không Cái này trong nhà mình gọi là gì ta cái gì cô ấy mình quên tên rồi nhưng mà mình rất thích ăn màu tím nhé nó có một cái màu tím hay không phải màu tím còn có cái màu tím thơm lắm luôn ý ăn kiểu nóng
7255941113726321666,7457883527586123026,Xin chào mọi người hôm nay mình sẽ ăn nem chua Thanh Hóa mời mọi người cùng mình nhé đây chính xác là lại chuyên mục nhà có gì thì qua đấy mà tận dụng cái này mới làm thêm quả núi mọi người Hôm trước mình ăn một lần thì em là đem quà nhưng mà tại sao mình lại lên quả núi đây mới chính xác là nhân quả núi nhá Nó có cái hình trụ tam giác trong tiếng Anh này thì sẽ không có tốt đâu mà chỉ có lá sung ăn kèm Thôi kiểu này không cay mà không chán là mình nghỉ Tết ngoài là bánh kẹo để kiểu đẹp bằng cách để đón khách ra thì sẽ có tôm khô và lúc nào cũng sẽ để ở trên cái bàn khách để mọi người để nó có thể ăn được luôn đấy là một trong video của mình hay ở video sau
7255941113726321666,7457514810075401480,Tại lỡ xem được mấy anh chị ăn Hết Trông ngon mê quá trời luôn phải tìm cách order về được một người biết không Cái này mình order với anh tự đi Thái là phải đợi mấy đợt mới sinh về được luôn đấy Đây là món khó mua nhất từ trước giờ mình từng đạt luôn bởi vì mỗi ngày ở đấy thì cho đúng 100m mặn thôi có mùi hun khói hậu bị sẽ ngọt nhẹ cái tiếp theo của
