author_id,video_id,video_transcription
6611029964165070850,7355858130519002369,sáng sớm có tới Vũng Tàu Tất nhiên pha bánh khọt rồi đó Tôi hay ăn thì nay đông quá đi cho nên tôi ghé lại bánh khọt cô hai chỗ này tôi cũng ăn được vài lần rồi Ở đây thì có một cái chậu bánh nè nhưng mà cái cô này làm cũng nhanh lắm thì cũng giòn lắm nhiều cho nên tôi thấy có hơi bị ngán một xíu đu đủ ngâm với lại nước mắm cái này cực kì ngon cái bánh bông lan nè Tôi rất thích ăn bánh bông lan ở đây lần nào cũng nói mấy chị đổ nóng ăn liền hết trơn mà lúc nào cũng phải xách mấy cái bánh nó vô cà phê hết trơn kiểu vừa ăn bánh tráng miệng cảm giác rất là vui bánh chỗ này thơm lắm mà không có bị khô nữa xong thì về nhận phòng nghỉ ngơi xíu mà chỗ này hầu như lần nào ra Vũng Tàu chỗ mở hết trơn á xong đi Trà này ngủ xíu đi Dậy đi kiếm gì ăn nè mẹ lòng vòng không biết đi đâu hết trơn Thôi thì lên núi Vi Ba thăm bạn xong rồi Ăn trứng lòng đào với lại trứng lòng đào Cái này ngon lắm lần nào ra cũng ăn đó Ăn xong thì tôi sẽ đi hẹn hò với lại một người Và người đó sẽ là hoàn thuế tôi thì hoàng hôn bao giờ cũng thật là đẹp và có người nói ngắm hoàng hôn cũng là một cách để tự chữa lành không ăn cái gì hết thì cũng hơi buồn miệng đúng không nên đẩy nhẹ nhàng thấy phá lấu với lại cúp nước của anh này cũng ở Vũng Tàu không biết ăn lẩu cá đuối ở đâu chú ý tôi cô hồng vẫn mãi là chân ái luôn á nước lẩu có vị chua đậm đà cá tươi mềm và ngon lắm cũng không có chuyện gì tâm này kia đâu nha Ăn xong ra biển không gió xíu rồi ăn đậu hũ non nước cốt dừa này biết của tôi rồi đó cây kem đó về phòng ngủ nè
6611029964165070850,7355711969988496641,nhìn hai màu đỏ xanh tưởng chừng là đối lập nhau nhưng mà nó rất là hài hòa về hương vị luôn trong quá trình thanh mai này sẽ có viên Thanh Mai dẻo phim thanh mai phô mai thanh mai thật trân châu Mã Thầy thạch dừa cũng đầy nước chan từ trái thanh mai thì chua ngọt thanh mát trân châu Mã Thầy kiểu như bên trong có củ năng cho nên ăn rất là lạ miệng và ngon luôn mà thích nhất có đặc có bị âm thanh mai phô mai này nha bánh nếp đậu đỏ này ăn bị dẻo Bùi lắm cha này thơm mà không có bị quá ngọt nữa có viên hoa dạng matcha Thạch matcha trân châu Mở thầy thạch dừa cùng với lại đậu đỏ nữa Bạn ngồi đây ăn xin đừng đốt cháy túi còn đem về có tô họa tiết cho con công rất là dễ thương có món trà sữa matcha đậu đỏ với đầy trà thanh mai cái Trà này uống vị chua chua rất là thích luôn Nhìn cũng đẹp nữa trang Huy có rất nhiều chi nhánh nhưng mình thấy ghét nhất với lại cái chỗ này với quận 6
6611029964165070850,7355451494075845905,buổi tối ở Sài Gòn đổi mới tìm được một chỗ sữa đậu nành mày ngồi chơi như này là hơi bị khó đó một ngày là 200 Yên là tôi bán từ 5 giờ chiều có 10 giờ tối thôi ạ tưởng có bạn này nấu rất là thơm luôn cho nên buổi tối mới tầm 7 :
6611029964165070850,7354970186216246544,nói bán đảo kim cương này uống mắc tiền lắm Giờ này vừa ăn vừa có nhạc giao tiếp thôi mà đâu có bao nhiêu tự dưng nghe bài này xong có bị buồn ngang luôn đó nhạc cá chim nướng là 355 cành cho vui vẻ xíu hà có phủ lớp muối ớt ăn cay cay đã lắm thịt cá có giữ được độ mềm và ẩm không hề bị khô cuốn với lại rau bánh tráng chấm mắm nêm này bớt độ mặn xíu nữa thôi là cực kì ngon luôn á Còn cái gà tre cơm lam là 30030 nghìn xác mà còn mọng nước nữa da gà là siêu giòn chấm này muốn sao nó hơi bị đỉnh luôn cơm lam không Vẫn dẻo mềm còn rất là thơm nữa cuối cùng là mẹ hải sản 339 cành tôm càng nướng phô mai chà là 7 km thì phải nói là rất tươi luôn á ốc hương sốt hoàng kim cái số này béo dính chấm bánh mì quá đỉnh ốc hương phải nói là cực kỳ tươi ăn giòn sần sật đã lắm cuối cùng rồi nghêu hấp sả ăn cũng rất là ngọt thịt luôn đó đồ ăn ngon view mất mẹ cái này còn chi nữa mà lúc tính tiền cứ mạnh dạn nói ăn cùng dầu chú được biết 204 Còn đây là mặt bờ sông nha
6611029964165070850,7354709161361378576,gân bò và đem ngâm xả tác chấm Cái này muốn xanh thì quá là gì Cuối cùng mà lẩu cá đuối mà thịt cá nó còn Tôi học nước lẩu tôi bị chua cay rất là dễ ăn lẩu này 169 cành mà cá nó hơi bị nhiều nha đặc biệt thịt cá rất là mềm mà cũng không có bị khai gì đâu lẩu cá đuối là phải cá tươi đem ra cho tự thả về nè thì mới ngon chứ mẹ nấu Sẵn đem ra là không có còn ngon nữa đâu thì gan cá đuối để vào bạn nhớ lấy ra liền Cái này tôi để hơi lâu lấy chỗ này buổi tối hơi bị đau luôn á ai thức có thể thử nè
6611029964165070850,7354335589409312001,nghĩ sao cái lẩu cua 195 Cà Mau tới vậy mà tới giờ không bạn tôi mới Chỉ dẫn đi ăn nè cua biển là bơi lội trong hồ luôn nha Cái nồi nước lẩu này thôi là thấy đậm đà rồi đó trước khi ăn lẩu thì cũng nhẹ nhàng với vài món khác trước cái đã Đầu tiên là hàu nướng phô mai mà phô mai nhiều cỡ này thì làm sao mà không ngon cho được cái đó xào lâu mỡ hành xào bây giờ không có to mà được cái là tươi xong thì nghêu hấp thái mình yêu này nó hơi bị ngọt thịt luôn sốt chanh dây tên là chiên giòn rụm huyện cùng với sốt thì bị chua ngọt rất là đậm đà bánh bao chiên cũng ngon lắm Còn cái này là ba rọi muối chiên cũng rất là giòn chấm với lại sốt men cũng khá ổn áp được trứng để thêm cái gọi củ hũ dừa mà tôm thật là hơi bị nhiều luôn đổi nếu bạn chung với nước mắm là đúng bài củ hũ dừa giờ Ngọ khỏi chê cuối cùng cái lẩu cua đồng quá trời tới bên luôn Còn cua biển là gọi thêm đó ăn kèm thì có bầu mướp là mùng tơi nha bên ngoài cua ra có cả tôm mực đậu hũ với lại chả cá nữa Lẩu này ngọt cua mà đậm đà lắm luôn á mà đỏ đen su quá Tao đẩy nhẹ vài cái trứng lộn nè Nhìn vậy thôi chứ mà nhiều lắm bốn đứa ăn cũng được luôn á đặc biệt mai cua đồng ở đây được rồi thịt vào bên trong ăn đã có hải sản là tôm mực cũng rất là tươi luôn á cua biển thì tươi khỏi nói rồi mà lại chắc thịt nữa không có gì bỏ gì hết trơn á hải sản Mày chấm với lại muốn xanh thì cực kỳ dính dán đây cũng rộng rãi thoáng mát lắm vải này lẩu cua cây me
6611029964165070850,7353965350179835137,tấm hình luôn cảm thấy cực kỳ chiều đó còn đồ ăn thì để thử trước vài món coi sao nha đầu tiên đi theo thì cái dĩa salad này nè Cái sốt hay bị chua ngọt rất là dễ ăn còn đường ống thì mềm khỏi nói chấm Cái này nước mắm chứ đậm đà hơn nè Cái đó là bún gạo xào bên trong ngoài hải sản rang có cải trứng với lại trả nữa xong thì nhẹ nhàng đẩy thêm bò nhúng ớt hiểm ốp bên trong là hơi bị nhiều luôn nhưng mà cũng không có bị quá cay đâu nha Thịt bò thì tôi trong hầm đường sắt rất là dày dặn luôn rau ăn kèm là cải xanh nước này bị chua cay mình rất là thơm và luôn nhớ nó nhúng thịt bò vừa chín thôi nha để lâu sẽ hơi bị dai ông Giang ở đây có đến tận 2 lầu mà view ban công rất là thoáng mát một là chứa được 40 người còn lầu hai là tận 60 người luôn rất là thích hợp để tổ chức sinh nhật hoặc là bạn có thể ngồi ngoài trời cũng rất là vui và ở đây là Đỉnh Phong quán Hai nha
6611029964165070850,7353856595073174800,ngao Hai còi hấp Thái mà Nga là không phải dạng nhỏ gì đâu nha Ăn ở đây được cái là ốc có bị gì cứ báo sẽ được đổi nhiều khi nó không tính tiền luôn á ngày thứ ba thứ tư là được tặng ba na có ta luôn nha đừng có nước sữa gạo đào cái này trà táo đỏ uống Ok lắm nè buổi tối mới ngồi ở đây là hơi bị mát luôn và ở đây là ốc Xịn nha
6611029964165070850,7353596316276083985,Bảo đảm là ăn là sẽ quay lại giống như vậy là khách của tôi đa số là thích ăn bánh tráng phơi sương Quận 7 này ít chỗ bán bánh tráng phơi sương lắm hầu như là không có có luôn cho nên là khách nào ở quận 7 là biết tới cái tiệm bánh tráng này là đường tới đây luôn bánh tráng bên mình nó sẽ là cái bánh tráng phơi sương được nhập từ Củ Chi cho nên là bánh nó rất là ngon luôn bánh dẻo mới mỗi ngày bên mình là bán một ngày là một 200 phần cái phần bánh tráng muối béo không đứa béo ở bên mình là 14 nhà làm nha trứng muối nhà làm ra mấy cái sốt ở bên mình đều là nhà làm hết ghé bên mình là chế Quảng Ngãi nó sẽ có dừa tai heo vừa da heo đây là muối tiêu và làm thơm lắm chủ yếu là bên mình trộn như vậy để cho nó giữ nguyên cái vị trí nó không có phải bị dính nhiều nước lúc này là bạn đang chọn 6 chấm bánh tráng đơn giản là muối sa tế là tắt thôi nhưng mà chấm hơi bị dính mấy bạn giới thiệu từ nãy tới giờ món này cũng khóa hết trơn cho nên tôi gọi thử luôn mỗi thứ một ít bánh tráng tóp mỡ hộp gì có 30 cạnh mà top mở ra siêu giòn luôn bánh tráng có rất là dẻo nữa có hộp chế này 60kg chả nem chả bò nem chua rồi cả trứng cút nữa ăn chay chắc ngon lắm không có bị pha bột quá nhé vị tròn có rất là vừa vặn Và đây là cái sốt chấm muối béo và bạn rất là tự hào nè Trời ơi ngon lắm luôn á Đang có 6 trứng muối sốt sa tế với lại sốt thái đâu được 20.000 đ có sẵn trứng cút xào bánh tráng với đầy đủ số chấm Ngoài ra có cái dàn bánh tráng vô bịch sẵn vậy nè Và đây là Nguyên bánh tráng Nha
6611029964165070850,7353485512964852993,khác với những chỗ khác là bên mình có luôn sức mạnh nha các bạn gọi là sốt Lucky nha sốt nướng BBQ lắc kêu cái này sẽ là shop mắm bơ tỏi nha Sao cái này là sốt tương ngọt nha Ở trong đây là có thêm mè nha các bạn nha có thêm mè nữa không cho sản phẩm này đều ăn đều có mẹ hết nhưng mà riêng nước sốt này là được trộn nè chung như vậy nha có bốn loại truyền thống BBQ bơ tỏi cái này rong biển mỗi cái gì có 15 cành À cái này là món bánh gạo cuộn phô mai nha Hay ghê phô mai tan chảy ra sau đó cuộn tokbokki rồi đuối sữa đặc bột phô mai lên nữa nè bánh gạo chiên này ăn giòn ngon nha bên ngoài thấm đẫm sốt ăn hơi bị dính có bánh phô mai này 30 cành ăn dẻo lắm mà thơm phô mai cực kỳ luôn nha Tôi thấy cái món này chắc là sẽ hơi bị hot Ai thích thì que thử nè
6611029964165070850,7353224737687964945,con lươn ngỗng nó đem chấm với lại sốt chanh dây vị chua béo dính lắm luôn á cái tép trứng sốt Thái cái món này ăn khoái ăn cay thì thích lắm nhỉ Có cơm chiên heo giòn cơm thì tôi dám thịt chiên giòn rụm luôn là xôi xoài xôi Nó dẻo mềm rồi mà xoài ngọt lịm đi trà tắc 16 ngày mà đi to đùng lấy chỗ được lòng nhiều người này là quán Thái Lan hay biệt có thêm chi nhánh quận 9 chuẩn bị khai trương
6611029964165070850,7353114390389984528,hàu nướng phô mai thì béo dính cực kỳ Đợi nãy giờ thì nồi lẩu đã sôi rồi nè không nghỉ trưa được 200.000 đ Ăn tôm hùm cua đồ luôn á trời cua này ăn cũng được đó má không có bị bỏ gì hết trơn á Ở như đem ra là có không tươi thì cứ mạnh dạn mà nói đừng im im nha ăn xong rồi bày đặt chu đáo đưa rau câu cho tráng miệng đâu nữa chứ long nhãn có thể chơi cái bể cái này chứ không phải Ly bình thường đâu mà có 40 cạnh ai mà thấy khoái quá thì cứ quẹo thử nha
6611029964165070850,7352848601367727377,đặc biệt là mới có thêm mấy cái món nướng mà có từ 29 cạnh và nước ngoài luôn nha bạn có thể tự nướng hoặc là nhờ mấy bạn nhân viên nướng dùm cũng được luôn á Cái này không có bị đắng nằm theo tôi dày dặn chấm kèm với lời chào đúng bài nhìn thấy cái món ốc hương sốt trứng muối này giống như là thời của tôi đã tới luôn rồi đó ốc thì giòn sần sật thêm với 6 trứng muối thơm béo ngậy Nhớ là phải chấm kèm cái này bánh mì nha Ngon xuất sắc luôn á sò huyết cháy tỏi món này là cho ngái cho những ai mê tỏi phi với lại tóp mỡ nha mặc dù không có quá to nhưng mà được cái là tôi cái này không có gì khác bên trong mà sao nó kêu người tới như vậy Ăn vô cảm giác rất là ngọt và ngon luôn còn trái nào nướng trứng thì có 10 cạnh nào mà bên trong Hà nào cũng hơi bị nhiều luôn á được trứng đẩy thêm sò dương nướng mỡ hành Nhớ là phải chai nước mắm vô chỗ này hình như là món nào ăn cũng thấy rất ổn áp luôn á đặc biệt chỉ có duy nhất alo quán có phòng VIP tại khu phố ẩm thực Vĩnh Khánh giờ thì ngại gì nữa mà không hiểu thử alo nè
6611029964165070850,7352481834212658448,trà sữa chuyện ở đây không nhưng mà lại có rồi từ nến qua tới trang trí rồi được free hết thì không có lý do để chối từ hết trơn á Không những chỉnh chu mà còn đẹp mắt nữa đầu tiên là sắp taxi dùng Thanh mà thơm mùi tàu bè cái trứng lòng đào này tôi nghĩ mà ngon nha hoặc là súp kem tôm hùm ăn chung với lại bánh mì nướng bơ tỏi bị béo Thơm ăn rất là thích luôn á Cái đó là mì Ý tôm dầm vào cua Tuyết hay mì Ý sốt kem làm tới nay thử đội ngu tưởng không thích Ai ngờ lại thích không tưởng vì Tommy chua mà thơm mùi Red là lá chanh lắm thịt cua Tuyết cũng chắc lắm không có bỏ đâu nha cho đến sò điệp nhật sốt miso sò này phải nói là hơi bị to luôn á Vậy thì ngọt mà giòn ngon lắm xong thì đẩy thêm cá hồi áp chảo lớp da thì giòn thịt vẫn giữ được độ ẩm mềm không hề bị khô luôn Đà đẩy thêm bò wagyu sốt tiêu đen xù cái tôi quên dặn độ chín nhưng mà Bò nó rất là mềm nha để heo thì hơn tôi có gọi phần salad bò nướng còn cái hoành thánh chiên này là được tặng Xong rồi đến Ngọt Ngào Hơn Tất nhiên là phải có tráng miệng siêu thích cái bánh xe khác à nha vị thơm béo cực kì ngon luôn á còn ai mà thích trong đắng có ngọt thì cho má thì chocolate Lava này nè và cái chỗ mà có không gian yên tĩnh nhẹ nhàng lãng mạn mà ấm cúng này là nhà hàng mát Venus
6611029964165070850,7352371704884153617,cho nước dùng bạn có thể chọn sợi mì tươi mì gói hủ tiếu gọi là bún sườn cay Thái nhìn có mà đen quá nè nghe đâu cũng được đọc rất là nhiều người luôn sai với lại Nam tâm là
6611029964165070850,7352114302926474512,Thật sự lúc bạn này Nướng thịt mùi thơm tỏi lên tới đó là ngào ngạt luôn á và đây cũng là cái lần đầu tiên mà mình được biết tới cái món xôi thịt nướng này luôn á cái món xôi yêu thích của mình ở đây cũng có luôn đó là sao thật khó ở đây cũng hạt dẻ lắm có từ 25 toàn bộ với cái tóc bên này ở đây là bạn tự làm hết trơn luôn á sáng làm tô soi về là thấy no cả ngày tại vì nhiều dữ lắm luôn từ khóa là cái trứng ốp đào này nè Nhìn mà đem thật sự luôn á Trời cực kỳ ngon mà mình luôn còn cái xôi thịt kho thì thịt ba rọi rút sườn được hầm rất là mềm luôn đó hạt xôi của rất là dẻo ăn kèm với lại ba tê chảy mỡ ngon lắm hiện tại cứ phần sau là tặng cho Ly sâm bông cúc hạt chia mình cực kỳ thích cái không gian mang nét hoài niệm này kiểu là một khu vườn xanh mát có rất nhiều món đồ xưa cũ và ở đây là tiệm xôi xù xèo nha
6611029964165070850,7352000822022049041,thật sự là ở đây có rất nhiều món luôn nhưng mà tụi mình chỉ có thể thử mọi thứ một ít thôi đầu tiên là hầu 7 vị nào là tiêu xanh mỡ hành sa tế phô mai hà là tô mất rồi cho nên ăn đã cái đó là chân Ái của tôi sò điệp nướng phô mai cái món này bao giờ cũng là ngon nghêu hấp Thái thối thì có 30 cặp hơn 6 trứng muối có 6 cái đậm đà mà béo ngon lắm Hương thì giòn sần sật chấm kèm là cái xấu thế này hơi bị dính để chắc bụng hơn có mì xào ốc móng tay mà có 40 cũng được làm sạch ruột hết trơn rồi lót nướng tiêu xanh cái này ăn thơm nồng đã lắm bulot cũng mềm nó không có bị quá da chấn động đó là nguyên cái nồi lẩu tôm càng dày có 149000 nào chua cay tôi cũng hơi bị to luôn buổi tối bạn có thể ngồi trong nhà gọi là ngoài trời cũng rất là mát và đây là ốc ngon 7 vị
6611029964165070850,7351738025707162881,
6611029964165070850,7351631371334323457,đây là bò bắp hoa tươi đường hầm dưới 20 loại thảo mộc của người qua đó chị cái này được mua hoàn toàn từ nước dừa tươi Bến Tre nước sốt bò có phụ thuộc vào độ ngọt của vườn dừa bữa đó là nhiều hay là ít nha Cái này là sốt chanh dây Hoàng Kim Cái này là số ít sim đó chị cái nào số ốc Ngọc Tứ Xuyên là sốt me Tô Kim Bảng đó chị mà mấy cái shop cách làm chung với lại bánh tráng Phúc Tiến là Quảng Đông Tôi thấy cũng đậm đà và ngon hết trơn á cái đầu bé của nước sốt này không phải là từ dầu ăn mà là từ mỡ bò bắp hoa là mềm ngon Khỏi chê ngon hơn nữa rồi ăn chung với lại mấy cái viên xíu mại bò nướng món này bạn có thể ăn chung với lại xôi cơm bánh tráng mì trộn hay là bánh mì gì cũng được hết cái ổ bánh mì bò xíu mại này nó ngon tới mức mà tôi không biết tả cái đường nào luôn á mì trộn bình thường đã ngon rồi mà giờ có thịt xíu mại để cho bà ngoại kêu luôn nhớ là phải Trang cái nước sốt bò vô tinh túy Nằm hết tới đó luôn đó nha Còn ai bánh tráng chấm là đúng hệ tại vì quá trời là shop luôn shop oxi mà trộn chung với lại mấy cái topping nhưng mà làm sao qua được cái shop bơ béo này thân ái của tôi là đây nè Ngoài mấy cái món này ra ở đây có thêm cả nước sâm trà sữa này trà chanh trà sữa là hơi bị ngon luôn á và ở đây là bò 5 phút kiến nha
6611029964165070850,7351366730591014146,tương ớt nó lại sa tế này hơi bị đỉnh luôn á mà tới đây tất nhiên phải ăn cảo chiên ngon bên trong ra ngập tràn luôn nhớ là phải chấm Cái này tôi xí muội nha Ngon xuất sắc luôn á cái này một mình tôi ăn 2 dĩa nó cũng còn được còn ai mà khoái xí quách là có luôn một tô Bây giờ là hai cục to đùng luôn đó thật là hơi bị nhiều nha chứ không phải là xương không đâu cũng mềm đó không có bị khô gì hết trơn á Pha thêm tí nước chấm chan vô là siêu dính nha còn nước thì có mía dâu uống cũng lạ mà ngon chỗ này lần nào vào ban cũng là đông chấn động hết trơn á rồi Hà Tôn Quyền chỗ nào bị vàng được nguyên giả đã biết ngọc ý rồi đó
6611029964165070850,7350993772131486977,được trộn cùng với lại khế với chuối chát vị chua ngọt rất là hài hòa luôn em cún cùng cái này ra bánh tráng chấm với cái mắm nêm Đây nè tôi nói chứ xuất sắc nha Còn không thì bạn có thể ăn kèm đó là bánh phồng cũng khá là ổn cuối cùng là cái nồi lẩu này 180 kg là tết là dùng đuôi bò lá sách nhân viên thịt vậy đủ thứ hết trơn á nước lẩu theo kiểu Vị Thanh và ngọt mấy cái đuôi cái này gần đây được hầm mềm tan không bò ở đây đặc biệt khác với mấy chỗ kia là không có khoai môn với lại đậu hủ bán lẩu bò Tất nhiên là phải chấm lại trao cháo đây pha rất ngon lắm đặc biệt nay ngoài cái lẩu bò tiêu hóa thì ra còn có thiên Can Lộc Thái nữa giờ tôi không có nói đây là lẩu bò cô Tư đâu nha
6611029964165070850,7350887575869017346,Cái đó nó hào nướng tráng phô mai Nó kiểu như ngập tràn luôn đó là hàu sốt Thái ăn vào vị chua cay của rất là đã trở lại thêm cái mực một nắng nướng muối ớt sốt là thấm đẫm rồi cho nên ăn vào dính lắm giò heo muối chiên giòn cái lớp da này giòn rụm luôn á Nhưng mà thích nhất là cái món sụn gà rang muối đây nè sụn gà giòn thì không nói mà cái lớp muối phủ bên ngoài không biết sao mà ngon ghê á cuối cùng Mà lẩu Thái Tom Yum nói là hai người chứ Cái này chứ Facebook thả lẩu tôm mực Nói chung là hơi bị nhiều loại bạn ở đây nó có sinh nhật là bạn sẽ được tặng nến vàng ở đây kiểu là sân thượng mà ngay bờ kè đó cho nên gió thổi lồng lộng mát lắm mà ở đây hai chi nhánh nào nếu bạn thích thử nha
6611029964165070850,7350624105651047681,vị ngọt thanh cây ấm của gừng kết hợp với lại hương thơm của thảo mộc bạn nào mà thích ăn thanh đạm Lẩu này đúng nghĩa để chân ái luôn á thực vật ở đây mặc dù đã được hầm Nhưng mà không phải dạng mềm tan mà là còn giữ được có độ dai dai có món tôm sốt Mala có rất là ngon rồi chiên giòn thấm đẫm nước sốt thơm nồng bên ngoài bánh thành chiên có 35 cạnh nào mà được chiên giòn lên chấm kèm với lại tương ớt nè đặc biệt là có được món cơm thịt kho đài khác biệt của thịt kho đài là thịt sẽ được thái nhỏ và lên giường ra món này nhìn vậy thôi chứ mày ăn cũng cuốn lắm á bất ngờ nhất là trà sữa đây rất là ngon luôn trân châu dạng mini mà mềm dẻo lắm Soda uống cũng được lắm đó không gian ở đây thì ấm cúng nhẹ nhàng và yên tĩnh
6611029964165070850,7350254529008504065,đậu ăn bên ngoài phải giòn bên trong phải ngại quá dạ khi ngay trung tâm quận 1 có mạng bún đậu to vậy có 120 cành à Đúng là không hổ danh đậu làng mơ bên ngoài giòn bên trong có độ mềm mại ngày Cực kì ngon luôn á Tại vì pha mắm tôm mà đường cát như một số nơi thì đây sử dụng đường nước sẽ giải hòa tan hoàn toàn mà anh Pha theo công thức gia truyền tham gia mọi người ăn sẽ có cảm giác không bị tanh nồng đâu mà nó rất là thơm và lớp vỏ bên ngoài giòn tan ngon lắm có mức lãi thì không cần phải bàn cốm thơm là đã ngon rồi thì bây giờ chấm Cái gì cũng thấy ngon miệng hết trơn á hơi bị đỉnh luôn ở bên ngoài giòn mà bên trong Không hề bị khô luôn Chuẩn bị đến quán anh sẽ không làm người thất vọng vì cực kỳ đậm đà ăn kèm với lại bún lá là quá dính luôn hay là món ăn tuổi thơ món ăn quả là hợp luôn rồi nếu như bạn đang muốn tìm hương vị Hà Nội cổ có thể quẹo bún đậu làng mơ
