author_id,video_id,video_transcription
6611029964165070850,7324652718407126274,sẵn trứng rồi tôi gọi thêm bớt khô bột khoai môn sáp màu mực với khoai môn là được chiên lên giòn rụm chấm kèm với lại tí tương ớt cuốn cực kỳ luôn á Cuối cùng thì đẩy nhẹ nhàng thêm cái nồi lẩu bắp bò nhúng mắm ruốc là phải thả thêm cái trứng gà này vô cho ngon Đừng nghe mắm ruốc nghĩa là hôi mặn này kia cái này vừa ăn mà thơm lắm bắp bò tươi mà đem mới nhún thì quá là đã mềm lắm không có bị chai ngồi ăn lẩu mà cái kiểu đường phố như vậy nè nhìn cũng chưa Kêu lắm chứ bộ đi kèm cái lẩu này có ra và bún nữa Chụp cái món ăn kiểu như là cứ bị cuốn cuốn sau chế độ ăn đã ngon rồi Mà thêm cái view ngắm xe lửa cực đã này ngại gì mà không quẹo 196 Phạm Văn Đồng đúng không Đặc biệt Cái đó là mở xuyên Tết luôn á
6611029964165070850,7324283667444944129,buffet có 139 ngành mà được ăn thả ga tôm càng xanh thả hồn mày like đếm xương xương là tầm hơn 44 đã vàng có nguyên cái dàn nhạc ăn thịt cho bạn tha hồ mà trêu nhau bạn không thích ăn tôm càng xanh tả Hồ thì có luôn mấy cái tâm sen sẵn nè rồi bò tản sườn heo ba rọi bò cười lúc nào cũng được trong khi trong trạng hết trơn á cho nên không có sợ nói chuyện mà lai cạn là hết món gì đâu nha hải sản ngoài tôm rang có cả râu Thuộc nữa tất cả mấy cái lạp xưởng xúc xích rồi sụn rồi đủ thứ nữa thì mấy món chế biến sẵn Mình thấy có cả bánh bao khoai tây kim bát nem chua rán và khoai tây đồ nữa và đặc biệt có tất cả trứng lộn ốc luộc nghêu rồi cánh gà chiên luôn á còn nói về bé cá sấu chấm thì cũng hơi bị đa dạng Mấy cái sốt phô mai trứng muối rồi tiêu xanh đâu là lấy thả ra luôn trong buffet ở đây có một máy tính càng không VT không phụ thu đầu tuần cuối tuần gì cũng chỉ một bài trước thì có nước ngọt nước cam trà sữa trân châu nhớ vui vẻ thêm 25 có trái cây bên đang có tang thì bất ngờ buffet có 139 cành mà được cái Bill ngồi hơi bị chi luôn á Cái này là tưởng nó đang trên Đà Lạt không Chứ bò mà đem chấm Cái này xóa phông Mai trứng muối thì quả là dính rồi cơm thì tôi khỏi nói chấm Cái này muốn sau này cực kỳ ba đội cái cuốn này mới ra sau đó chống lại cái số đỏ nó cũng ngon lắm nè phải nói kỳ này buffet đồ chơi chơi hơi bị lớn trang trí không gian này phải nói là cực kỳ chi luôn á có cái vụ hát nhạc Sau tết mà chỉ tối thứ bảy thôi nha Và đây là buffet đồ chơi Tân Phú
6611029964165070850,7323911883617012993,kem sôcôla thì đậm vị thì mới có bông lan mềm mịn Phải nói là quá đã luôn mới đến Ngọc Lan ga tô lớp bánh flan mịn béo kết hợp với làm bông lan xốp mềm và sự kết hợp quá hoàn hảo Bánh Kem Bắp thì có luôn nè Ăn không có bị quán rồi mà nó có thơm mùi bắp luôn cái Đến là chân Ái của tôi Tiramisu bánh này thì phải to lúc nào cũng là Mỹ ngon Cái đó là bánh matcha kem cheese mùi thơm nhẹ nhàng của matcha kết hợp với kim chi ăn hơi bị cuốn còn ai mà khoái cái bánh của Astro bên Thái thì đây cũng có luôn là vì socola cái lớp bánh mì mình thấy cũng khá là mềm mình không có bị khô Còn đây là hương vani vị kem khác là thơm cho mang thì mình thấy cũng không có thua gì bên Thái hết trơn á Có bánh bông lan trứng muối bánh sushi đồ nữa ăn dai dai thêm cứ lớp kem đều bên trong nó cũng khá là ngon nhưng ở đây có đa dạng các loại bánh mà cũng rất là hạt dẻ nữa nhưng mà chủ yếu sẽ là đem đi Cái này là bánh tươi hơn Bác không phụ gia không chất bảo quản Đây là khuôn khác
6611029964165070850,7323535090263313666,ngay giữa trung tâm quận 1 có chỗ bò nầm nướng ngon nếu như vậy mà tới giờ tôi mới biết con này trời Tuy là hào nướng phô mai Hào là cực kỳ tươi không có bị tanh gì đâu nha Mai kéo sợi là ngập tràn luôn đó mà mê phô mai kéo sợi như tôi thì gặp cái món này giống như tìm được chân ái cái món này tất nhiên sẽ là bánh mì lấy miếng bánh mì quết nhẹ một cái thôi tôi nói Trời ơi ngon chấn động luôn chấm chỗ nào hết trơn bên trong có rất nhiều tỏi và ớt luôn nha Cái đó là dính liền luôn Cái đó nó bò nằm nướng do là thịt quá tươi cho nên chị ướp đơn giản xíu muối tỏi với lại tiêu thôi Ăn cái món đó mà bạn để thật nhiều bơ vào sẽ rất là thơm nhớ là phải đặt thêm cái trứng vô nữa mới ngon với lại nằm heo ở đây chứ mặc thử nghiệm một miếng thôi là cảm nhận liền có độ tươi mềm của thịt bò là bạn có thể ăn kèm với bánh mì chấm vô cái lòng đỏ này béo dính cực kỳ luôn cái này miền Tây Mình gọi là 3 t đó trộn với sốt me ăn chỗ đã gì đâu và đặc biệt tôi khoái những món lẩu bò nhúng dấm ở đây là từ trái cây và nấu cùng với lại nước dừa cho nên có vị ngọt thấy hơi nhạt nhưng mà nấu càng lâu có nước sắc lại có vị rất là đậm đà và ngon luôn không có bị dầu mỡ mình khá thích luôn cho nên ăn vào có độ giòn sần sật rất là đã Thịt bò thì cũng rất là mềm không có vị dai gì hết trơn á mà để chắc bụng hơn bạn có thể để thêm gói mì vô ăn chung nè mà như nãy giờ món nào mà thấy con vừa miệng hết trơn á vải đây là bò nằm nướng Thảo Nguyên nha
6611029964165070850,7323428085280361730,Vậy phải đi Đài Loan mới được ăn mì bò tại Sài Gòn mình cũng có rồi nè tôi nói cho ngon chấn động luôn nha cũng chỉ từ 35₫ ở đây thì có rất là đa dạng loại ngoài mì bò Đài Loan ra có cả mì bò cay Tứ Xuyên rồi mì trộn mì bò cay Tứ Xuyên ăn vào nó thơm cay nồng đã Thịt bò thì mềm không có bị ra chấm với lại cái nước tương này cũng ngon tại vì ở đây thì có hai loại đó là mì trứng và mì Đài Loan hay là sợi mì Đài Loan cái mì này là phải có cải chua ăn kèm cái này là mì trộn bò nè Mình thấy cái sợi mì đài này ăn trộm khô nó sẽ ngon hơn sao trộn bữa nay rất đậm đà nha Nhớ gọi thêm chén bò viên nè bỏ ra chắc không có bị trộn bột nào để bột rất là nhiều luôn nước dùng theo kiểu ngọt xương mà thơm nhẹ mùi thảo mộc có khúc này mới 6:00 mà đông ghê Và đây là vua mì bò Đài Loan nha
6611029964165070850,7323168064936234242,chung cư Ấn Quang có tiệm mì Ý bít tết chiếu từ ba mấy cành mà tới giờ mình mới biết là chẳng hạn như cái dĩa mì Ý bò bằm phô mai này có 37 kg ở đây so với mấy chỗ khác Mình thấy hơi bị nhiều luôn có vị phô mai béo nó đã lắm Còn cái này là nuôi xào bò lúc lắc cái đậm đà bạn nào thích cũng có thể để tí tương ớt vô ăn cùng Nè đây có thể nói là cái máu mình cảm thấy thích nhất luôn đó cá hồi áp chảo sốt chanh giá hồi sau khi mày áp chảo lớp da giòn rụm luôn đó Phần thịt cá cũng không có bị quá trắng nhẹ với lại cái sốt chanh dây chua chua béo béo phần bít tết có 64 cành nè không bị dai đi kèm sẽ có bánh mì do là sốt tiêu cho nên có vị thơm nồng đã lắm 150 g bò mà 64 cành này quá Được luôn á Cái này có hơi quốc tí nhưng mà được cái ngon Cái này hạt dẻ lắm chang bàn ghế này cũng rất là rộng rãi và đây là biết xác không 15 nha
6611029964165070850,7323056832308579586,chị phải gửi từng viên từng viên một đó rồi sau đó thì chụp hai ba lần nước sôi thì nó mới sạch được đó Bây giờ thì bạn cũng đã nghe rồi đó toàn bộ mấy cái này là chị tự làm hết luôn chị có đến tận 2 loại ớt bột có hạt tên này ra chỉ có cái loại ớt bột Hàn nữa đi được lần rồi không thấy ngon cho nên là quay lại mua ăn bạn nào mà hay ăn gạo muối chắc không biết mấy cái chỗ nhậu này rồi cưới con gà chỉ free luôn cây xúc xích còn không là 15 cạnh cây xúc xích này ăn vào có độ mỏng nước khá là ngon mà chưa thử chỗ xúc xích đen quá nó chích ngừa Giáp này ông muốn nhậu nha
6611029964165070850,7322799082588622082,hẻm nha
6611029964165070850,7322426809260281089,hoặc là mề gà chiên rồi vòi sụn luôn nè có trong sữa đậu nành nhìn nhớ Đà Lạt nghĩ sao ăn cái lẩu 79 ngày mà ngồi máy lạnh mát mẹ như vậy Hèn chi cái chỗ lẩu gà lá é
6611029964165070850,7322055310535937282,Nhìn cái chỗ rau muống tốt bên lúc nào cũng run rẩy hàng chứ người ta đồ nghề hơn ngàn cái lẩu nó phải rồi tên mà còn bơi lội nhảy múa như vậy thì cái đội Tôi không phải bàn tới rồi đó thì không tin cái lẩu tận ba loại cá như vậy có 60 cạnh phải nó quá trời luôn cái này đi hai đứa vui vẻ đứa 30 càng được ba loại cá nó nghĩ ra được không Tôi không hề nha cá là tôi mềm ngon lắm đó dù lẩu cá 60 càng này cũng đến 22 tháng 1 sau đó cho nên tranh thủ mà quẹo nha tranh không có rất nhiều món khác kiểu là bò viên chiên mắm bò là da chắc không có bị pha bột này kia và cái chỗ lẩu cá Đông chấn động xếp hàng dài mỗi tối là cá 67 bên Lê Trung Nghĩa
6611029964165070850,7321685062456478978,trứng gà nướng ăn như một cái thôi để dính dở không ra tôi đã không nói rồi còn to múc rap nữa chứ nằm heo nướng mà đẹp chấm với lại sau đó thì quá là xuất sắc đã vàng có thêm em nướng tự làm nữa chứ thịt không luôn á Không có độ mở này kia đâu nha trái sầu đâu mỡ hành với lại đồ chua ăn kèm nữa nè còn mà lỡ Xu quá cũng có luôn trứng lộn xào me nha nó ngon lắm luôn á cháo này là được nấu bằng nước dừa tươi bên trong nó có luôn cái vừa nên là ngọt cái chỗ ngon chấn động này là nướng 78 nha
6611029964165070850,7321572491061660930,nhưng chấn động cái này tặng luôn cái xe ô tô đồng khi mua kèm trà nè Có 29 cạnh này nhân viên ở đây thì phải nói là quá nhiệt tình và dễ thương nào giờ uống trà chanh không à nay nghe có thêm trà sữa nên Sẵn tiện tôi đẩy luôn hai số đó là thái xanh nha cái đơn vị rất là thơm luôn khỏi nói sau này hơi bị nhiều nha Tôi nghĩ ba đối tượng lại uống cũng được cũng là li long nhãn 29 cạnh này bất ngờ thiệt luôn á ngày uống vào ngọt thanh thơm nhãn và thỏ nhẹ mùi lá dứa lúc nào tôi cũng thấy đông hết trơn á tao đẩy nhẹ thì cứ bạch tuột cây phô mai 9000 quá cô Mai thì kéo sợi dư chất lượng cả mét luôn mấy cái sổ đỏ này thì 59 cạnh nếu như bạn cũng thích trà chanh nhà ta
6611029964165070850,7321310608517778690,từ truyền thống cho tới tôm bò trứng muối là đủ thứ luôn á và độc đáo của món này là được nướng trên những cái viên đá này có độ và thơm bên trong khá là mỏng nước không có bị khô Các bạn thích ăn lạp xưởng bò và đầy trứng muối này kia thì cũng có mấy cái lịch sử nó sau khi nướng xong cái độ phủ lên cái lớp ớt bột Vậy thì sẽ hơi mặn mặn cay tê nhẹ đầu lưỡi khác nó quá có luôn trà chanh giải tay Ly 25 cành mà to đùng luôn quá từ 15 cành thôi à và ở đây là cái tiệm vui vẻ nha
6611029964165070850,7320942686783966472,Xem phim Hàn có hay thấy cái chảo gà xào bắp cải to đùng mà tới giờ tôi mới được diện kiến thử nè và cái đều chấn động đầu tiên là có 60 cạnh có số máy lạnh như vậy thôi rất là nhiều sợi mì sợi mà lạnh lạnh ăn đã vì là không có bị tâm như một số nơi mình đã thử qua đi Bà Hai ba đứa kia có bình trà tắc Cái này có 39 tiền rồi chia nhau uống đã luôn Còn đây là chở gà xào bắp cải to mà tôi nói nè phía bên trên phô mai đang ngập tràn luôn đó ăn kèm này có mì với đầy cơm đầu tiên sẽ ăn mì trước nha món hàng này cuối cùng lại với rau là ngon nhất đó là phần đùi cho nên ăn vào có độ dài chắc không có bị khô là có phần nước phải ăn kèm với nền An xanh cho đỡ ngán nhìn qua tụi nó cay lắm nhưng mà không nha có vị cay cũng hơi vàng nhạt có tất cả tokbokki nó ăn và có độ dài dài ăn xong rồi Mấy bạn sẽ đem cơm ra trộn cho mình nè Mà không biết sao ăn cơm mà cái gì trộn với nồi như vậy nè bao giờ cũng ngon hơn bình thường hết trơn cuối cùng là chả cá chân Ái của tôi mà do là tôi thích sẵn cái món này nữa cho nên cứ mãi là ngon đặc biệt là 3 chai với lại trà đá đây được free tha thứ để tích điểm đó chứ ở đây là Mr đất cho AB nằm ngay trong Giga Mall Thủ Đức luôn nha
6611029964165070850,7320830496345263378,có
6611029964165070850,7320574313252408594,chấn động hóa Đi chấn động Nghĩ sao mà có hai chính sách miễn phí kèm phô mai đàng hoàng đã vàng có thêm ba cục gà chiên tẩm sốt nghe chứ lời cái đường nào tôi không biết luôn bên trong ngoài gọi là có được cái tên thấy hạt lựu nữa nè mày đều được trộn da Chắc vừa tới thơm lần vị rất là đặc trưng lý mà kết hợp với lại sốt beatle nó ngon mà cái kiểu rất khó tả nghe thấy cái kiểu đơn giản truyền thống chỉ là sốt bò bằm cà chua rồi thì có luôn nè mà khoái béo có lưu ý thịt xông khói sốt kem nào sốt thì béo thơm mà đã lắm không có ngán nhà bà nào hỏi cái nào thì có làm sao đá gà này có ba tính tiền À còn một khóa nhanh nhi vui vẻ có nuôi gà viên chiên giòn cái lớp vỏ bột bên ngoài giòn nhưng mà cái phần gà Bên trong vẫn có giữ độ ẩm mềm đó là cái sốt này hơi bị ngon nha Mày nhớ tích điểm nha được free mà trái tim ra được viết 5 phần trăm cái chỗ mì Ý hạt dẻ này là phố spaghetti nha
6611029964165070850,7320460557553863944,một cửa hàng bánh tráng nướng Đà Nẵng về mỉm cười câu hỏi gì thì nói đó thôi Bởi vì nếu bạn cứ nói là hỏi quá nhiều mà nó không đúng với câu một cái thôi nướng bánh mà tưởng mày ra lẹ luôn á nhưng mà bánh tráng của cô thì đúng ngon nha
6611029964165070850,7320200200478362888,sôcôla lắm nha kết hợp thêm cái bị béo mềm của bánh flan đâu phải nói là Quá hợp luôn đó có bài nào thích đơn giản chỉ là bánh lăn không Cũng có luôn đó nhưng phần bốn cái như vậy là 28 pha lên nhìn cũng hấp dẫn lắm chứ bộ còn những cái lò xo này bạn cái đó ra món gì không có màu rất là đẹp mắt đã phải có mùi thơm lá dứa tỏ lên sau đó thơm ngào ngạt luôn đó và đây chính là món kem xôi nha kem là mặc dù là hơi mềm nhưng mà rất là béo và thơm không có bị dăm đá kết hợp cùng với lại cái xôi dẻo mềm mình nữa Mình thấy cũng khá là ngon ở đây là có tầm bốn vị luôn truyền thống matcha sô-cô-la với lại thái độ mềm mịn với lại thơm trứng và đó là cô cô ni cô nằm đối diện Cổng Xanh đường Trường Trinh
6611029964165070850,7320087842141572370,buổi tối mặt trời se lạnh uống trà sữa nóng nhâm nhi bánh đó thì quá là họ đang có vụ uống trà sữa được viết 10 trăm khi ăn mấy món ở đây đầu tiên được kết nối sườn cây ngon chấn động này nè Cái nước súp là vị chua cay Đúng rồi tôi luôn đó còn mấy cây sườn là được hầm miền Tây luôn chấm kèm muối xanh thì quả là do đó là ba chỉ chiên giòn chấm kèm cái số chậm chéo của Phan Tuyết Hoa Sao bì ăn hơi bị lạ luôn muốn chấm kèm bánh mì
6611029964165070850,7319830160608365832,nghe 39 cành thì nghỉ có một chút xíu cá đù cũng tươi này kia nha không hề luôn cá là khoanh nào khoanh lấy to đùng đã vậy còn rất là tươi nữa Chứ vì cái nước lẩu ở đây là đúng rồi tôi luôn kiểu là chua cay rất là tới vị phải cái kiểu mà bị một số nơi đây sao không biết chứ biết nuôi cá uống ngon nhất là cái bụng nó béo ngậy ngoài lẩu ra có rất nhiều món chẳng hề có món ruột của tôi nè tôm sốt Thái tôm thì to chưa chắc thêm cái sốt chua cay cay nữa tê tái tâm hồn nha Còn cái này là răng mực xào bơ phải chi có thêm bánh mì chấm kèm nữa thì quá đã lỡ rồi nó đẩy nhẹ thêm cái mặt nướng này gia vị Tạm ước thì quá nó vừa phản ứng bật tụt thì tôi giòn sần sật chấm kèm bút xanh thì quá quên nhớ phải ăn cái Bill 300 mới được gọi cái nồi lẩu cá 39 cành nha Mở xuyên Tết luôn nha Và đây là lẩu cá Hiền Nhi
6611029964165070850,7319459027623202055,đầu tiên là tôm sốt Thái cái món này cực kỳ dính luôn nha tôm thì tôi chắc thêm cái shop này chua chua cay cay chấm kèm muống xanh thì quá đã mà đâu phải vậy không đâu có thêm mấy cái đầu tôm chiên giòn nữa nè Cái đó là gọi cá lóc chiên xù nhìn đấu khác gì ở cá trê cho mấy cái quán thái kia đâu cá lóc thì giòn rụm kèm tí xoài chấm với lại nước mắm nè Trời ơi không biết chơi cái đường nào luôn chỗ này là ba rọi xạ chiên lên cho nên lớp da giòn rụm thì cứ 68 thì bị chua ngọt hài hòa và nấu ăn hơi bị cuốn Cái đó là gọi miếng hải sản miếng thì dai dai thêm cái hải sản tươi nữa Nói chung cũng hơi bị ổn áp Cái đó là ốc hương bơ bắp sốt thì thơm mà béo Đã lắm điều gì có thêm mỗi mì chấm kèm nữa thì quá sướng hơn mặc dù không có to lắm nhưng mà được cái là tươi giòn sần sật cuối cùng đẩy nhẹ nhàng cái nồi lẩu tomyum là dạng sữa không phải kiểu nước trong nhà đúng luôn tràn luôn nha Đổng có kêu ngồi ở đây Đúng vậy nó thoáng mát luôn đó là quốc dân quán nha
6611029964165070850,7319084743046270215,
6611029964165070850,7318341509579885831,đến nhà hàng thịt nướng gần lại chấn động chỉ có món da heo nướng thì chắc không đâu khác chứ là ông mập BBQ Bởi vậy đầu tiên Tất nhiên rồi tôi phải gọi có máu pdf da heo nướng này rồi mà nướng Cái này phải để cho cháy xém cạnh xíu thì mới ngon Không cần phải lo đâu Tại mấy cái chuyện nướng này có mấy bạn nhân viên Fe rồi chuẩn bị thong dong ngồi ăn thôi mà không lẽ giờ ăn da heo không có phải gò má thịt với lại lòng nướng đâu nữa da heo nướng này đúng cách thì đầu tiên bạn phải lăn qua bột đậu nành sau đó chấm vô cái tương đỏ Trời ơi ngon thì thôi nhé luôn nghe lòng nướng nghĩa là thôi này kia không hề đừng có nhớ là phải chấm này cái tương đây nè ngon chấn động đi ăn thịt nướng mà gọi gà rán nghe có hơi tốn nhẹ mà vô Lúc đầu tôi thấy có cái con Tuyết Trần kế bên cái tự nhiên bị thèm gà rán ngang xương cái gà nào lớp vỏ bên ngoài giòn tan bên trong nó rất là mọc nước đi kèm có xa lá sẽ đỡ ngán nữa nè Không biết ai sai cái thịt nướng là tôi phải cuốn lại với rau chấm lại cái tương đậu này thì vẫn mãi là ngon mà quên nữa ba anh sang đến đây là hơi bị nhiều loại nha Bạn có thể ăn kèm với lại thịt nướng với đầu lòng cho đỡ bạn thích nhất kim chi hành đó là lá mẹ đi ăn có bị cuốn cuốn sao mà bạn có thể kết hợp qua sao bì với lại thịt bù lại nhưng mà Ngon mà đã món hàng Tất nhiên là phải có canh kim chi bên trong có rất là nhiều thịt luôn nhớ là phải ăn kèm với lại cơm trắng vì kim chi đậm đà mà cay cay đã cái đó mì tương đen mặc dù sốt không có nhiều nhưng mà được cái vị rất là vừa bằng mà không có gì đây là bánh gạo phô mai chân ái cho những đứa mê phô mai cho tôi cái món này phải nói là siêu béo siêu dính luôn ở đây nếu bạn sắp còn bên trong có thể ngồi bên ngoài cũng rất là thoáng và mát và ở đây là ông mập BBQ Nhà Bè nha
6611029964165070850,7317972388820307207,Alo Thái Lan U23
6611029964165070850,7317861959108431122,đầu tiên là tôm đút lò phô mai phải nói là ngon chấn động luôn ngập tràn trắng kèm bánh mì này nữa là béo dính đỉnh cao cái này tôi gọi là phở đặc biệt cho nên tốt hay là dùng 75 cành là phải nói là hơi bị hở luôn có đầy đủ luôn miền Tây luôn nha chấm kèm cái này tương đối là quá đã bò lúc lắc sốt tiêu đen ăn kèm hơi bị điêu luyện luôn nha Thật sự mà nói ở đây từ bài trí tới màu sắc món ăn Hương vị tất cả đường không chê vào đâu được luôn á bò lúc lắc này nè bò này mềm tan quy định các vết thương lòng cái sợi mì Ý được trộn vừa tới một sự kết hợp của nó là quá tuyệt vời đó là bánh mì trở thì mới Nhìn thôi là đã thấy ngon rồi đặc biệt cái này có luôn sốt phô mai cho nên nay Mai béo Đúng hệ rồi đó là tôi mềm khỏi nói lòng đỏ trứng với lại thêm shop phô mai nó thứ gì mà chịu nổi đang có cả xúc xích pate với lại salad ăn kèm nữa nha Còn lỗi mà bạn không thích ăn sốt phô mai cũng có luôn sốt tiêu đen tiêu xanh với lại nấm hương mà nếu như bạn Đơn giản chỉ thích mì Ý sốt thịt tầm với lại xúc xích cũng có luôn này không có bị gãy vụn xóa tao thấm đều và đậm đà lắm nha không gian bàn ghế đây nhìn rất là chỉnh chu và sạch sẽ và đây là tư Hồng Phước nha
6611029964165070850,7317598704947531016,ở Sài Gòn Mở rộng Hà Nội tôi nghỉ liền cái chỗ này nè mà lần nào lướt ngang khu bếp tôi có bị hấp dẫn bởi cách chế biến của mấy anh ở đây hết trơn vậy cá sốt bên đây Cái nào cũng vừa vào mà không có bị với tôi hết á mặc dù giá chỗ khác một xíu nhưng mà rất là xứng đáng là kiểu là tiền nào của nấy mà nếu như bạn đi đông đông thì được thử nhiều món mà xay ra cũng không bao nhiêu đầu tiên là còn điện phô mai gạch cua 79.000đ cái món này là siêu siêu béo ngậy luôn bên trên có xíu Trứng cá chuồn ăn vào gần laptop khá là vui vì đó là sò điệp trứng cá chuột bàn tay vẫn là nước với phô mai và trứng cá chuồn ăn vào thì xuất sắc Trời ơi sốt tiêu đen 149 km thì rất là vừa vặn nha Không cần phải chấm thêm bất cứ cái gì đó thích cái nào ở đây mọi người sẽ điều chế nước chấm bạn tự do Michael tùy ý ở đây là ốc hương bơ dừa trong 19 cà rốt là toát ra dòng sản phẩm này mà không chấm bánh mì thì quá là yếu tố cực kỳ thơm béo ăn hơi bị cuốn luôn ở đây phải nói là to đùng luôn đó chấm kèm mới là bánh mì nửa top mỡ giòn Do đâu sợ bị mềm cho nên sẽ mở riêng ra khi nào bạn ăn sẽ tự để vào sò huyết có đầy đủ đồ Nhìn đã ghê chấm kèm với làm muối ớt hay là nước mắm gì mà thấy có rất là ngon nghêu trộn Xoài lại siêu dính kiểu là chua chua cay cay để biết tôi nói có đúng hay không thì bạn có bị béo Hà Nội Nha
