author_id,video_id,video_transcription
6611029964165070850,7305028622258064648,Nghĩ sao mà có 79 dành cho nó đậu bắp bò ri cua to đùng như vậy nè bắp bò là Dung chè luôn Ngoài ra có cái đậu hũ với lại thanh cua rồi nữa nè mà bên trong có nồi nước lẩu riêu cua nó rất là nhiều luôn cái này kiểu như là đam mê hay sai có tôi thấy lời không nổi rồi đó Không phải vậy Không Đâu con free luôn cả ba ly trà chanh giả tay nữa nè kỳ này là cái chỗ khó nó chơi bây lớn nhà áo về đồ nướng nó cứ 200 càng được 4 món nào là tôm càng nằm heo ba chỉ bò cuộn rồi là đủ thứ luôn đó bên đây mình thấy rất là vừa vặn luôn không nghĩ cái bạch tuộc to đùng như vậy mà cứ 50m nữa Nè tao nói vậy cứ 100 cạnh ba món đầu tiên là hàu này được tính bằng ba vị luôn ốc len xào dừa Trời ơi cái sốt vừa rồi phải nói là béo thơm cực kỳ luôn hấp thái con nghêu không có khoái to nhưng mà được cái đó cũng ngọt thịt lắm Nó chỗ chấn động chơi lớn này là tiệm lẩu ở nhà khó nha
6611029964165070850,7304982258442636552,khách Sài Gòn tìm đâu được chỗ ăn ốc có bia triệu đô như vậy hả trời và giá của thì sinh viên hạt dẻ luôn nha hôm nay tụi mình gọi sơ sơ về ốc mỡ xào rau muống đi kèm có mấy cục tóp mỡ này ăn vào giòn rụm cũng đã ốc hương 6 trứng muối ốc thì giòn sần sật kết hợp với lại cái sốt này béo thơm cực kỳ luôn á là bánh mì đó thì quá là dính rồi Cái đó hàu nướng phô mai mà con nào con đấy nó mất rồi luôn nha Còn đây là ốc len xào dừa món dừa ở đây Béo thơm gà xào sa tế ăn vào cay cay ăn khá là cuốn và cuối cùng là cái nồi lẩu đầy đủ thông tin này nè buổi tối ngồi ở đây phải nói là 3 m mẹ luôn gánh trọ của phi lê mát này phải nói hơi bị treo luôn á vị lẩu đến thế kỷ chua cay Ngoài bán cái này ra có cả tôm mực bỏ cá viên đủ thứ nha hồi xưa để dạng buffet nướng gần đây thì mới chuyển sang cái dạng ốc này nè vàng thì rất rộng rãi phải thoáng mát hơn cả ngoài trời với lại trong nhà cái nóc thành lùn nếu bạn thích thì bạn thử nè
6611029964165070850,7304874112260787463,trân châu nấu một lần là cái nào tổ sản như vậy nè bởi vậy không có lo Cái vụ mà hết Trân Châu này kia đâu nha có 19 ngày mà có luôn trân châu Bởi vậy người ta đứng xếp hàng dài là phải rồi không thì thôi chứ mày chọn có lâu nha kiểu là mỗi người một việc cho nên rất nhanh có hai loại mình thấy mọi người gọi đơn giản nó xanh với lại vàng bi xanh là là thái xanh nè Còn cái ly vàng này trở lại thấy xanh thì có vị rất là đặc trưng kết hợp với mùi tinh dầu Chanh đây này hơi bị lạnh chân cháu đây hơi bị dẻo mềm ngon mà Vì sao thích cái ly trà này hơn nữa là uống nó cứ bị cuốn cuốn sao quá mà quên nữa Ở đây mới về chợ quá đừng có chỗ cũ mà người Nhìn xéo qua thấy đồng nghiệp mà sáng đèn là biết rồi đó
6611029964165070850,7304611509013957896,bánh tráng mỡ hành đặc biệt là có luôn thịt bằm nhé Chén ở đây là theo kiểu phơi sương cho nên ăn vào rất là dẻo luôn cái hộp này có 20 cạnh là ăn Tao thấy cũng hơi bị cuốn Ngoài ra thì thử mấy cái gói thập cẩm với lại chân gà nào nữa nè chó sói tôi phải nói nó hơi bị keo liền luôn á chỉ có phần chân gà sốt Thái này của mình là 50 Cặp nè khúc này trộn ra thấy hơi bị mờ lên rồi đó Đã ăn tất nhiên là phải có uống Mày gọi thử trà chanh giải tay với lại Trà Chanh tăng tới đây là 25 cạnh nhau được cái là có luôn mấy cái trân châu đi kèm nữa nè Ê mà phải công nhận mấy cái số 8 này hơi bị đậm đà luôn chân gà khá là giòn và được sơ chế khá là sạch không có bị hôi này kia có gọi thập cẩm bên trong ngoài chân gà rang có cái bạch tuộc với lại trứng non sốt cà chua cay rất thú vị chấm kèm với lại cái bút đỏ nè Phải nói là quá dính luôn á và một phần thập cẩm như vậy là 110 cạnh đó nha trà chanh thì bị trà thơm dịu nhẹ ở ngoài cùng với lại cái mùi tinh dầu chanh pha nó hơi bị thơm lắm y chang ăn cục này bên trong mình thấy có luôn mới có mất măng cụt không được uống khá lạ miệng ở đây theo kiểu đó ngoài trời cho nên rất rộng rãi và thoáng mát bạn nào mà thích cái thói quen thử nha
6611029964165070850,7304504057081744658,nhắc đến ăn vặt đường phố Hàng Tất nhiên là phải có bánh gạo Gọi cái phần nào là bánh gạo chiên lên cảm sốt ăn cũng khá là mềm cái đó gà chiên tẩm sốt cái này mày thấy ăn khác tất nhiên không thể thiếu được cái món bánh gạo phô mai này rồi Bây giờ bên trong có trứng chả cám làm xíu phô mai kéo sợi ra cái món chân Ái của tôi nè bánh gạo lắc phô mai bỏ ngoài giòn bên trong dạ phủ lên cái lớp bột phô mai khác nó thơm nha Hôm nay khai trương nên tôi đã mất pháp này có vai trò 50 cành cho nên từ 199 ở đây thì có rất nhiều món ăn vặt Đường Phố kiểu gì cái xe này cũng hấp dẫn lắm chứ bộ Nếu bạn cũng hứng thú thì bạn thử nha
6611029964165070850,7304244428401544466,buffet có 199 cạnh mà ghẹ tôm ốc này là thoải mái một hồi đang bơi lội bạn tha hồ bà lấy nha ngoài tôm càng rang có cái ghẻ nữa nè bạn lấy bao nhiêu cũng được hết trơn đó gợi nhớ là phải canh nha tại vì rất mau hết luôn nguyên cái live lúc nào ở đây là bao đây dung tràn Nhìn cái này cũng muốn gấp hết trơn á buffet ở đây là hơn tầng 71 nó không có chịu mà bạn chọn có gì ăn đâu nha đầy đủ hết mấy cái gọi chả giò khoai tây chiên khoái tôm càng vô đây kiểu là đúng rồi me xào tỏi đen muối là có sẵn hết luôn nè thả ga không giới hạn thời gian nhưng số lượng không VT rồi luôn nhé trong ở đây mình thấy cũng khá là đa dạng không phải vậy không đâu có tất cả các loại thịt cá gà ở trong này nếu bạn thích chắc bụng hơn tất cả cơm chiên với lại mì xào nấu với tráng miệng để cả Mày rửa trái cây với lại cái đầu bánh dân gian tôi chủ yếu là mấy cái hải sản gà ốc nào nhớ là phải lấy mấy cái sốt mỡ hành phô mai ăn cùng mới ngon nha ở đây con này con này nó mất rồi nướng ra ở đây có cả lẩu mà nhớ chưa vậy thì 49 ngành nha mấy cái tôm càng mực càng ốc màu này bạn có thể like và lấy thoải mái không biết bao nhiêu tiền mà nói luôn là dạng được lấy thả ra cho nên chuyện con lớn con nhỏ này đương nhiên nha Cái tôm càng ở đây là gạch đầy rượu luôn á khúc này là gần 6 giờ mà nhìn nè hơi bị đông luôn á Và đây là buffet Đại Dương nha
6611029964165070850,7303872090975833351,có 179 cạnh mà bạn nam buffet nướng kiểu Hàn Dân chủ Hoàn mở nào đặc biệt có nguyên cái phòng làm tách biệt bên ngoài để thịt và rau củ luôn được tươi sống đa dạng các loại thịt giống nhau thịt cá heo cũ heo sườn heo ba chỉ mấy cái bò cuộn lòng gà chân gà da heo là có đủ luôn xanh và kim chi dưới đây hơi bị ngon luôn tráng miệng thì có trái cây nè có nuôi cá một like ẩm thực đường phố hàng cho bạn thoải mái mà lấy nước nè lấy cái chả cá này nè hơi bị ngon có mấy cái bánh xèo chả giò khoai tây kimbap đặc biệt cái tóc có khi nào Ăn dính cực kỳ luôn nha Có cả gà chiên bánh gạo lắc đó là miếng trộn nữa nè ngoài nước thì có cái like nước ngọt tươi cho bạn lấy nè nè Có 179 cạnh mà được nguyên cái bàn hoành tráng luôn á còn mấy cái chị nướng thịt thì có mấy bạn Dĩ nhiên đứng lo hết luôn nè nếu như bạn muốn ăn cơm trộn cứ nói mấy bạn nhân viên sẽ làm và đem ra mấy cái bánh xèo hải sản ở đây ăn cũng hơi bị cuốn thịt nướng cuối cùng lại với rau kim chi và ớt phải chi cái này mà có thêm lá mè nữa là quá xuất sắc luôn đó chấm cùng với tương đậu là hơi bị đỉnh luôn Cái đó là dãy núi nó được thay liên tục luôn cái lòng nướng da heo rồi đem chấm với lại cái tương đậu nành này nè rất là hợp luôn cái livestream trắng điện thoại trà đá sủi bọt cái này cái nước trái cây lúa mạch này nè nó ra đây chứng nhận đặt bàn chưa có tiền sinh nhật mà nếu tuyệt vời được free cái tháp lúa mạch
6611029964165070850,7303501432714480903,đẹp nhất cho cái chỗ mà mình từng đợt này vừa ra thêm ví dụ trân châu mà nướng nữa nè lịch sử vô Long phá nó cực đậm luôn đi 4 đứa cho nên gọi luôn 4 ly bốn vị nào đây chính là cái trân châu mà nướng mà tôi nói nè hạt trân châu ống mã mà đang bước luôn mặt mày ăn vào giờ tí tách thêm lần mùa mè luôn còn cái trân châu trà này thì quá quen rồi đâu cần nói nhiều nữa cô đông sữa đó đậm vị mà kết hợp cùng hai loại trân châu này vào đâu phải nói là cực kỳ cuốn luôn cái đứa uống trà sữa lúc nào cũng phải thêm kem như vậy nè trời ơi nó béo Đã lắm trâu này ăn vào có mùa hè nướng thơm lần nữa bạn nào mà thích ăn mèo là kiểu như là chân ái rồi đó Thấy thang máy thì có luôn trà đào với lại trà vải nữa nè tạm biệt kết hợp với lại đào và vải phải nói nó hơi bị dị ứng thì cái này Simili Đức Thọ này phải nói nó hơi bị rộng nha cái khu máy lạnh ở đây phải nói là hơi bị đã luôn bàn ghế là 35 cái khu ngoài trời nè ngồi ở đây là hơi bị treo luôn á Và đây là lá Simi Lê Đức Thọ Nha
6611029964165070850,7303126011011550472,còn em thích sự béo ngậy thì có luôn ốc hương bơ dừa nè Cái sốt này béo thơm quyện cùng với lại vừa bào ăn cực kỳ đã luôn á Cái đó còn đẹp 6 trứng muối trứng muối là xuất sắc chấm kèm là bánh mì nữa là quá đã Bữa giờ thấy cũng không được khỏe lắm cho nên gọi luôn hai con bào ngư ra để tẩm bổ nè là có một món mà Tôi thấy Hầu như ai cũng gọi nha Là nhôm nước trứng cút này là hơi bị to luôn á tiếp theo là sụn gà chiên nước mắm gà thì giòn sần sật mà đã là có luôn tóp mỡ nó nè tiếp theo là sò huyết xào mắm tép vừa tái như vậy thịt rất là ngọt luôn nắm chắc là chua cay rất là đậm đà thì gọi luôn buổi sáng 7 bị như vậy mèo con nào con đấy nó mất rồi nên ăn vào béo Đã lắm đừng quên tôm càng nướng phô mai ở đây có rất nhiều về này nọ luôn bánh tráng sầu riêng để tráng miệng nữa nè đã ghê không gian thoáng mát có nuôi trong nhà và ngoài trời và đây là ốc hoàng kim
6611029964165070850,7302756107213131015,tranh giải ba hết mà bây giờ có một diện mạo mới để biết cục trái cây tươi nè Mình thấy có dâu xoài cái này đổi bạn thích vị gì
6611029964165070850,7302384764193983752,cảm nhận liền cái độ săn chắc của gà ướp rất vừa vặn Anh thích đậm đà có thể chấm thêm nè Cái đó là lẩu gà nấu măng khô bên trong ngoài măng khô với lại gà ra còn có cả trứng non nữa gà ở đây đúng nghĩa là cơ bắp luôn á thịt rất là săn chắc có rau muống Với lại chú bào trong vai và thanh ngọt lắm luôn á Để chắc bụng hơn bạn có thể thả miếng và ăn cùng cái nồi lẩu nó cứ nghĩ bốn người ăn rất là ok Tại vì thịt Bên trong rất là nhiều luôn đó đây giống giống như là mình đang ăn miếng măng gà vậy đó nhưng mà cái này là phiên bản lậu cực thích măng khô luôn cho nên tìm được cái lẩu này giống như là chân ái gì đó mà đến cái thuốc chấm gà này giống như là kiếp nạn của tôi đã tới rồi đó dài cơ bắp quá hay sao mà cứ rớt hoài luôn đó là ở đây có gọi gân bò ăn cũng khá là ngon thì có độ dẻo giòn sần sật trọng là cái sách gọi nó bị chua cay rất vừa phải có một cái tên rất là đặc biệt rất là gà cơ bắp thoáng mát nằm ngang đối diện bờ kè Hoàng Sa luôn
6611029964165070850,7302015195457572103,chấn động chấn động buffet tôm hùm thả ga Bạn muốn ăn bao nhiêu cũng được đến khi nào thấy Ngán thì thôi đi bộ luôn nha vé thì có 649 và 729 chọn luôn 729 thì ăn được cho nhiều may mắn nhé low số một cái Tôi không biết chuyện gì xảy ra luôn nhìn cá màu vàng đầy ắp hải sản như vậy đã ghê cò Điệp nhật mày ngồi nướng phô mai với lại mỡ hành to đùng mang dính cực kỳ luôn quá nè tôm hùm nướng phô mai trời ơi phô mai tôi phải nói là béo Đã lắm luôn á cái dạng cay cay thì có luôn đó muối ớt tôm hùm mà chấm với lại muối xanh thì quá là ngon và nhớ là tôm hùm thả ga Nha ăn bao nhiêu cũng được hết trơn á Ngoài ra có cả tôm hùm sốt me với lại rang muối nữa nè Tôm Hùm là tôi chắc lắm luôn có cả cua nữa Cái này mày gọi là 6 trứng muối tôm hùm và cua tất nhiên phải có con hào nướng phô mai phải đó là ngon xuất sắc luôn đó hoặc là hàu nướng mỡ hành cũng không có kém cạnh gì đâu nha nó cả tôm tít rang muối nữa nè dù là Tôm không có to nhưng mà được cái đó tôi chắc ăn cũng đã lắm Nói chung mấy món này là bà đang thoải mái cứ hết rồi Nói mấy bạn nhân viên sẽ đem lên cho mình và đang có cái mùi bò lai mình thấy có cả sushi nữa cả miếng mà xào với lại tôm hùm nha tráng mì nó có đầy đủ trái cây rau câu cùng với lại kem nữa nè Cái chỗ buffet có view siêu đẹp này là trời view đẹp nha
6611029964165070850,7301905170600873223,mà chất lượng phục vụ là không khác gì ba cái nhà hát Lượn Ricky và Tứ Xuyên hỏi vậy là 16 cạnh mà bạn đã review nước lẩu thoải mái còn mấy cái thịt chả tấm pin này kia Mình thấy có mười mấy hai mấy ba mấy cành là phải nói là quá hạt dẻ luôn đó mà nhân viên phải nói là siêu nhiệt tình và dễ thương Mấy bạn thấy thèm từ a tới áo luôn nước chấm thì có một cái like cho bạn tự pha và có thể nhờ mấy bạn nhân viên pha nha mấy cái xót xa tới muốn xanh ở đây là hơi bị ngon luôn mà khi nước chấm xuất sắc nó phải nói là quá tuyệt nhất là cái Chả tôm phải Thúy này nè ăn có độ dai thơm ngon lắm hoặc là có tim heo nhân phô mai kéo sợi này nè ăn cũng hơi bị cuốn thiệt chứ mỗi bạn mày nghĩ tao cầm hơn 100 km luôn á mà không lẽ giờ ăn rau thịt nóng không mà không ăn mì thì cũng kỳ đúng không như cái mì này nè có 15 cành nè trời mới làm xíu sốt sa tế với lại thịt băm Trời ơi tôi phải nói là ngon xuất sắc luôn á nước lẩu đây được review đúng vị chứ không phải chỉ là cái nước cốt xương hầm như một số nơi này nhạc lên mấy bạn nhân viên cũng làm chủ công cho đứng nhảy múa tạo không khí rất là vui tươi luôn á và thường đi ăn thì bạn hay e ngại nhà vệ sinh đúng không ở đây rất là sạch sẽ rồi mình được chứ không tặng cho cái bong bóng nè quá là dễ thương luôn ăn lẩu rất đáng để bạn trải nghiệm
6611029964165070850,7301642316744314130,thả ra buffet tokbokki không VT không giới hạn thời gian như số lượng đầu tuần cuối tuần gì cũng chỉ 100k là có cả vị socola khoai môn rau củ với lại phô mai nữa nè có cả các loại chả với lại bò cá viên cả rau nấm kim chi bò gà mực râu tụt vào nữa nha Nhớ lấy cái gà chiên cơm trộn miến trộn này ăn cũng ok nè nước sốt có rất nhiều loại bạn có thể nhờ mấy bạn nhân viên mà là tự pha Theo các bạn gợi ý tôi là pha hai phá puki với lại một khóa đổi kem nè sau khi lăn quanh một hồi tôi được cả Một Bàn như vậy nè quên ở trong có buffet 100k này là có luôn cả nước mình thấy có nước ngọt trà sữa được thả ga luôn á Trong lúc chờ lẩu sôi thì cứ đẩy nhẹ nhàng mấy cái gà chiên Anh đâu rồi nè Cái sốt này ăn cũng khá là ổn áp giờ là nồi lẩu uống đã sôi rồi nè nhìn cũng là em lắm chứ bộ vô là có cái sốt kem béo ngoài với lại cái shop bút chì cay cay Ăn cũng ngon lắm đống kia là dẻo mềm nha ăn xong nhớ trái tim để được free kem nè có cả ngoài trời sân thượng với lại phòng lạnh và ở đây là giấy tờ bút tiêu quận 7 nha
6611029964165070850,7301534359973039367,ở Sài Gòn mà muốn ăn đặc sản Nha Trang thì nó có bài 5 thông tin lo rồi nè mà đã là đặc sản Nha Trang thì tất nhiên phải làm nem nướng Cái mặt này hoài nem nướng ra còn có khả năng rán giò lụa và cả nem chua nữa cái cuốn này hết tất cả với nhau để chăm sóc thôi bất ngờ nhất là cái bàn này chỉ có một 55 cành thôi đó chấm thịt ở đây mình thấy sánh đặc thù với bạn muốn ăn cùng nước mắm chua ngọt Mình thấy cũng có luôn kế đến là cơm gà xé xá xíu có 50 cạnh thì có đây cũng mềm thơm không bị khô cơm ống vàng và của tôi ráo lắm nha kem sẽ có một chén súp có trứng bên trong luôn Cái đó là bún mắm nêm ngon xuất sắc luôn tràn vì mắm nêm là đúng chuẩn miền Trung luôn rất là thơm và pha rất là vừa vặn nữa mà khoái gọi là có luôn gọi sứa ăn vào giòn sần sật đã lắm Cái đó là bún cá ấn tượng nhất của mình ở nước dùng trong veo luôn quan tâm sẽ có sứa tôm mực cá cùng với lại các loại thì tương lai sần sật Không có gì bổ dùng trong veo cho nên rất thanh và ngọt luôn miệng tất nhiên phải là xu soi rồi Thanh mát mà thơm lần mà nước đường gừng Nói chung ở đây có rất nhiều món bạn nào mà thích ăn món Nha Trang có thể ghé thử vài năm thông tin nha
6611029964165070850,7301286765799755015,kimbap chỉ 50.000đ chuẩn bị hàng do chính người Hàn Mở nằm ngay khu Lê Thánh Tôn quận Nhất luôn nè Ở Đây hầu như có đủ hết các món ăn truyền thống của hàng chẳng hạn như các phần này mình gọi là tóc của Kim phô mai phô mai kéo sợi luôn nè Nhìn đã ghê á bánh gạo thì dễ dai phần sốt rất là đậm đà luôn Và đây là kimbap Nhà Họ Kim nè có 50.000đ cái cũ nụ à topping cũ bên trong nó là siêu nhiều luôn đó nếu như bạn thích ăn phô mai cũng có luôn kimbap phô mai nè hồi nãy gọi là phô mai thì tất nhiên ăn vào sẽ có vị béo nhẹ của phô mai bên trong Mặc dù kimbap chỉ có 50kg cùng với lại vị trí shop nóng hổi Cái đó là mì tương đen sợi mì có độ dài phần sốt khá là vừa vặn Nhưng mình có thích hơn nếu mà nhiều shop hơn một xíu nữa Còn đây là rong biển chiên phần vỏ bên ngoài khá là giòn bên trong có đầu dây nhẹ của miếng ăn vô hơi bị cuốn cuối cùng là xếp thịt heo đem ra là nóng hay họ bốc khói luôn nha đi kèm với đầy sub sẽ có bún và cơm Tùy vào bạn thích ăn gì với phần nước súp có độ Thanh ngọt và béo nhè nhẹ ăn với cơm hay là bún gì mình thấy có rất là buổi trưa mình thấy mấy bạn văn phòng cùng với lại người Hàn rất là đông đặc biệt là mở lúc 24 giờ và ở đây là Kim ga kim bát Nhà Họ Kim
6611029964165070850,7300908241217752327,đứng đứng bò lá lốt thôi ở nhà mà cũng được đó là quá hấp dẫn luôn á Ở đây thì ngoài bò nướng lá lốt ra còn có cả bầu trời nữa bỏ đây là dạng thịt tươi nóng của mỗi ngày luôn chứ không phải mà dạng đông lạnh này kia đâu nha Ê mày khúc này Nhìn cảnh huống chi tiêu quá nè đứng nhìn thấy cái nào cũng hấp dẫn nó cho gọi là một màn đầy đủ lá lốt và mở trà là 70 cạnh cái đó tội ác để riêng nên không ăn cay được cũng không sao nha Cái này là mở chai nè bên trong là thật đầy đủ luôn á bò lá lốt thịt bên trong có rất là nhiều không có độ mở này kia đi kèm sẽ có bánh tráng rau bún với lại chuối chát cuốn chung lại với nhau rồi chấm Cái này cái nước mắm Nam này nè Có khóm đó cho nó có bị mặn được cân bằng rất là nhiều mày nghe đâu bánh mì chả ở đây cũng ngon lắm nên mình có gọi thử một phần nè nè mày ngồi đó đặc biệt Hình như là 65 cành đó cái khúc này nhìn cái chả sôi là 1 như vậy Phải nói là quá mà là em luôn á đi kèm theo sẽ có bánh mì với lại một đĩa salad đây thì mình thấy có xíu mại trứng xúc xích thịt bò chả patê với lại phô mai bánh mì mà chấm với lòng đỏ trứng là béo khỏi nói rồi nó bị xíu mại này rất nhiều thịt mà lại mềm 3t thì quá là béo thơm mà ra có trà trái cây thì cũng rất ổn áp vị trà thơm dịu nhẹ Đây là đâu thì cứ nhìn màn hình nha
6611029964165070850,7300794293633961224,nghe đọc cái tiệm bánh canh cua này rất là dày 60 khu quận 4 bởi vì hôm nay tôi phải test thử nào đổi thử rồi thì gọi luôn cái thố 300.000 này ra xem có cái gì trong đó cái số này thấy toàn là tới bên chứ không thấy bánh canh đâu hết trơn trước khi đem ra bạn cũng sẽ được bật lên bếp nấu cho thật là sôi luôn nè thối thượng hạng luôn nha nào là tôm càng may rẻ Hải Sâm bào ngư Trời ơi quá là bổ dưỡng rồi Kiểu này mà đang mệt trong người làm Bảo thối vô Chắc là phải liền á Có luôn ốc nhồi nấm đông trùng với lại càng cua đồ nữa nha nhiêu đó thôi sao đủ phần có thanh cua với lại còn đẹp Nhật nữa nè còn ai khoái ăn cùng với bánh vậy nó cũng có luôn nha mấy cái tấm pin mình múc ra một cái tô riêng cho dễ ăn nhìn nè dung tràn nha Cái hải sản này muốn xanh hoặc là cái nước sốt tắc này nè thấy cũng hơi bị ngon đó mà cái thố nó là hai đứa ăn nha Chứ một mình tôi không thể nào hết được rồi đó chẳng ai về nên ăn thơm ngon lắm luôn á yên tâm càng mà tao thấy có nguyên cái hồ này mấy em còn đang bơi lội luôn nè cho nên tâm trạng đó là tôi khỏi nói rồi và gạch cũng rất là nhiều luôn á nước uống rất là ok nha như sữa đậu nành bạc hà
6611029964165070850,7300531799854189831,chân gà sốt Thái một cái máu mà luôn được lòng rất nhiều người nè cái nước sốt thần thánh này nè Cái sốt Thái này nó hơi bị keo liền nha khúc này đứng nhìn ăn trộm phải nói là hơi bị hấp dẫn luôn mỗi phần cũng chỉ từ 50k Uống nụ luôn trắng cùng với lại cái muối ớt đỏ nè sau đó để dính cực kỳ luôn nha chân gà ở đây ăn vô giòn sần sật đã ghê á Ở đây có đầy đủ 50 70 100 cành Bạn có ăn bao nhiêu cứ nói nha tôi ăn thử free luôn để biết rõ hơn bạn cứ bị chân gà ai vậy
