author_id,video_id,video_transcription,url
6675890617647940609,7332068105650179346,ngon quá siêu ngấm gia vị luôn Nhưng mà em nói ít quá em ăn thêm mà chờ đến một lúc bây giờ em ở đâu vương trên môi nụ hôn của ai để bây giờ em dùng đỡ chia xu để màu thịt lên đẹp mắt tương ớt Chinsu thơm cay dùng thấy ức chế còn khiến món ăn cay Tây kích thích vị giác buồn vì món ăn may mà giờ có cho 2 kg dùng cho tiện lúc đi siêu thị có bị bất ngờ vì quá to thì mới đã vì mỗi lần nấu cho cả mỗi ngày cơ mà Đúng là món gì cũng phải canh canh một chút mới ngon Tết này dùng bản 2 kg chấm thả ga,https://www.tiktok.com/@6675890617647940609/video/7332068105650179346
6675890617647940609,7331706593177849106,,https://www.tiktok.com/@6675890617647940609/video/7331706593177849106
6675890617647940609,7331329561059282183,Nghe xuân sang thấy trong lòng mình chứa chan tiếng pháo hoa biển Mùa Xuân Đang Đến trường em nhận ra những ngày xuân đến nghe bức tranh màu đẹp thế từ con ngựa sắt hai bánh của anh làm sao chở được hết đống đồ này thêm một người thân đã đồng ý Giờ có xa nhau đi Sắm Tết từ a đến z xanh lo hết tài xế của chu đáo này cũng chứa thoải mái đã thế còn không ra mắt mèo nữa nhá Còn việc của anh chỉ là thanh toán rồi đúng không thanh toán cũng chả phải lo vì rẻ hơn có mã xanh 50 giảm ngay 50% lên tới 50k luôn còn đang có cả chương trình Hái Lộc xanh đầu năm qua áp đặt khách hàng lên áp dụng cây vào mùng 1 2 3 Tết sẽ nhận được câu đối Tết và lì xì lên tới 1 triệu đấy Đúng là người thật khỏi phải cong đít dắt xe ra vào liên tục Gọi anh sang SMS thực phút mốt là tới năm nay đúng là đi xe xanh về đón tết sang di chuyển mái rồi giờ thì sản xuất tiếp theo nhé Chúc anh chị sống rất vui vẻ Let's,https://www.tiktok.com/@6675890617647940609/video/7331329561059282183
6675890617647940609,7330586510816726290,cả 50 ngày tết mặt trời lên đỉnh đầu chứ gì Anh ơi báo việc em đi xuân sang thấy trong lòng mình chứa chan tiếng pháo hoa biển mùa xuân đang đến cho em gần xa nhớ bao giờ có cái nồi chiên không dầu Xiaomi máy hút bụi để mà cũng mua ở đó luôn mua nhiều giảm nhiều cái gì cũng giảm hơn nửa giá đúng thời đại này chấm smartphone,https://www.tiktok.com/@6675890617647940609/video/7330586510816726290
6675890617647940609,7330214378878340359,bây giờ tiện lắm dùng luôn có nước dùng hoàn chỉnh ở barona này công thức là như nhà hàng luôn hương vị tươi ngon có thành phần 70% nước hầm xương và chiết xuất rau củ nên không cần hầm xương lầu Dương Còn có cua thật nữa không cần nêm nếm thêm gia vị mà không có chất bảo quản đâu kể cả làm lẩu đôi cũng chỉ trong tích tắc,https://www.tiktok.com/@6675890617647940609/video/7330214378878340359
6675890617647940609,7329473692482718983,sớ tra hay còn non đấy luôn đó mua những gì không chia ly Suốt này kiểu chua ngọt nhưng với cá nhân em thì món gì cũng phải cay cay một chút mới ngon nên em cho thêm tương ớt Chinsu giúp món ăn có vị cay cay kết thúc vị giác cùng vị món ăn cũng khiến món ăn lên màu đẹp mắt hơn nữa trồng cây dùng thay nước chảy luôn Mà công nhận trai hay tí nữa tao thật Tết này con trai 2 kg chấm thả ga ăn với cơm chưa,https://www.tiktok.com/@6675890617647940609/video/7329473692482718983
6675890617647940609,7328749721168727304,món bánh kim nguyên bảo là mới lạ và độc đáo ghê mang về quê ăn tết là cả làng thấy ngay nhà mình giàu sang liền đã đẹp còn có ý nghĩa cầu tài lộc đầu năm nữa nhưng mà là một cầu kiến em làm có một lúc thôi tiếng nói rằng nguyên liệu không thể thiếu để món này thêm ngọt ngào là sữa Ông Thọ giúp món ăn ngon hơn ngọt dịu mà không thoát vị đường béo ngậy thơm đặc trưng mùi sữa con trong làm bánh sẽ mềm diệt không hề bị khô đến bên anh thỏi vàng là vàng ươm Chắc là hôm nay mình lên hương mau giàu lắm mèo chứ sao sữa Ông Thọ không chỉ giúp Bánh vừa lên hương vị thơm ngon mà còn mang ý nghĩa lớn hơn tài lộc nữa đấy cúng ngày vía Thần Tài thì chuẩn luôn béo bánh mềm dẻo sánh mịn mà đẹp nữa Phải Chi năm sau cũng có mấy thỏ vàng này mà là vàng Thật nhở Bánh vừa ngon vừa dễ làm,https://www.tiktok.com/@6675890617647940609/video/7328749721168727304
6675890617647940609,7327989467237698834,khiếp sức đâu mà ăn cho hết chưa hết đâu em vừa mua thêm 150 ở menu được tặng bao lì xì Tết 5100 và 5 bao lì xì nữa xinh không ăn hết đi em lấy lì xì rồi,https://www.tiktok.com/@6675890617647940609/video/7327989467237698834
6675890617647940609,7326882160143535378,I love you,https://www.tiktok.com/@6675890617647940609/video/7326882160143535378
6675890617647940609,7326197360348957970,từ hôm qua rồi đấy nhưng mà bảo để chơi Ngọc về Ngọc thích rước dâu về để cho Ngọc Bích chín lắm rồi đấy bảo là chuyển lên đồ chơi bài hát Mọi người đi qua nhìn thấy thấy đỏ chín giờ cháu đi vào bể chưa,https://www.tiktok.com/@6675890617647940609/video/7326197360348957970
6675890617647940609,7323908847670693138,Rider Demons Let It Go baby Shark,https://www.tiktok.com/@6675890617647940609/video/7323908847670693138
6675890617647940609,7323164155488275719,tổng hợp với tôm bằng nước tương Chinsu tỏi ớt chiết xuất từ đậu nành tự nhiên hòa quyện cùng tỏi ớt được xay nhuyễn giúp cho chi sư tỏi ớt có hương vị cay thơm khó cưỡng bức tường khi hòa quyện vào món ăn giúp vị giác được kích thích và Nâng tầm vị ngon món này mà có cơm nấu ăn cùng thì khỏi bàn cơm ngon tới giọt cuối cùng luôn,https://www.tiktok.com/@6675890617647940609/video/7323164155488275719
6675890617647940609,7322436750859668754,bánh kem phô mai không phô mai ở đâu ra yên tâm em có cách đợi em một lúc nữa karaoke karaoke hiện nay cũng chỉ như một loại tương cay cay ngọt ngọt đem lại cảm giác cay ngon Thứ Thiệt không bỗng dưng mà tương ớt Chinsu là tất cả các sao lưu trên amazon ví dụ sữa chua nó khá là ngon,https://www.tiktok.com/@6675890617647940609/video/7322436750859668754
6675890617647940609,7321680770299415826,bài vẽ Ăn gì cho mất công anh nhìn tôi làm việc sốt xào này cho thêm ít chi su sa tế tôm hải sản xào rau thơm cay mùi vị ăn cuốn cực kỳ tôm ăn cơm với ta,https://www.tiktok.com/@6675890617647940609/video/7321680770299415826
6675890617647940609,7320945273893571848,nay mình về muộn quá nấu gì cho nhanh số điện thôi nhé Có ăn là tốt rồi đợi em 20 phút là có tốt không ạ đủ món ngon khẩu phần ăn vừa vặn Bữa nào không có em anh bỏ ra ăn cũng ok Chồng nói mà đủ năng lượng nhé loại mới mà Nhưng mà anh có an toàn không đấy nguyên liệu làm từ thịt sạch nhất để ly không hàn the bán tại các cửa hàng Winner yên tâm nhé Chỉ cần là cô bé ngủ ngon,https://www.tiktok.com/@6675890617647940609/video/7320945273893571848
6675890617647940609,7320566316455251218,"mới ngâm một tuần đã được Rồi thời gian sẽ ngâm thì lâu chứ làm có một lúc mà về nơi đâu cầu mong anh không khó mong muốn yêu thương cuối con đường ta sẽ đi về đâu đôi ta cùng nhau tìm công thức này cũng đi học Mác là thôi cứ 1,05g có công thức ngon thích hợp dùng hàng ngày hôm qua em vừa xem thấy bảo Chinsu Biển Đông không chỉ ở Việt Nam mà còn có mặt ở thị trường quốc tế Đấy mới bắt đầu ngâm đã thấy hấp dẫn rồi Ngon không đậm đà",https://www.tiktok.com/@6675890617647940609/video/7320566316455251218
6675890617647940609,7319458631701843220,Xem gà rán mở cửa đi ăn chắc đợi lâu lắm rồi cần gì đâu để em một lúc tình không đến sức sống giờ là không mất thời gian pha siêu nhanh luôn Chinsu vừa ra mắt sản phẩm dành cho anh ăn cay thì có loại mayonnaise tương đối một lần chấm 2 vị ngon luôn sáng mịn lắm về vấn đề trường,https://www.tiktok.com/@6675890617647940609/video/7319458631701843220
6675890617647940609,7319085595819625746,Giọt sương vẫn còn đây với ta nhìn vào mắt cô đơn chưa bao giờ anh nghĩ ta nên Rời Xa Nhau Thôi đi đến đây về nơi đất hoa lụa nằm trong ánh mắt tràn đầy Mộng Mơ,https://www.tiktok.com/@6675890617647940609/video/7319085595819625746
6675890617647940609,7318589148166688020,làm sữa chua may mắn gọi là ăn tạm xương sườn là chắc cũng mấy tiếng một chút thôi không không không nhà 50 vừa ra bộ sưu tập 3 chai nước mắm pha sẵn làm mấy món kiểu này nhàn ghê không cần băm tỏi ớt gừng hay pha cầu kỳ tới lui ra là dùng được ngay da giảm thêm xíu chanh đường mắm hoặc ớt tùy khẩu vị là phù hợp với món ăn Ví dụ như ốc mít với mực thì chấm năm nữa Thường Kỳ Sơn dùng gừng nghệ an vị gừng cay đậm hay cút lộn xào thì dùng luôn 5 km/h Nam Bộ chua chua ngọt ngọt kích thích vị giác của tôi em lại đi mua lúc nào đấy thì sáng em đi chợ mua luôn siêu thị Tạp Hóa chỗ nào chẳng bán thuận tiện lắm,https://www.tiktok.com/@6675890617647940609/video/7318589148166688020
6675890617647940609,7317970796553506069,nhiều người nói thích em em lại không thể yêu nhiều người không mua được con em dùng luôn gói sốt lẩu riêu cua Thanh tự nhiên từ word cua đồng tiện lợi dễ dàng làm lẩu ngay tại nhà Bây giờ ông phút còn có các quốc lộ sang nữa hãng nhiều loại lắm có bị thái tokbokki kim chi hải sản nữa Bây giờ thiết lập Bất kỳ giờ nào cũng chỉ 5 phút sau,https://www.tiktok.com/@6675890617647940609/video/7317970796553506069
6675890617647940609,7317595802468224277,làm món này không phải thiếu mayonnaise được em dùng mayonnaise của Chinsu làm từ trứng gà tươi ngậy thơm sánh Mị Nương sở đơn giản có luôn bây giờ này sợ Chinsu vừa ra mắt em phải muôn thuở luôn cay cay béo béo trộn chung là chuẩn bài tiện dụng lắm luôn luôn tuyệt vời,https://www.tiktok.com/@6675890617647940609/video/7317595802468224277
6675890617647940609,7317237378999962900,quán cà phê để từ đầu năm mẹ làm thành bản đồ ăn ngon thế này khó khăn gì đâu làm một lúc thôi được cái bột Milo remix nhưng dễ làm lắm ai cũng làm được,https://www.tiktok.com/@6675890617647940609/video/7317237378999962900
6675890617647940609,7316858056346832136,"ngon quá nhưng mà hết mất rồi Giờ này kiếm đâu ra đâu nữa em còn tự làm đậu phụ nữa không là dành tự làm cho nó vệ sinh dùng cái máy xay nấu đa năng bluestone này nó làm hết Có phải làm gì mấy đâu Mày có 9 chế độ xay nấu bằng một chế độ tự giữa trang bị cảm biến tự ngắt khi mở máy hoặc quá tải hẹn giờ 12:00 chống trào dung tích của lớn 1,75 lít phù hợp với nhu cầu gia đình bạn sau không đi xe Ford mới mua thì bên này bán hàng chính hãng giá tốt bảo hành đầy đủ hư gì đổi lấy yên tâm quá còn gì nữa karaoke",https://www.tiktok.com/@6675890617647940609/video/7316858056346832136
6675890617647940609,7316482110083058946,mưa thì không Mẹ ơi cho biết làm cái sốt cay ngọt này quan trọng nhất là dùng tương ớt Chinsu thơm cay dùng thay ớt trái giúp món ăn lên màu đẹp mắt gây tê kích thích vị giác món gì thì cũng phải cái tay một chút mới ngon lùng dùng thao dã man của hạt trai một khi sai lớn cho đã mà vẫn không đủ chất chống lại giống em,https://www.tiktok.com/@6675890617647940609/video/7316482110083058946
6675890617647940609,7316125525943094536,Anh ơi Thương Xót Chúa cảm ứng 3 chế độ tự mở cho em đỡ phải chờ anh lâu xịn thế Chạm vào là mở không chạm cũng mở Khi nào hết pin mở cơ luôn cũng được này Mày chết mẹ mày rồi mày làm bằng thép nên rơi không vỡ mà nhìn cũng đẹp đấy Sang chất liệu này chống nước thoải mái luôn xịn đấy nhưng mà anh ơi gửi cho hộ em nhé,https://www.tiktok.com/@6675890617647940609/video/7316125525943094536
6675890617647940609,7315815877885168904,đau lòng lắm có đắt không đấy không con ngô có mấy trăm nghìn thôi tiếc thay con đường mới biết mẹ luôn muốn đời còn tốt hơn ước mong mẹ con đã lí trí để đựng ấm biết đi rồi chia nhỏ mua giày mới đi trên Gương Mặt Thân Quen không ra đi lòng rộn ràng biết bao đi để trở về,https://www.tiktok.com/@6675890617647940609/video/7315815877885168904
6675890617647940609,7315369849197235474,Anime hot lắm Không biết có ngon không nhỉ vừa tiện Món này ngon nhờ hương vị thơm béo của sữa tươi nhưng do có nhiều sôcôla dễ bị ngọt gắt nên em chọn Vinamilk hộp 1 lít không đường sữa tươi đậm vị tốt cho sức khỏe kết hợp với sôcôla tạo nên món đồ uống thơm béo ngọt dịu Đúng là Một Cặp Trời Sinh được cái bao bì cũng xinh và đáng yêu nữa nhìn vậy mà cũng đơn giản nhỉ Tìm món này ai cũng làm được sữa mà nguyên liệu thì dễ tìm mua Online hay siêu thị nào cũng có đấy,https://www.tiktok.com/@6675890617647940609/video/7315369849197235474
6675890617647940609,7315002078294723848,anh bánh mì Thanh Long đang hot đấy mà đợt hoài không được Anh nói là chờ đợi em vào lúc 5 :,https://www.tiktok.com/@6675890617647940609/video/7315002078294723848
6675890617647940609,7314633754176163079,mình nhận được rất nhiều câu hỏi kiểu như ngày nào anh chị cũng ăn nhiều thế mà nói nhiều thế thì có ăn hết không Vậy thì hôm nay bọn mình sẽ chia sẻ một chút thứ nhất là bọn mình ăn cùng các thành viên khác trong gia đình nữa nên cũng không sẽ nấu nhiều hoặc nấu một lần ăn nhiều bữa những ngày còn lại thì bọn mình phải dành nhiều thời gian để làm việc tập luyện theo công thức 4:51 đơn giản để tiết kiệm thời gian nhưng vẫn đảm bảo dinh dưỡng Nhân tiện để chung tay giải cứu cam sạch miền tây và ủng hộ nông sản nước nhà hôm nay bọn mình sẽ nấu món mì trộn và hoa quả theo công thức 4:10 có nghĩa là phải cân bằng được bốn yếu tố gồm chất bột đường xích đạo chất béo Vitamin và khoáng chất nguyên liệu có ít nhất 588 thực phẩm nhóm thứ nhất là lương thực mình có mì ăn liền nhóm thịt cá và hải sản hôm nay mình chọn gà nhóm rau củ màu vàng da cam xanh đậm thì nay có cam sành cà rốt dưa chuột dứa xoài táo các loại hạt ở đây là làm rau củ quả khác là rau răm rau mùi khuất nhóm dầu ăn và mỡ các loại bình chọn dầu ô liu sữa và trứng này mình không sử dụng tới công thức này đơn giản và dễ áp dụng kết hợp thành một món mì đảm bảo ngon mà đầy đủ dinh dưỡng ai cũng có thể làm được luôn,https://www.tiktok.com/@6675890617647940609/video/7314633754176163079
6675890617647940609,7313886665360067858,nhà nào nấu phở bò ý nhỉ Nhưng mà hình như hơi nhiều mùi hôi thì phải muối ớt luôn á anh lại vừa ăn vụng sầu riêng đấy à Anh đã rửa mồm rồi mà Đúng là cái mùi sốt cà ri vàng nên không lấy đâu được có quả gì màu khác nữa hả Chứ sao ở đây một cái đỏ với xanh nữa tôi cả ghi này mà có thêm bát cơm trắng thì nhức nách có thể mắc mắt Thái là hợp khẩu vị nhất nghe bảo bếp trưởng ở đây là người Thái với hơn 30 năm kinh nghiệm Manu đa dạng hơn 100 món đặc sắc của Thái đấy vì cái món tôm càng xanh sốt cà ri độc lạ này mà cứ phải ra đây đậm đà và tôm càng xanh thì chắc thịt canh tôm đem thơm cay đảo sườn lợn vị mà không bị bở ta Thái đây khá là ngon mọi vị chua mặn ngọt cay rõ ràng mà vẫn hài hòa thế nên vừa khai trương cơ sở mới ở vincom bà triệu anh phải đưa em đi ngay còn được hưởng ưu đãi giảm 15% khai trương chứ bạn ngửi thấy có mùi gì không có mùi gì đâu Mùi nghèo đấy nên nói đi nhé,https://www.tiktok.com/@6675890617647940609/video/7313886665360067858
6675890617647940609,7313052978947099911,,https://www.tiktok.com/@6675890617647940609/video/7313052978947099911
6675890617647940609,7312651470531202312,giờ mà có cái ăn cùng nữa thì đúng là 10 điểm không có nhưng đơn giản này mấy lần đi qmart Aeon Mall Big C emart Lotte đều thấy quyền nhân sự của hãng này nên em mua về để mình ăn luôn lại còn giảm giá tặng kèm các kiểu đấy vị bơ hành Về Thôn Dã man luôn mệt mỏi lắm ok phết Đúng là bánh gạo Hàn Quốc Yoyo monkey,https://www.tiktok.com/@6675890617647940609/video/7312651470531202312
6675890617647940609,7311176959847959816,,https://www.tiktok.com/@6675890617647940609/video/7311176959847959816
6675890617647940609,7310796451804712210,Xem mực hôm nay có ngon không còn bao nhiêu mùi kem với nốt mẹ mua cho ít mực để mà sao mà không ra nước dai ngọt thì chỉ cần trục sơ với nước sôi 12 phút là bao ngon muốn mực không tanh thì sao cho ít sa tế tôm chi su nữa cai nghiện rất là thơm luôn rồi,https://www.tiktok.com/@6675890617647940609/video/7310796451804712210
6675890617647940609,7310181888742739207,hai đứa cầm tiền ăn sáng còn tiền thừa mua gì ăn thêm thì mua đơn giản 2 mỗi hộp 1 luôn không có sữa nên em thêm hạt kim chi su làm sao kê và tạo combo để nước dùng trong ngọt thanh ngọt thơm mùi nấm Saga món chay hay mặn thì cũng dùng được mà hợp với món nước lắm được bán song hành cả ở Việt Nam và Nhật Bản đấy là nấu một món ăn mà cả ngày luôn tốn kém hơn đi chợ có 100K Thôi còn lại Sim cũ nước dùng vẫn Ngọc đi Ngọc nấu ngon thật mai mày đi tìm ra là đi chợ tiếp đạn,https://www.tiktok.com/@6675890617647940609/video/7310181888742739207
6675890617647940609,7309322108528561426,chán thì dừng trang thì dừng một bờ suối thì đừng chẳng ai muốn nắm lấy quá khứ lưng chừng vợ của tao,https://www.tiktok.com/@6675890617647940609/video/7309322108528561426
6675890617647940609,7308962894568344839,nhạc Sơn Tùng mấy tháng chơi rồi mà chị không thèm nấu đây ạ một người hút nước hoa thật để anh chẳng phải dùng độ chứ hết mùa đậu đỗ rồi em dùng khởi động lại xem có được không một người khác lại trôi nhạt nhòa Giọt sương vẫn còn đây với ta chưa bao giờ em nghĩ ta nên rời xa thôi,https://www.tiktok.com/@6675890617647940609/video/7308962894568344839
6675890617647940609,7308217574611832082,hai người ăn thôi rễ cực kì luôn không có mong muốn được không đúng là bảo không thay thế từ Huế ra,https://www.tiktok.com/@6675890617647940609/video/7308217574611832082
6675890617647940609,7307586529768099079,"nem Lười quá cho nó nấu nướng gì cả nấu cơm nồi cho nhanh gọn nhất YouTube YouTube từ thiên nhiên có độ pH 5,5 chén luôn Đúng là việc nhà không khó có bao gồm 100 bay xong có người dọn phải thế này thì cũng mỗi câu nấu nướng có anh đảm đang em lười cả đời cũng được ngon nữa nó dịch tiếng Anh nhiều vào địt",https://www.tiktok.com/@6675890617647940609/video/7307586529768099079
6675890617647940609,7307103346563796242,Anh ấy uống kiểu gì thế này làm gì để đủ chất chứ đợi em một lúc Về Nơi Đâu rồi ta sẽ đi về đâu mái tóc người thương remix,https://www.tiktok.com/@6675890617647940609/video/7307103346563796242
6675890617647940609,7306466713036442898,Đặt báo thức 4:01 tự nhiên lại thấy thèm hoa quả Nhưng ăn hoa quả không thì hơi thiếu Thế thì thầm làm phở chay không 10101 thì vẫn chưa đủ ngọt em dùng hạt nêm Chinsu làm Sake và tạo combo giúp nó dùng trong ngọt thanh thơm mùi nấm Saga rất phù hợp với các món canh món nước và món Nhật và món Việt Nam sản phẩm được bán song hành cả ở Nhật với Việt Nam nhưng yên tâm chất lượng nha nước dùng trong thơ mùi nấm mà lại ngọt dịu mở rộng,https://www.tiktok.com/@6675890617647940609/video/7306466713036442898
6675890617647940609,7306008246022671634,"hôm nay mình sẽ tặng quà sinh nhật bất ngờ cho nóc nhà nhiều người bảo tiền lương đưa hết cho vợ rồi làm gì còn tiền mà mua quà cáp nữa Thực ra thì một khi đã muốn thì sẽ có cách thôi đó là tiết kiệm với cả lúc dư giả bạn mua quà cho nóc nhà nó không ý nghĩa bằng việc phải chắt chiu từng đồng để mua được thứ vô ích từ đầu năm nóc nhà đã nói vu vơ là chỉ mong được anh tặng một thời liverton là sinh nhật năm nay Bình Hòa giải thích màu gì thì biết và trả lời riêng nếu anh hiểu em hãy viết một gì thôi đâu đó tôi còn đọc được rằng trung bình đàn ông nuốt khoảng 2,7 kg son trong khi đó phụ nữ chỉ mất khoảng 1,7 cân trong suốt cuộc đời nhưng không sao em thích là được chất sinh nhật 1 tháng mình có đi sinh công tác và tranh thủ đi mua son mắc phải kiếp nạn mù ngoại ngữ nhưng may mắn được đi cùng bà chị trời hành ba chân Dịch dùm và hỗ trợ thành công cho tôi mua cây son em hiểu Cảm ơn chị yêu rất nhiều còn hôm nay tôi sẽ nhờ một bà chị nữa để hỗ trợ tôi tí nữa chị cầm hộp quà là theo em nhé baby nói cho em nghe những điều mà nó vẫn tồn tại hơn không biết nên chị ạ cùng với mạch khuôn mặt gần Mất đi nhân tính thật vô nghĩa",https://www.tiktok.com/@6675890617647940609/video/7306008246022671634
6675890617647940609,7304894003793759506,Anh chuẩn bị máy tính đi mua loa chứ đi đâu Cellphone S bình thường hơn một củ mà giờ có 59 nhưng chỉ trong 24 giờ 9 đến 11 hoặc 14 đến 16 giờ thôi toàn cắt đi giá sắt gần nhất thị trường cái nồi hấp bia này còn có hơn 500 tắm nước H2O có chữ lớn 500k,https://www.tiktok.com/@6675890617647940609/video/7304894003793759506
6675890617647940609,7304239897383030024,buồn mồm thế nhỉ Anh cũng đói mà giờ nấu nướng nó hết sữa đóng phim thôi để em 7 phút trộn chua ngọt đậm đà mà topping còn gọi với nhiều thế mới đã mì trộn hương vị sườn xào chua ngọt của đệ nhất làm vừa nhanh gọn ăn lại ngon sợ mì được bổ sung thêm 10% tinh bột đậu Hà Lan giòn dai mà bóng nữa rồi Chắc phải là nói nữa thôi,https://www.tiktok.com/@6675890617647940609/video/7304239897383030024
6675890617647940609,7303496058439503122,"tao gọi xem mày làm gì Thôi mẹ con hết đi rồi con gửi cho em Ok À mà chưa nói xong lại tắt xong rồi ăn không Mẹ ship cho cái gì thế này mẹ gửi cho con cái gì đấy mẹ lại sập nguồn rồi ôi số điện thoại này cũng được Samsung Galaxy m54 này đi 6 nghìn Map trên giờ không lo dùng nguồn nữa màn hình to mượt mà còn có camera 108 megapixel chống rung iOS chụp ảnh cho nó rõ cho mẹ chụp ảnh mờ thâm 10 triệu thôi mà con còn mua đúng luật thế giới di động mở bán nên được giảm thêm 1,5 triệu cơ gì nữa chụp đẹp ra phết",https://www.tiktok.com/@6675890617647940609/video/7303496058439503122
