author_id,video_id,video_transcription,url
6968898955178542081,7430794680670899476,rồi rồi Ra liền ra liền thử thách xe cứu người khổng lồ theo nguyện vọng của cu shin đặc sản ở đây không phải là trà sữa nha mấy bạn mà là em biết rồi cứ ngồi trên tiktok em có chơi đó bây giờ chưa coi Thôi từ số 1 đến số 100 em chọn một số đi thì cái con số đó sẽ là nguyện vọng của em số 9 em bóc ra số 9 thì em sẽ thêm một túi nữa Còn nếu mà em bóp dưới mệnh giá 10 thì chị vẫn sẽ cho em thêm một túi,https://www.tiktok.com/@6968898955178542081/video/7430794680670899476
6968898955178542081,7429664253797305617,khoảnh khắc rất là nhiều người sợ cái móng đen thùi lùi này với hai Lý do thứ nhất là về phần nhìn còn thứ hai là về phần 7 lớn có thể bạn sẽ thay đổi nếu như cùng muội đi đến cái quán không khí này ra tại đường Âu Cơ quận 11 này Đây cũng là một chiếc quán khá nổi tiếng về đồ ăn Người Hoa có tới 4 chi nhánh tại các quận luôn rồi đó đại lý do hôm nay tôi dắt mấy bà đến đây là tiền hút máu đang nằm trong tuần của tiên nước lèo mấy bà chỉ cần lên coca-cola phấn đỉnh thôi là còn nhận được voucher ăn uống siêu bất ngờ từ coca-cola nữa đó nghen thôi quay lại vấn đề chính hôm nay Mùa Xuân Gọi một vài món bánh xèo lò để giới thiệu cho mọi người món đầu tiên này tìm thuốc bắc tới cái tên thôi thì chưa ăn cũng sợ lắm mà ăn được gọi là gì nha thịt gà được hầm rất là mềm mà vẫn giữ nguyên được cái sự tươi ngon vì nước lèo thì đậm đà Thanh ngọt ấm nóng mà đương nhiên là tốt cho sức khỏe giữ luôn á tại được hầm từ các loại thuốc quý không ạ tinh túy nhất là nằm ở phần đất liền á nên mới ăn có món đầu tiên tên là tôi có lý do để bóp cho cái quán này rồi uống thêm tí coca-cola Mát lạnh giải khát thì không còn một cái nữ nào để chê nữa Thôi thôi tiếp nè đến quán mì thì sao mà không ăn mì được Đúng không mấy bạn 10 điểm không có nhân nghĩa gì hết trơn rồi mì vàng ươm nhỏ dài hòa quyện cùng với phần nước dùng nguyên chất làm từ xương thì nên là siêu siêu ngọt thanh nhưng không kém phần đậm đà thịt vịt tươi chắc không có bị khô mà còn ăn kèm chung với đu đủ ngâm chua nữa thì hết bài cái gọi là hết liền luôn được không khỏi suy nghĩ tại vì không chỉ có đồ ăn ngon mà không gian quán cũng rất là nha mấy bạn theo phong cách Quảng Đông rất là rộng sạch đẹp tạo cảm giác ấm cúng cực kỳ thích hợp để đi cùng với gia đình đủ lý do để bóp rồi thì hãy cùng tôi lên ngay coca-cola phấn chọn chiếc quán Đỉnh này để leo top thêm nước lèo nhé Vậy thôi là nhận được ngay cái bầu trời ăn uống siêu bất ngờ từ coca-cola quá là dễ nhớ rủ thêm bạn bè và gia đình chơi chung cho vui nha mấy bà,https://www.tiktok.com/@6968898955178542081/video/7429664253797305617
6968898955178542081,7429193358137953553,bạn đã xem video này vào lúc mấy giờ búp bê Apple nữ sexy Tự nhiên thèm ốc nướng và sốt cay cay nên ra quên mất lượng một bài hát đủ thứ nguyên liệu về nhà làm ăn cho đã cái miệng công thức cái món này phải gọi là đơn giản cực kỳ phần quan trọng là nằm ở các nước mắm mua dùng loại nước mắm Nam Ngư cá cơm tươi chai thủy tinh nhìn sang xịn mịn hơn chất lượng thì mới vừa đổ vào thôi là nó dậy bị thơm lừng cái mùi thật sự luôn đeo thật là điều sau đó ướt cỡ 50kw,https://www.tiktok.com/@6968898955178542081/video/7429193358137953553
6968898955178542081,7428614837753613576,Đây là một hình thức lừa đảo mới đặc biệt là dành cho những quán bán đồ ăn thức uống và những bạn tiktoker chuyên review tích cực kỳ luôn đó mọi người chuyện là vừa qua có một cái account giả là agc tên là jun đó và tên thật là Trần Thị Thu stk cũng là Trần Thị Phương Linh Chắc chắn là tên thiệt trung gian làm việc với lại các quán ăn để bứt các bạn thích tóc cơ đến review chi phí các bạn rất tốt cơ bản như thế nào là bạn đó sẽ chốt như thế đó luôn và cũng hẹn lịch cho các bạn kết thúc cơ đến quán để review ý là quy trình nó sẽ giống như những gì mà bạn đã từng làm vấn đề là bạn sẽ không được nhận tiền cọc trước mà sẽ nhận Phương tiền sau khi đã hoàn thành xong clip Nhưng mà khi hoàn thành xong clip thì sao gửi demo thì bạn đó cũng biến mất luôn cái vấn đề này thì nó cũng là lỗi sơ suất bên ekip của muội đã không có nhận tiền cọc trước sau khi mọi chuyện xong xuôi hết rồi Mùi hỏi ra thì mới biết và mối liên hệ với các anh quản lý marketing bên đó thì anh cũng có nói là không có bút kinh gì ở đây hết nhưng ảnh có làm việc với bạn đó qua trung gian mỗi khi mà nhận được điều một clip là anh sẽ gửi full tiền cho các bạn Thu Hương nó nhận nhưng sẽ không trả bất cứ một đồng nào cho những bạn đã đến review gửi đến các chủ quán ăn đặc biệt là đừng có chuyển tiền gì cho stk Trần Thị Thu Kết quả là cả nhãn hàng lẫn các bạn Tik Tok cơ mà đi review đều bị lừa hết đều không có tiền và cũng không có clip Hiện tại thì Mùi có nghe thông tin từ quán là thu vẫn còn đang rút rất là nhiều các bạn tiktok review khác nữa Nói chung là cái vấn đề này cũng nằm ở loại sơ suất bên Tiên liên kết của muội thì muội chỉ muốn gửi lời cảnh báo đến các chủ quán ăn hoặc là nước uống với lại các bạn chuyên đi review mọi người nếu mà có làm việc với lại Thu thì được dừng lại hết đi không có được cái gì hết á mất thời gian,https://www.tiktok.com/@6968898955178542081/video/7428614837753613576
6968898955178542081,7425106944962104584,bạn đã xem video này vào lúc mấy giờ búp bê mì trộn cay nhập phô mai hôm nay đi siêu thị mới phát hiện ra cái gói mì xào bò phô mai Cay của nhạc bolero mới ra mắt luôn hay sao á nên cùng múa ăn thử coi có ngon không nấu đơn giản vài bước y như các loại mì trộn Hàn Quốc thôi Quan trọng là các sợi mì và cái vị của nó sẽ như thế nào thì ăn mới biết được thêm một cái điểm đặc biệt khi ăn mì nữa là trong tủ lạnh còn thấp bên nào thì có bỏ vô hết cho tôi như mùi sẽ có phô mai phô mai mozzarella xúc xích trứng chiên đơn giản vậy thôi giờ thì mời cả nhà cùng ăn chung với muội nha công nhận là mì mà ăn chung với shopping như trứng xúc xích đồ là chỉ có O và cái vị mì này cứu nha mạng nào vừa bạn thêm xíu cây tre lại còn thơm béo của phô mai Bạn nào mà thích ăn mì xào mì trộn đồ đó thì gói này nên nằm trong clip yêu thích nghe thử đi biết đâu là ghiền đó,https://www.tiktok.com/@6968898955178542081/video/7425106944962104584
6968898955178542081,7424747006679092487,top những chiếc đầu cơ hậu đậu nhất Việt Nam bởi vậy Để giải quyết những các tình huống như thế này cho đỡ mất thời gian thì tôi phải nhờ tới bọt Tuyết lau bếp của nhà Sunlight sản phẩm này có dạng bọt Tuyết nên rất là dễ sử dụng và ý thức đúng 5 giây để lau sạch các vết bẩn với những vết bẩn mới chỉ cần xịt một chút Bạch Tuyết sau đó lấy khăn lau lại bề mặt là vết bẩn là biến mất tiêu rồi đối với những vết bẩn lâu ngày mấy cái vết bẩn nước nhiều cà phê thì tụi mình xịt rồi đợi từ 3 đến 5 phút không cần rửa bằng nước hay gì hết chỉ cần lau nhẹ nhàng lại bằng khăn bếp đã sạch kim chi không một vết thương mà muội thích ở sản phẩm này là cái sự tiện lợi nhanh gọn không chỉ là mặt bếp mà có thể sử dụng trên rất là nhiều các bề mặt khác nhau đó thể là tủ lạnh lò nướng cần bếp hay kể cả là bồn rửa chén Bởi vậy mà giờ muỗi đã tự tin với mẹ hơn rồi vào bếp mà có lỡ đổ tháo thì chỉ cần 5 giây là làm sạch lại ngay mà thích nấu ăn hay vào bếp các kiểu thì cái chai bọt Tuyết đầu bếp của nhà xanh lai này rất là tiện dụng và cần thiết đó nha,https://www.tiktok.com/@6968898955178542081/video/7424747006679092487
6968898955178542081,7424457282924055816,trần đời đi ăn lẩu bò chưa bao giờ thấy quán dốc hết thịt ra chỉ để lại xương mà lấy tới tận 200kg ở đâu Tôi không biết chứ mọi người lưu ý dùm cái quán net 97 Ung Văn Khiêm quận Bình Thạnh à nha Cái nồi lẩu xương ống ở đây là vừa có Ê hồi xưa mà thịt ăn cũng ná thở luôn đó 5660 bự chà bá đây nè 200.000đ Lúc đầu thấy ảnh lốc hết thịt ra để mỗi cái xương vô nồi thôi Tưởng Susu rồi đó ai mà có về bao nhiêu thịt thà khúc sau là cũng bỏ vô nồi hết luôn ta nói hả đầy đến nỗi mà múc ra không được luôn đó mọi người rồi sao bỏ mì vô đây với cái lẩu Như vậy muội đi có hai người là chắc chắn mùi sẽ không ăn mì người ta ăn thịt với lại nước không mà nhiều khi còn không hết nữa đem về vấn đề chính phần thịt mềm gân thì gần đây còn có thêm cái lớp tủy béo béo nữa tao nói nó nói luôn mà lạ kỳ là mùi đặc biệt thích cái phần nước lẩu nha vị mặn ngọt vừa vặn lắm đặc trưng là cái gương của sa tế các bạn sa tế ngon lắm Các bạn thơm thì cái nồi này 3 4 người ăn mới đủ chứ mình tôi là uống thử cái bụng bự luôn Ngoài ra thì ở quán còn có mấy món nhanh như là cải chua giòn sạch hay là còn có cả bê thui cho cả nhà thưởng thức món ăn ngon rau tươi búp bê bên trong thì mềm ngọt xong là vợ bạn cần chế biến ở đây khá là vừa và hợp khẩu vị với mỗi giá cả theo mùi thấy thì hợp lý với chất lượng không gian nữa nên khá là thoáng mát đậy nó là quán bà cũng là một địa điểm xứng đáng để bạn Lưu lại để cùng bạn bè và gia đình đến trải nghiệm thử đó nha,https://www.tiktok.com/@6968898955178542081/video/7424457282924055816
6968898955178542081,7424364396207410439,bộ bộ phim kinh dị Thái có cô bé đặt trước cao nhất mọi thời đại tại Việt Nam môn toán phần 2 không quá bất ngờ khi phần 1 của bộ phim này đã đạt mức Doanh thu cao Ngất Ngưởng gần 400 tỷ và clip này có boy nhẹ phần 1 Tôi chỉ coi online thôi nhưng vẫn ám ảnh về ánh mắt của da và âm thanh con quỷ trong thi THPT trong truyền thuyết dân gian của thái lan khác với phần 1 quỷ chỉ ám đúng một người thì phần 2 nó Hốt cả gia đình luôn chỉ xào lẫn bối cảnh được đầu tư khủng hơn rất nhiều vì tiếng vang của phần trước điểm nhấn vẫn là nam chính nades ta nói đẹp trai má hú luôn mà phần này cởi mở hơn nhiều nha đếm socola phải gọi là cục cục sầu riêng chín cây thơm phức hai thì vẫn có hai đó nhưng cảnh báo đến những bạn sắp đi xem hùng rất nhiều nhấn mạnh là cần cần sự giải trí đi kèm tính kinh dị với mức đầu tư khủng nên phần này sẽ khiến người xem có nhiều trải nghiệm mới mẻ và cốt truyện kịch tính hơn với mụn thì phần này còn hay hơn phần trước gấp nhiều lần hiện quỹ anh tặng 2 đang được chiếu trên tất cả các cụm rạp vậy đừng quên tát đứa bạn thân vào để rủ nó đi xem cùng Nhớ là đừng có đi một mình nha,https://www.tiktok.com/@6968898955178542081/video/7424364396207410439
6968898955178542081,7423668162559855890,thử thách cây mít thối nhất giải nhất thế giới của mẹ chồng cảm giác nó nhức nhức cái đầu tôi thôi tôi bỏ cuộc đậu hũ Siêu Thú cuồng thử thách hiểu chưa này sẽ được chơi với 4 cách kéo con sấm sét thì Mọi người lựa chọn kết quả dây kéo dài nhất thì người đó chiến thắng thì phải có cái sự cẩn thận chắc chắn tôi sẽ là người chiến thắng dân gian khác thay nhau ăn kẹo ai ăn nhanh hơn người đó thắng xe cẩu nào là một thiết bị trái cây khác nhau rất là thơm đó ăn rất là dẻo luôn Ăn nó càng lâu nó sẽ càng cuốn cái khẩu vị Nó rất là thơm ăn rất là nhiều luôn rồi đó luôn hả 631 thì 19498 và trở thành vua trò chơi còn mọi người hãy rủ bạn bè chơi cùng để xem ai là vua trò chơi rồi nói cho mày biết nha,https://www.tiktok.com/@6968898955178542081/video/7423668162559855890
6968898955178542081,7420301615950810376,thử thách ăn các món ăn vặt hot teen cùng với tương ớt cay nồng với cái thử thách này thì Người Bạn Đồng Hành hôm nay của muội chính là tương ớt Chinsu Chacha bắt đầu với món thứ nhất đậu hũ thối nhà họ lan kêu hai loại là tương truyền thống và sốt phô mai đặt trứng thật sự thì cái mùi của nó dễ ăn lắm đó nha các phần sốt ngon thiệt Cho miếng tương ớt Singapore nên tạo thêm chế độ cay cay nữa cũng cuốn cũng hợp à nghen tiếp tục với các món thứ hai là Turn off Facebook nên là cái món này nó Đa vị luôn từ mạnh và béo thơm thịt thêm miếng tương ớt lên nữa là cây tròn bị lưu lại này cây nằm hơn tài được làm từ gấp đôi lượng ớt chỉ thiên qua các quá trình nướng rồi ủ lên men nên là vị thơm cay dùng thay cho ớt trái được luôn đó sang tới cái món Thứ Ba Nha khủng long móng này có hương thơm từ hải sản nướng hậu vị đối với bụi thì sẽ hơi ngọt nhẹ thêm vị cay Lại giống như là mình đang ăn mấy cái loại khô nướng mà chấm cùng với tương ớt vậy đó Nói chung là món này cũng cũng thôi nha Cuối cùng là tới món được nhiều bạn trẻ ăn nhất là tưởng nướng đá trong bốn món nãy giờ thì cái món này phải gọi là off luôn khỏi bàn cãi bản chất của cái món này là phải dùng bột ướt nhưng mà thử thay thế bằng cái tương ớt xay ra cha thì cái vị cay nồng nó cũng tương tự đúng là cái loại tương,https://www.tiktok.com/@6968898955178542081/video/7420301615950810376
6968898955178542081,7419231552816860434,đùi gà mà có vị nghe thiên hạ đồn là các sản phẩm mới của anh cùng Bạch Tuyết có cái vị lạ lắm nên mùi đã đặt về ăn thử trên tay Muội đang là 3 hộp đùi gà cay cay sản phẩm này đang gây tranh cãi bữa giờ tại vì sao đùi gà mà có vị của lạp xưởng nướng đá để ăn thử coi cái vị nó làm sao cái mùi quen lắm không Nó có bị tôi lạp xưởng nướng đá Việt Nam giống như là tưởng bóng đá vậy Hehe mạnh nặng review tôi không tin tôi mua về tôi ăn tôi lấy giống mùi nó xạo chị thử đi để biết cái bị của nó như thế nào nha,https://www.tiktok.com/@6968898955178542081/video/7419231552816860434
6968898955178542081,7418802122260565256,chị uống trà sữa nhai luôn cái ly trà sữa Về làm cho mấy bạn coi 45k 45k là bao nhiêu 1 lít nước ở các tiệm xăm mini ngay số 41 Đồng Đen quận Tân Bình mới nhất cũng có giá 15.000đ chỉ trong vòng 3 ngày 27 28 29 tháng 5 tới trà sữa Nhìn cái dàn 25 loại thấp bên đây nè Nội trân châu dẻo thôi là 4 loại trà đen Hoàng Kim với gạo nâu trân châu phô mai phô mai viên cục nào cục đẩy cây bàng luôn tươi dày ăn miếng nào làm mát em mở miếng đó vẫn như lần trước bản thân mình sẽ lấy comment mọi người uống các loại từ trà gạo nâu không phức tạp với tôi Cái đó là 60km trà sữa tham gia luôn cái ly Bây giờ tôi làm nha trà sữa thì vẫn ngon nhưng lạnh lại càng thêm lạnh rồi đó uống trà sữa nhai luôn cái ly thì hàm răng từ 32 cái tới còn nửa cái nói chung là hoàn thành được cũng mấy bà còn thấp được gì thì khách luôn đi nha,https://www.tiktok.com/@6968898955178542081/video/7418802122260565256
6968898955178542081,7418507689333984519,"hết ngày trở thành trưởng thành tài khoản âm tiền mà hỏi xíu tổn thương đòi đi camping dựng lều đồ đó thì ở nhà dùm tôi con gái tôi giận một cái cắm trại thu nhỏ tại gia cho mấy bà coi đây là cái ban công bỏ trống không có để làm gì hết trơn á thì bắt tay vào dọn dẹp sạch sẽ trước xong rồi Bước tiếp theo sẽ là lên ý tưởng để đỡ mất thời gian nhức đầu khi suy nghĩ nghĩ thì mày sẽ nhờ sự trợ giúp của cô hơn Đây là nền tảng thiết kế nội thất all in one các công cụ này cực kỳ dễ dùng chỉ cần một cái máy tính mới thao tác kéo và thả 0,01 là vẽ sơ đồ mặt bằng 2D 3D và bố cục thiết kế thông minh bằng công nghệ ai ai đã hơn hết là thiết kế nội thất tùy chỉnh dựa trên thư viện mô hình 3D với hơn 1 triệu mẫu khách sạn hơn là 100.000đ một bộ sẽ được coi lên như thế nào rồi đúng không Bây giờ muội đã hoàn thành xong cái bản thiết kế rất là dễ dàng Đơn giản bây giờ sẽ tiến hành được coi là ban công nha Với cần xét cắm trại thì dưới cái mặt sàn tôi sẽ trải một tấm thảm cỏ xanh tạo cảm giác cho nó chân không Rồi dựng lên đó một cái lều bốn chân từ cột cho nó đỡ chi phí lót một cái thảm lông ở dưới xong rồi đỡ bị nhột nhột theo thêm tí đèn cho sáng sủa chơi thêm bàn bếp nướng ghế nguội nên thay bằng cái thảm Caro trên ban công có cái giá treo bông mà không thấy bông nào hết Cần Giờ có bông rồi đó tiếp theo là cuốn treo đèn đom đóm xung quanh đính kèm mấy cái hình cây cỏ xanh lá cây nó thêm phần thiên nhiên gồm có các bước cuối rồi Cố lên gấp gấp máy chiếu có cái nghe nhạc coi phim Đổi nhạc Giờ chỉ cần lên đèn lên đồ ăn mở 2 ngày 1 đêm ngồi đó tận hưởng là đủ để chữa lành rồi đó mấy bà xem thử cái hiện thực này nó có giống như cái mẫu thiết kế hồi chưa Tôi làm không Bởi vậy mọi người sắp tới có dự định đi co hay xây nhà thì tham khảo thử cua không đi Nếu mà thấy thích hợp muốn nâng cấp lên các gói rồi thì tôi có cái mã trên màn hình này giảm 72% lần đó nghỉ hè đừng quên lưu video này lại Biết đâu sau này cân",https://www.tiktok.com/@6968898955178542081/video/7418507689333984519
6968898955178542081,7417791870547299591,tụi mình tâm sự chút đi một ngày tồi tệ của bạn diễn ra như thế nào còn mùi thì hỏi mẹ ơi ngày mai tao nghỉ liền đó nhưng sợ quá trời cái gì cũng được Chứ cái này thì làm sao hình cái khác ý chụp em ở đây buồn quá Chị gửi em thiệp cưới nè Tháng sau sắp xếp đi đám cưới chị nha đúng rồi đó bé chồng chị nè Đẹp trai nha đúng rồi Thôi chị đi nha Bye bye Nha Trang Đà Nẵng thì sao 1 2 3 trước khi uống mình phải làm sao giải độc đắc xổ số miền Bắc thứ hai thì cứ vui trước đi chuyện gì thì mai tính tiếp mấy bà cũng vậy đó nghen,https://www.tiktok.com/@6968898955178542081/video/7417791870547299591
6968898955178542081,7417020948253068552,bộ đã biến một chiếc ban công bỏ trống từ như thế này thành như thế này bằng cách nào để làm được như vậy thì bước đầu tiên phải có những món đồ để cho tôi sẽ đi xuống nhà gom một đề sản phẩm đã đặt trước đó để inbox xe nhé Thứ hai tuần trước muốn làm thành một cái nơ canh Minh đi camping thì chắc chắn không thể thiếu bếp than để làm gì ăn đồ nướng được hai cái bẫy luôn không có tốn ship luôn free ship quá đã đây là chiếc bàn học vừa làm bàn vừa làm hộp được nghe lại miễn phí ship inbox luôn cái đèn này chỉ có giá 80 đúng không khi xếp được nói nãy giờ cô đơn không free ship thì được giảm giá hỏi giờ ra mới biết là thứ hai phim tiếp cổ tích khóc đây đây thứ hai phía trước là khi mọi người mua hàng vào thứ Hai hàng tuần trên tiktok shop để được ưu đãi freeship 100k cho đơn hàng 0đ cách tra freeship lên đến 700k bưu điện 50 phần trăm voucher lên đến 222 cạnh cách lấy voucher thì cực kỳ đơn giản mọi người vào trang mua sắm của Tik Tok shop này nghe bài hát sẽ thường tự hiện ra màn hình để mình bấm nhận Còn không thì vào cái mật mã vận chuyển này gom hết voucher là sao hoặc là mọi người có thể nhận mã freeship được ghim ngay trong tương lai ở đầu giỏ hàng cũng được đó đơn giản vậy thôi mà tôi mua hết hơn 10 sản phẩm không tốt 1 đồng tiền ship mà còn Tiết Kiệm gần cả triệu nữa Quá đã đó Giờ nghe nhắc tới thứ hai là thấy mệt mỏi trong người mà giờ là nôn nha Cứ cầm tới đúng thứ Hai hàng tuần mà lao vào Tik Tok shop Tìm đồ đạc rất lãng phí ship ầm ầm luôn đó giờ còn phân biệt cơ quan công mấy bà thấy sao tương tác đồ đi để tôi có động lực ra phần 2 sớm nha,https://www.tiktok.com/@6968898955178542081/video/7417020948253068552
6968898955178542081,7416654712440737031,hôm qua mới ăn rồi muốn ăn cái gì và đây là cách trị những đứa ăn gì cũng được Bây giờ xoay vô cái nào ăn cái đó không có chọn lựa nó nghe chưa sốt nướng muối ớt Vậy thì nay sẽ làm hải sản nướng muối ớt cho nó ăn nguyên liệu cực kỳ nhanh lẹ tôm có bạch tuộc có chỉ cần thân thấp cái tay ướt với gái chim sâu sốt nhẹ hàng nướng muối ớt là được đó các thành phần tươi ngon tự nhiên từ ớt muối tỏi Sẵn đây thì một giới thiệu cho mọi người 8 loại sốt nhà hàng của chim su luôn có 8 loại này là mọi người dễ dàng chế biến ra tận trăm món ăn với công thức chuẩn nha đam có thể chế biến được nhiều món khác nhau từ mỗi gói quá là tiện dụng như cái tôm bạch tuộc này để ủ nửa tiếng 45 phút là giờ Đem đi nướng được rồi nè Tao nói hả Cái màu nó đẹp mà cái mùi đó kim chi đỏ áo thơm phức nhỏ ngon thường chấm luôn Ăn cái vỏ luôn nó sẽ thấm vào cái phần tôm và phần Tôm nó còn nhỏ nhưng mà tôm như vậy là cũng rất là thấm rồi nha rất là đặc biệt muối ớt luôn đó phải được không vừa rẻ không Mấy bà cái nhỏ bạn thân hay anh chị em nào có nốt y chang vậy thì thử làm theo cách của tôi nha,https://www.tiktok.com/@6968898955178542081/video/7416654712440737031
