author_id,video_id,video_transcription,url
7163686821477729306,7318017146586418433,Tôi không ngờ là cái ly bạc xỉu vừa đẹp vừa hấp dẫn như vậy mà chỉ có 20 cành Mặc dù là Quán vỉa hè nhưng có cái view rất là nhiều mát mẻ nữa Chưa kể là có cái món cà phê cốt dừa chỉ có 35 cạnh hơi bị xỉn à nha Hello Tại tao ngủ là ngủ đi ăn đây cái quán này trước nổi tiếng bên Phan Đăng Lưu lắm nè Giờ mới biết giờ về chỗ này nơi nuôi rất là hạt dẻ cho từ 1 8 0,https://www.tiktok.com/@7163686821477729306/video/7318017146586418433
7163686821477729306,7317865830186781953,Mặc dù chỉ là một cái xe ăn vặt Đường Phố kiểu hàng nhưng mà mới nói rất là đa dạng ngang chỉ từ 2 0 4 0,https://www.tiktok.com/@7163686821477729306/video/7317865830186781953
7163686821477729306,7317647546690587905,người ta nói ăn bằng mắt đâu có sai đâu Chỗ này bánh khọt bánh xèo coi có cái bánh xèo hủ tiếu bò ngoài đẹp mắt ra thì tôi thấy chất lượng anh chủ để lên hàng đầu với cả rất là hợp số sàn nên khách mới đông đen như vậy luôn đó Hello Bạn có hiểu là mỗi đi ăn đây Mặc dù nằm ở Hóc Môn hay là hủ tiếu mực là tôi tìm đến cái quán này với tiêu chí Món không ngủ ngon mà phải sạch sẽ như vậy thì tôi nghĩ anh chủ nó còn có tâm với cả trình bày món ăn rất là đẹp mắt một dĩa bánh khọt sáu cái như vậy chỉ từ 35 tuổi Ông hỏi bạn nhân viên đẩy nhẹ cho tô hủ tiếu mực đặc biệt 105 cành to ứng xử người thường không ăn hết được đâu nào là xí quách mực tôm rồi chả cá trứng cút mực khô Quan trọng là nước lèo được nấu bằng nước tinh khiết Oxi và hầm từ rau củ quả nên vị rất là đặc biệt mực là mực câu luôn nha mấy bà chưa kể là cái bánh khọt ở đây bột gạo là quán tự xay với cả lấy nước suối tinh khiết oxi để pha bột cảm nhận của tôi là bột rất là béo và thơm thì được bóc vỏ rất là tươi quan trọng là cái nước mắm này nè Nó rất là đậm đà ăn như vầy nè Trời ơi tao nói nó đã lắm mấy bà ơi hết nha có vấn đề chưa có 7 cần một cái mà thịt quá trời luôn nghe nói thật quán tự mua về rồi xoay luôn đó Bởi vậy khi mà mấy bà qua đây ăn nó sẽ cảm nhận được chất lượng liền món nào trong đó mấy bà Ngoài ra thì đây còn có canh chua cá ngát và cá ngát kho nói con cá nó dẻo dai béo bát cơm lắm luôn Nói chung là tôi rất là ưng cái quán này mấy bà trải nghiệm thử nghen bye bye,https://www.tiktok.com/@7163686821477729306/video/7317647546690587905
7163686821477729306,7317492580978003202,đi ăn đồ nướng chiều rừng thông mà không gian như một quán cà phê xinh lung linh như vậy nè Ngoài ra thì hải sản cho tới bò rất là tươi nha mấy bà Bởi vậy tôi đi thứ hai mà khách trong đen cỡ này luôn đó là buổi đi ăn đây kiểu nào mà cho ly cà phê Chắc chưa tới tối khí hậu mùa này khá là lạnh ba càng lạnh ăn đồ nướng mới đặt cái ngang ăn cái bài như vậy tầm 200 cạnh gọi là thấy no phần này là bò tản sốt trứng muối với bò cuộn nấm kim châm vào vị trí này rất là dày muốn biết thai như vậy nè thịt nó mềm cháy sáng cạnh nó hấp dẫn lắm mà cái miếng bò tản thấy bà nướng vừa vừa thôi để nó mềm và bọng nước như vậy nè chấm thêm sốt trứng muối tao nói nó béo hay là cuộn rau chấm muối ớt xanh trời ơi nó dính đã cái nuôi gì đâu mà bò mềm ăn nguyên miếng như vậy hơi bị thích à nha Tôi còn gọi thêm một phần sò điệp nướng mỡ hành dữ lắm à nha ngoài đồ nướng ở đây có mấy cái món lai sau giống như ếch chiên bơ tỏi vừa thơm vừa thấm vị ăn nóng nó đã còn mà để no tôi gọi thêm mì xào bò một dĩa cũng khá là nhiều nghen Nói gì Nói cho cái dĩa gỏi hải sản ở đây ở trộm rất là vừa bị rơi lạnh lạnh ăn một xíu cây như vậy Tự nhiên nó cuốn Nói chung là tôi mê cái tiệm nướng này rồi đó nha Không những đồ ăn hấp dẫn phục vụ là nhanh nhẹn thêm một chiếc tiêu Cưng xử như vậy đáng để trải nghiệm nha mấy bà ơi Bye bye,https://www.tiktok.com/@7163686821477729306/video/7317492580978003202
7163686821477729306,7317273992962804998,Pokemon trong nhà mà nhìn quen thuộc đậm đà quê hương đi tôi mới biết một quán cơm niêu với Hương vị như là mẹ nấu nằm ngay trung tâm quận 2 khu đảo kim cương đó mọi người lại kế bên bờ sông rất là mát mẻ trong đêm luôn đó Hello Carbot đi ăn đây tôi thấy chỗ này còn có phòng riêng cho gia đình và nhóm bạn nữa mâm cơm quê hôm nay rất là dân dã và quen thuộc ngay món này là rau xào thập cẩm rất là tươi xanh nha 55 cành một phần lâu lắm rồi tôi mới ăn cơm đốt với mỡ hành đó mọi người thêm một số thịt rang mắm tép với 59 nghìn phải nói là ăn mấy cái món càng giản dị Tôi thấy nó càng cuốn nó mấy bà ơi Nhìn có thối thịt kho tàu trứng này làm nóng Đến Tết Rồi mẹ thôi cho một nồi ăn từ mùng 1 cho đến mùng 8 mà không có ngán nha Chơi mà cái số này khỏi rất đậm đà miếng thịt ba rọi thấm vào mồm lắm Nói gì Nói cho mâm cơm Việt lúc nào cũng có cá kho cá hú kho tộ rất là thấm vị mà không có bị tanh mấy món xào thứ hai là bò xào cần hành bò khá là mềm dưới này rất là nhiều bò mà chỉ có 79 cành Hà có ai thích ăn cơm niêu cháy như vậy nhưng tôi không một chén vừa có rau có trứng có thể quá trình dân dã đậm đà quê hương tính ra tầm trăm cạnh người mà ăn một bữa cơm trưa đủ đầy lắm nha món cuối cùng là canh chua cá lóc 89 cà rốt nguyên cái ruột cá như vậy nè Ăn canh cá lóc làm sao thiếu nước mắm ớt được không có canh chua nóng hỏi nuôi chưa cay cay đậm đà rất là vừa vị lai ra chỗ này còn là một quán cà phê có cả bún bò ăn sáng,https://www.tiktok.com/@7163686821477729306/video/7317273992962804998
7163686821477729306,7317122369787546882,nếu mà nó cài đặt Bluetooth là chỗ này ra vừa chắc thịt vừa mọng Quan trọng là ngồi ăn mà được ngắm mấy cái lồng đèn như vậy nè Nó vừa đẹp mà thoải mái lắm luôn đó Hello Bạn có ngủ là ngủ đi ăn đây bước vào chiếc quán này y chang như một cái lễ hội Lồng Đèn Bởi vậy điểm nổi bật của Hương quán là đây chứ đâu phía bên ngoài được ngắm thành phố trên cao thích lắm luôn hôm nay tụi tôi đổi gió ăn món Tây Nguyên và đập luôn cái món vừa nhắc đến nhớ liền tới hương quán là đây 8 điểm phần nhìn thì 9 điểm cho chất lượng nhanh thịt gà được ướp rất là vừa về da chắc thịt mà nó không thức Hà Mai miếng thịt bò Xé ra như vậy là còn mụn nước luôn đó rồi bây giờ là bằng thế lực nào Cái món này nó cuốn từ từ Sài Thành lên tới Đà Lạt đó tôi vẫn ăn tuyết thịt như vậy nè chấm với muối ớt đỏ nói câu chuyện chuyến này với tôi luôn ăn miếng thứ nhất là muốn nghe tiếp miếng thứ hai một con như vậy là 340 kg để mà lai rai tôi gọi thêm rau bún xào tỏi còn món này là cá tầm nướng cuốn bánh tráng nè mọi người cá tầm khá là tươi được ướp rất là vừa vị chấm thêm mắm chua ngọt của nó đúng ghi bài se se lạnh nó diễn viên phải đẩy nhẹ thêm cái lẩu Cái này là lẩu sườn Thái chua cay có cả bún và rau ăn kèm rồi nè chua chua cay cay đậm đà Quan trọng là mấy cục sườn nó cũng thịt không à nghen ai mà thích đội chó ăn đặc sản Tây Nguyên với Đà Lạt thì ghé thử chỗ này Ngang vừa thấy rất là ok la đó Bye bye,https://www.tiktok.com/@7163686821477729306/video/7317122369787546882
7163686821477729306,7316903996680129793,lâu lắm rồi tôi mới đi ăn lẩu bò nay tôi thấy có món bò viên bò Mông Cổ chưa kể là cái lỗ nhỏ 23 người ăn như vậy chỉ có 150kg Ngoài ra còn có bò là cảnh bò Tùng xẻo chất lượng lắm à nghen là buổi đi ăn đây nhìn cái tủ topping sắp xếp gọn gàng như vậy là khóa rồi nào làm bò lá số tử vong còn có đuôi bò lòng bò Phèo Lá Me Bay đậu hũ khoai môn đầy đủ mấy bà nhìn cái quầy rau nè tươi xanh sạch sẽ à nghen cái lẩu bò này là lỗ nhỏ nè mọi người 1503 nhân thịt uống rượu chấm với cháo Tao nói đúng ghi bàn cái lẩu bò này ba người ăn no nên là có thể ngoài ra thì bò tơ hấp cuốn rau rừng của bộ mát lắm muốn chấm với rau cùng mắm nêm nó chua cho nó đã còn cái này là thịt bò nướng mắm nhỉ cắm đầu bò Tùng xẻo Có cả rùa bò nấu mắm nhỉ một phần nó chỉ từ 129 Thành Hà được một cái là bò ở đây rất là mềm còn cái sốt rất là vừa vị chấm cỡ nào cũng dính sáu người ăn no đi mà chỉ tầm 150 cạnh người mấy bà ơi nói lại rủ gia đình bạn bè đi ăn là hợp lý luôn rồi đó Bye bye,https://www.tiktok.com/@7163686821477729306/video/7316903996680129793
7163686821477729306,7316752294509399297,với tôi một nồi lẩu gà lá é thật sự hấp dẫn là phải có ba tiêu chí và phải vay và chấp thuận nước lẩu thì phải thành và quan trọng là phải phù hợp với túi sàn Bởi vậy tôi chọn cái tiệm này lẩu gà lá é Phú Yên nhưng mà nằm ngay trung tâm Đà Lạt luôn đó Hello Tại có Hữu là là buổi đi ăn đây cái lẩu này của tôi là 250 km rất là nhiều gà ăn 3 người khá là loại khá nhiều măng với nấm có cả trứng non luôn nha mấy bà ơi là trời cái nào quá chừng thời đổi đây sử dụng gà ta nên thịt rất là rất là thanh nha Với cả cho rất là nhiều lá é và bốn cái nồi lẩu sôi lên nó thơm phức Hà mà lá é ăn tới đâu với bà bỏ tới đó thôi nghe để mà vừa chín tới sẽ giữ được độ thẩm nhiên là phải làm một chén nước chấm như vậy Tao nói là nó bá cháy luôn Thịt gà thì có cả đùi cánh chưa hết nha Cái nồi lẩu vừa thanh mà lại đậm đà nữa trứng non mà chậm như vậy tao nói nó dính gì đâu mùa này á Trời se se lạnh Lam liền một chén lẩu nóng nó ấm lòng gì đâu Tao nói hàng nước lẩu nó dậy mùi thơm nó bắt vị là bởi vậy Có quán lẩu gà lá é này đúng là chân Ái của tôi chưa hết nha Tôi còn đẩy nhẹ chả ram tôm đất được chia nó cũng ráo dầu và giòn rụm mà không quên để nhẹ chỉ cánh gà rang muối bỏ chạy ba đứa đó không mắc vui quá chừng đâu có hết đâu phải có mang về nhưng mà chất lượng nha mấy bà mà về Đà Lạt Thèm lẩu gà lá é ghé chỗ này thử nghe bye bye,https://www.tiktok.com/@7163686821477729306/video/7316752294509399297
7163686821477729306,7316452773283859714,Thời buổi bây giờ đi Đà Lạt mà ăn cái lẩu đầy đủ như vậy chỉ có 99.000đ rồi món nướng cũng chỉ 99k bò cho đến hải sản chất lượng lắm đó Hello ta có Hữu là là buổi đi ăn đây không gian thì khá rộng rãi nằm ngay trung tâm luôn đồ nướng tôi có gọi bảo vú heo thêm một ít rau củ nướng nữa nghe no se lỗ hồi trước là buffet giờ chuyển sang gọi món máy món nướng lẩu khá vừa vị quan trọng là bảo tàng mềm lắm nha ăn mòn một cuốn theo như vậy nè mới đúng bài Ở đây nước chấm là muối ớt xanh nha mọi người mà chấm cũng khá là dính nha tôi không nào là menu hạt dẻ nhưng mà rất là chất lượng ngay để mà ăn no chất bụng thì cơm chiên trứng với mọi người gom được chiên không quá khô như vậy nè nhưng mà ăn liền ăn nóng mới ngon cho bữa hai người ăn no mà có 59000 Hà dễ sợ hết trộn giờ là 49 km ở đây thì rất là nhiều loại lẩu 99k tôi chọn lẩu ếch rồi có kêu thêm cá diêu hồng rồi đậu hũ non nấm kim châm với thêm một diễn viên thả lẩu nữa dù menu của quá trình bắn hấp dẫn nhưng với tôi ở dưới hay vẫn là chân Ái ở đây ướp rất là thú vị mà không có bị hôi là tới cái nồi lẩu sôi rồi lành lạnh mà hấp cái nồi lẩu như vậy Trời ơi tao nói đúng là tuyệt cú mèo nước lẩu thì chua chua cay cay khá là tha Nói chung là với cái mức giá này khá là hợp túi tiền sinh viên luôn Bà nào mà chuẩn bị đi Đà Lạt thì nó lại chỗ này nhanh máy bay,https://www.tiktok.com/@7163686821477729306/video/7316452773283859714
7163686821477729306,7316380160905841922,Hồi đó giờ tôi rất là mê sữa bò nguyên chất có bán Tôi cần mua nha mấy bà hôm nay không những tôi tìm được chỗ có sữa bò bán mà có cả tuần 17 số bò nhiều vị nhất từ trước đến giờ đó tại căn hộ là buổi đi ăn đây một cái chiếc quán sữa bò màu hồng rất là xinh xắn Nha Quan trọng là với tiêu chí không tạp không tha không chất bảo quản không ngon hoàn toàn nghe như vậy thôi đã thấy yên tâm rồi mà sửa đây được thanh trùng xong rồi mới biết vậy có cả bò sữa Choco hạnh nhân nó thơm dữ lắm mà rất là đậm đà nha Tui bày cho mấy bà một cách để uống cùng sữa này nữa nè bánh này chọn liền cho tôi hai cái xong rồi chấm như vậy nè tưởng Không hợp nhưng mà hợp không tưởng là cả nhà thấy Ok la quá nên giúp thêm cái nữa mà mấy bà biết không sửa ở đây được thanh trùng xong rồi mới mít vậy mà cái ván này sữa nguyên chất nấu lên được hình thành nó mấy bà yên tâm muốn nghe Không có sao đâu nhớ thử sữa bò gạo rang với bò hạt dẻ cười thơm lắm Đúng là một địa điểm chiều ngắm đường phố buổi tối có bà nói lại nhanh Bye bye,https://www.tiktok.com/@7163686821477729306/video/7316380160905841922
7163686821477729306,7316082453213351169,giữa cái lòng Đà Lạt này có một cái quán theo phong cách vừa được thưởng thức còn được nghe nghệ nhân trổ tài nhạc dân tộc rất là hay nha mấy bà Quan trọng là mấy cái món ăn vừa lạ tưởng Không hợp nhưng mà hợp không Tuổi luôn đó mọi người Hello buổi đi ăn đây không khí Tây Bắc nó nhộn nhịp gì đâu đó mọi người nghe nói chú này là nghệ nhân Bùi Tiến Mạnh độc tố 6016 bên trong mộng nước vừa vị lắm phải nói tới cái nước chấm ở đây chấm gà quá chừng luôn mặc dù là móng tay mắt nhưng mà khá dễ ăn nha cả nhà nói là tôi mạnh nuốt lắm chưa kể là cơm lam Nó dẻo chấm với muối gừng thì thôi bá cháy luôn bởi vậy tới chợ phiên quán với bà nhớ thử cái món này nha chưa hết đâu trong cái mặt đó còn có gỡ gà nữa đó Mấy bà còn món này là nai nướng tảng thịt nó vừa mềm vừa thấm vị thơm mùi tiêu xanh nó cuốn lắm nha Còn cái dĩa rau rừng này nè chấm với lại nước tương ớt sắc vừa cay cay ra vừa thơm bát cơm lắm luôn rửa cái thời tiết chỉ có 160 cá tầm ở đây rất là tươi có cả măng chua và rau ăn kèm nữa nước lẩu chua ngọt khá Thanh ăn kèm với mì nó hợp lạ lùng công nhận không biết thì thôi chứ tôi mê cái quán này rồi đó Chưa kể là những món ở đây rất là bắt mắt giống như cái món bò nướng ống tre này nè mỗi người hơn 200 càng được thưởng thức món Tây Bắc với không gian như vậy thì quá Ok la luôn đó mấy bà trải nghiệm thử nghen bye bye,https://www.tiktok.com/@7163686821477729306/video/7316082453213351169
7163686821477729306,7316010393573379330,Trời đất ơi ăn thịt nướng cơm lam mà Villa mát như vậy nè xiên thịt nướng thì cực kỳ chất lượng tận 5 vậy chứ từ 25 g Hà Ngoài ra còn có mức bên Thái có cả xúc xích gà nướng nữa đi ngang Nghe mùi thơm là phải tắt vô liền luôn đó là buổi đi ăn đây Nói chung là từ 55 cành là mấy bà đó Ăn no rồi Mấy bà biết không thịt nướng chỗ này là từ thịt nạc dăm đơn xin nào xe máy Nhìn chất lượng Ngoài ra còn có mất bên Thái xúc xích thành nam nướng nữa quan trọng là cơm lam ở đây nấu bằng nếp nương Điện Biên trong các ống tre này đối tượng 5 tiếng nên khi mà góc ống tre ra rất là thơm còn nếp thì dẻo nguyên hạt như vậy nè không có bị nhão đâu mà vị là vị thiên nhiên nha mấy bà nào là lá dứa lá cẩm hoa đậu biếc màu cam là vị rất đó mọi người ăn với cái viên như vậy nè là chiêu đãi chưa với chả thịt nướng ở đây không có bị khô cảm nhận một cây 35 cành nhưng mà khá là chất lượng nhanh còn đem nướng nó tới tận 6 Núi đã giữ chưa móc bên Thái chỗ này được lắc phô mai bột nha cả nhà chấm thêm tương ớt cho nó chui ra thịt mềm nha mấy bà thấy xúc xích ở đây không còn nguyên tắc là không có giống chỗ khác đâu gà nướng thì có đùi và má đùi cảm nhận của tôi là gà da không có bị bộ với cả Mặc dù nướng nhưng mà không có bị khô được ăn kèm với lại đậu bắp nướng nữa buổi tối thì ở đây đông lắm ai mà đang thèm món này thì thử trải nghiệm ngay Bye bye,https://www.tiktok.com/@7163686821477729306/video/7316010393573379330
7163686821477729306,7315787884794023169,ăn ốc Bây giờ là phải biết đổ vỏ nha mấy bà nói giỡn chứ ăn ốc Bây giờ là phải biết lựa chỗ Nha vừa muốn rẻ mà lại chất lượng thì không có đâu nhưng mà ăn ốc với sự uy tín ốc tôi mỗi ngày thì tôi sẽ chọn quán này chỉ từ 50.000₫ với chất lượng cũng quá xứng đáng Hello tại cá Hữu là là muội đi ăn đây nếu mà hỏi quán ốc nào nhiều sốt chế biến thì tôi mạnh dạn đi comment mọi người Cái Quán Này nào là sốt chanh dây số trứng muối sốt phô mai có cả số taxi nhưng mà tôi thích dấu hiệu này lắm nha mấy bà rất là nhiều hàng mà cháu ngọt thịt lắm luôn một bài như vậy 4 năm người ăn no no chỉ hơn 800 cành ốc hương xào bơ bắp mỹ con cũng khá là to shop bé mà thơm lắm mấy bà con heo đất có vị chua chua ngọt ngọt của sốt chanh dây ăn kèm với bánh mì tự nhiên Đúng hệ gan xào sa tế thì dính chứ sao Quan trọng là nó không có bột nên nó giòn giòn sần sật có thích quá chừng mà Tôi thấy ít có quán nào của ốc bố phải là ốc mày là ốc muỗng này nướng sa tế vừa cay vừa giòn giòn ốc búa nướng tiêu đen thơm lắm mấy bà ai mà Mai béo thì ốc mỡ xuất hành kim là ngay hệ luôn cái chén nước chấm mà có mỡ hành như vậy nè chấm Cái gì cũng dính ăn với sò điệp nướng mỡ hành tao đó khỏi bàn cái vòng mà khoái béo làm sao tha cho dễ ốc len xào dừa còn muốn ăn ốc thối ngoài thì nhất liền Oppo đó có con nào con nấy bà cho bữa giòn giòn sạch sẽ mà hâm nóng cái bao tử đang cô đơn thì làm liền cái tô cháo hào hành gần như vậy tôi nói thiệt món nào món nấy ở đây đều hấp dẫn mấy bà nói lại rồi đi ăn ngon bye bye,https://www.tiktok.com/@7163686821477729306/video/7315787884794023169
7163686821477729306,7315715087413660930,một tiệm bánh mì chảo mà tôi quay đi quay lại rất là nhiều lần là bởi vì ở đây có một cái hương vị riêng với cái nước sốt đặc trưng không có giống ai mấy bà kia ăn một lần nó sẽ ghé lần thứ hai thứ ba luôn à nghen 1/4 chỉ từ 55 cành hàng quán nằm ngay trung tâm rất là dễ tìm luôn đó Hello tại cái hũ lại là ngủ đi ăn đây Quán này khá là rộng tới tận 2 tầng nha mấy bà có cả chỗ đậu xe hơi thoải mái luôn lúc nào ghé đây ăn tôi cũng chọn phần đặc biệt hết trơn á mà Tôi thấy nghe một phần rất là nhiều bò với cả ớt kiểu gì mà bò mềm lắm điều gây thương nhớ tôi để quay lại đây là cái nước sốt đặc biệt mà thơm đậm đà lắm luôn với cả xoài bằng chảo gang nên nóng rất là lâu nhưng mà phần đặc biệt còn thêm phô mai nữa đó Mặc dù là bếp bỏ nhưng mà quán khá rộng nên không có bị ám mùi đâu đẩy nhẹ thêm ly sữa đậu nành nóng thật là tuyệt vời phần đặc biệt Tôi ăn là 70 km mà thấy không viên xíu mại Chất lượng lắm luôn kiểu nó rất là vừa vị càng ăn càng cuốn đi đâu ăn bò mềm mà tôi khoái rồi Bởi vậy Mỗi chỗ có một bí quyết riêng để mà giữ chân khách quay lại nhiều lần rất là khó à nghe nhưng mà quán này đã làm được đối với tôi như cái phần ba tên nó béo nó mềm tan luôn Tao nói ngang một phần vầy nè Ăn no uống thử trứng ốp la Thì lòng đào như vậy nè Quá đã với cả cái sốt nó vừa vị lắm nên không cần phải nêm nếm gì nữa đâu Nói thiệt chứ buổi sáng mà mấy bà tới đây đông đen luôn đó mà quán thì mở sáng sớm cho tới chiều tối luôn nghen có dịp đi Đà Lạt nó mà nó thử chỗ này nghe bye bye,https://www.tiktok.com/@7163686821477729306/video/7315715087413660930
7163686821477729306,7315638516216597762,lần đầu tiên ăn bánh tráng trộn mà có tôm rim như vậy nè Trời ơi Có cái sốt này nó thơm mà nó đậm đà lắm luôn mà trái ớt sa tế đây cây xỉu luôn nha mấy bà Một phần như vậy chỉ có 20 cành bà quá chừng Hà Ngoài ra còn có bánh tráng full topping gói bánh tráng chấm nữa mấy bà đó biết chỗ này chưa Hello ta ngủ là ngủ đi ăn đây chỉ là một cái xe nhỏ thôi nhưng mà rất là sạch sẽ và chỉnh chu nha mấy bà chưa kể là ở đây có sốt tôm rim dính lắm nha tôi chưa thấy chỗ nào có cả tóp mỡ khô gà trứng giữa quan trọng là bảo hành độc lập như vậy nè Đỡ dầu mỡ được một cái là chỗ này chị trộn bánh tráng phơi sương nên rất là mềm nha mấy bạn Một phần như vậy là 20 cạnh có mở hàng đầu số con riêng với số tôm rim này nè Nó làm đậm đà cái vị bánh tráng hơn tôi thấy chị chọn cũng khá là đều tay cuối cùng là cho thêm Xoài với lại đau răng mà công nhận một phần nhiều lắm nha mấy bà Nếu mà mọi người muốn ăn thêm top 3 thì ở đây cũng có khô gà rồi tách bỏ vàng chính giữa ngoài ra thì đây còn có bánh tráng chấm nữa trời ơi cái phần thập cẩm có nhiều ứng dụng Ai ăn cây ích cho nhiều thì nó giận ngay đây phần 20 cành này mấy bà tôi rất là mê cái tôn riêng ở đây nha trộn đều lên nó tự nhiên thấy thơm lạ lùng kiểu là càng ăn càng cuốn đó mấy bà một điều là bánh tráng chấm chỗ này có thêm mỡ hành là đậu phộng nữa nhớ trộn đều lên nha mấy bà ơi Xong rồi chấm như vậy tao nói nhức nhối không nhận ăn món mình thích tự nhiên thấy thoải mái nhẹ thêm bịch trà chanh túi Zip nữa rồi đi về Nói chung là okla đó mấy bà thử nghe máy bay,https://www.tiktok.com/@7163686821477729306/video/7315638516216597762
