author_id,video_id,video_transcription,url
7163686821477729306,7356950034568449281,một dĩa bánh cuốn 5 lại có bên ngoài chỉ có 25 cà có cả bánh cuốn trứng cũng có 30 kg Hà tôi ưng chỗ nào là vỏ bánh cuốn được độ mỏng lắm với cả ba loại chả mà Loại nào cũng ok phần thịt nó là nấm mèo rất là vừa vị bánh lúc nào cũng được đổ nóng thôi hỏi à khi nào khách ăn thì chị mới làm Mặc dù chỉ là một tiệm lề đường nhưng mà chỗ ngồi rất là sạch sẽ có trong nhà luôn đó là bố đi ăn đây ngoài nhân thịt bằm và nấm mèo ở đây còn có chả lụa chả chiên chả quế rồi Nem và bánh đậu xanh nữa cái phần vỏ bánh nó được chị đổ mỏng như vầy nè rồi thêm nhân vào mà nhân thêm nhiều nữa một đĩa 25 cành mà được 2 củ luôn nghe rồi thêm chả chiên chả cây chả quế tất cả anh em và bánh đậu xanh nữa thêm chút giá trộn rau và hành phi ăn cho đỡ ngán Ở đây còn có bánh cuốn trứng nữa kiểu mà quán nào đổ vỏ màu là tôi thấy khoái rồi vì ăn nó vừa no luôn Coi vậy chứ chị làm cũng nhanh tay lắm Tuy là vỏ mỏng nhưng mà rất là dai chứ không có bị bỏ đâu Mấy bà phần nào cũng đầy đủ năm cấp pin luôn Tao nói hay ăn một dĩa như vậy là ngon rồi cả Cũng xịn nữa không có bị Bộ tự nhiên phát hiện ra chỗ này Ok quá trời nè nhưng ngập lụt cái dĩa bánh cuốn trứng nó cũng nhiều không kém đâu tôi quen ăn chay như vầy nè nó mới thấm đều được đó thêm lớp trứng có vỏ bánh cuốn tự nhiên nó béo hẳn ra ăn đã cái này là có thiệt Tôi là tôi ở chỗ nào rồi đó Bye bye,https://www.tiktok.com/@7163686821477729306/video/7356950034568449281
7163686821477729306,7356889184138726657,trời nắng nóng mà làm được dưa hấu đã xa như vậy có 25 cạnh mà đã hư ghê chưa uống mà đã thấy mát lạnh rồi đó Ngoài ra còn có trái cây sinh tố nước ép nữa trời ơi tìm được cái tiệm chân Ái của tôi luôn đó Hello tài có ngủ là buổi đi ăn đây tôi ở đây nhiều lắm đấy bà hợp như vậy từ 35 đến 50 Cần Hà mà Công nhận nhìn nịnh mắt thiệt nha nào là dưa hấu nho thanh long vào đu đủ mít nữa còn cái ly như vậy là 15 cạnh ăn với muối nha Mà cách bài trí ở đây rất là sạch sẽ chỉnh chu tôi đi ngang qua mà phải quay xe lại liền sinh tố bơ mà trái bơ cỡ này nè 35 thành một ly bơ dẻo lắm Nhưng mà quan trọng là ở đây có dưa hấu đã say ta nói hay 25 cạnh Mày mà uống Mát lạnh luôn đó có cả dưa hấu vàng với lại dưa hấu đỏ nước ngọt nhẹ nhàng Thanh đánh nhau mấy bà Ngoài ra thì chạy nhãn ở đây được nấu bằng nước mát 30,https://www.tiktok.com/@7163686821477729306/video/7356889184138726657
7163686821477729306,7356578946277772560,có phải món phở Thái Lan là đặc sản của miền bắc không mọi người đâu mà cái mùi thơm Thối đặc trưng của món Thái Lan nó định miệng lạ kỳ một tô ở đây chỉ có 40 cái nước phở vừa thơm mà thanh lắm có cả bún bò mà tô chén lúc nào cũng được trộn nước sôi như vậy nè và tôi ăn ở đây nha mấy bà ơi bà có ngủ là ngủ đi ăn đây mới có giờ này mà quán nào gần hết nửa nồi rồi để làm tô phở tái lăn Ấm bụng trước đã được áp chảo như vậy nè với cả Thái Lan thì thịt rất là mềm mà đặc biệt món này khi nào khách gọi mới làm ngay nên lúc nào cũng nóng hơi thở thật mềm đã lắm có cả tô đặc biệt 50k Có bò tái nạm gân nữa quán nho nhỏ vậy trước hết cho mình được à Ai mà ăn đậm không thì 35 cần sa tế ở đây nó cay luôn đó mấy bà có cả sữa đậu nành nóng nữa Ba đứa buổi sáng làm ba tô như vậy là nó nó luôn bán miếng bò tái lăn nó rất là mềm cọng bánh phở không quá dài phải nói lần đầu tiên Ăn cái món này là thấy khoái liền mà chỗ đây cho Nguyên dĩa rau cỡ này nè hiểu nha Còn cái tô đặc biệt thì Ê hệ topping nào là nạn nhân bò viên rồi còn có tái nữa 50 cành quá chừng xứng đáng luôn thêm chút tương ớt tương đen cho đậm đà hương vị một tô bạc cho bữa như vậy nè bánh bèo như tôi ăn không có hết nhớ là một chén thức bên nhau mọi người rồi thêm chút rau quá đã còn tôi 35 Còn riêng tôi là tôi Ưng rồi đó Bye bye,https://www.tiktok.com/@7163686821477729306/video/7356578946277772560
7163686821477729306,7356516757177158928,Hôm nay thằng Tây nó dắt tôi đi ăn mì bò Hồng Kông nguyên liệu chủ yếu là bò và chủ là người Hồng Kông nấu món nào cho gia đình ăn lâu lắm rồi và ai cũng thích hết trơn á nên chú mới mở ra tiệm này luôn nè nói là không có sử dụng bột ngọt không có dầu mỡ ăn để loại sức khỏe cho mọi người một tô chỉ từ 55 cà rốt Minh thì có gân bò viên nặng có cả bắp bò luôn nghen Có cả ba loại sách đặc biệt mà chủ đâu có nào là sa tế Hồng Kông còn xót xa trương để dành trộn mì Còn cái này là số hải sản Mỹ Vị Và đây là tương chấm Mặc dù nạp thẻ nhưng mà không gian sân vườn rộng rãi lắm đó ta có thủ là mụ đi ăn đây trước khi chuẩn bị cho vào phủ cho hết bộ mới có gọi một tô sa tế bào 65 cặp bò được trộn cái trong cái nồi phá nấu này nè ăn kèm với dưa leo cà hành tây cho đỡ cả cái nước sa tế bào này nó đậm đà chỉ cây nhẹ thôi dễ ăn lắm son này là sủi cảo khô tôi còn gọi thêm bột mì trộn khô nữa phần đặc biệt có nên topping quá trời ghê mà cái tô sao tế bào này vừa đậm đà thơm mà bò mềm nữa với cả thanh nữa và được thành từ bò và rau củ mà còn mì không hề bị vỡ luôn Vé số cả bò viên nào viên nén Total mà tôi thích cái sủi cảo chiên này rồi ăn nhân bò nó lạ hơn nhân thịt heo nhiều lắm nước ngoài thì giòn rụm Hà có cái chén chấm riêng ăn nó đã gì đâu tính ra nước chấm ở đây chấm cỡ nào cũng dễ vẽ mì khô thập cẩm này 75 cành gồm có não bắp bò gân bò viên bò trứng lòng đào nữa nước súp ngọt thanh với rau củ quả quán lúc thể mà hấp dẫn như vậy là tôi Ưng rồi đó Bye bye,https://www.tiktok.com/@7163686821477729306/video/7356516757177158928
7163686821477729306,7356207998076718352,ấn tượng đầu tiên mà tôi nhớ hoài Khi ăn chuối tiệm nướng này tao nói không được đá đầu tiên trong năm nay bởi vậy nhanh trí làm liền cái lẩu luôn đó mấy bà được một cái là ăn trưa ở đây thoải mái lắm mấy bà ơi vừa có tiêu Thung lũng hoa cỏ món ăn từ lẩu tôm nướng hấp dẫn lắm à nghen Hello tài Tố Hữu là muội đi ăn đây cái món này là đậu hũ hải sản đối với bạn vừa có vị ngọt của rau củ kết hợp với Hương vị đậm đà của hải sản đậu hũ thì mềm tan một cái món ăn khá là dinh dưỡng tôi đi ăn buổi trưa Thấy hợp lý lắm luôn thằng Tí em tôi thì khoái gà sốt tiêu xanh cái thịt gà không có hóa da mà chắc lắm nha Với lại cái sốt đậm đà tròn vị Thêm mục tiêu đến năm cuốn lắm sốt này mà ăn với bánh mì nữa là no căng bụng luôn mặc dù đi buổi trưa nhưng mà thời tiết mát lắm có cả xà lách trộn ăn kèm đó nghen lai ra thì tôi chọn ba món nướng bò cuộn kim châm vừa vị được một cái mặc dù ở vùng núi mà tôm tươi Nha làm thêm máy thường xuyên nữa ăn mới đã cái nơ ta nói ở Đà Lạt mưa hay nắng cũng đẹp hết trơn á Làm thêm dĩa salad dầu giấm chứng cho heo thì nhanh Trời thì đang mưa làm một cái lẩu cá tầm ấm lòng lắm luôn được ăn kèm với rau các loại có bún nữa cá nhân tôi thấy nước lẩu Thái là thanh giá tầm đó thì tôi mỗi người tầm hơn 200.000 đ chưa Chiều tối ở đây rất là hợp lý hàng ăn Tôi là tôi Ưng rồi đó Bye bye,https://www.tiktok.com/@7163686821477729306/video/7356207998076718352
7163686821477729306,7356146507336191248,lần đầu tiên ăn bún bò mà có xương nước cỡ này nè nghe câu nói Một ngày Nấu hơn 80 cái xương chưa kể lại hành tím và ớt sa tế đều là nhà làm ngoài xương Còn có giò nạn rồi tới nằm trả đặc biệt là có rau cải mầm và đây là bún bò cô Hạnh nha mấy bà ơi là muội đi ăn đây buổi sáng thôi mà khách đông như vậy nè cô chất lượng lắm mấy bà trả mà cắt về cua chỗ này nè Nhưng mà quan trọng là cái nào nước Lào này được làm từ xương nên rất là thanh không có vị thuốc và mắm cái vị đặc trưng của miền Trung đó mọi người mà nước mắm ở đây được pha từ tỏi Lý Sơn hành tím thì tự ngâm với sa tế khô chứ không phải ướt nghe thấy cô chai nước nào mà thèm nghe luôn đó mấy bà cứ gọi tôi Đặc biệt 65 cành gồm có sương đạp trả những cái tô tóc bên mà thấy hè rồi Thằng Tèo thì nó ăn một tô cơm giòn xương chả nặng 4 món là 75 kg mà cái nước này nó trong tiêu à Nghe nói là cô tự nghiên cứu để nấu luôn đó nghe nói là thâm niên của cô được 18 năm rồi Trời ơi mấy cây xương có thịt nó đã lắm đấy bà ơi ăn kèm với nước mắm như vậy nè Tao nói nó dính gì đâu Cái cục giò nạc nó hấp dẫn mà được một cái làm mềm riêng tôi với cả Nam cũng mềm nghe miếng chả dày như vậy nè ăn mới đã ăn Mấy cái miếng thịt của mì gõ quen rồi như thế nào nó lạ ghê Mấy bà nó 65 cành nó cũng hợp lý đúng không với cả bún không bị bở nữa cho thêm một miếng sa tế rồi thêm một miếng hành tím Tôi thấy đau đầu rất là chất lượng đặc biệt là có thể làm nữa không bị ngán luôn Tôi là tôi rồi đó Bye bye,https://www.tiktok.com/@7163686821477729306/video/7356146507336191248
7163686821477729306,7355836157940354305,mỗi lần mà thèm cơm nhà không có thời gian thì cái quán cơm nhà mà tôi suy nghĩ tới đầu tiên khẩu vị lại hợp túi xách đó chính là cơm niêu thiên lý để mà trụ được trên trái đất Sài Thành này gần 10 năm phát triển rất là nhiều chi nhánh Nha hôm nay tôi đi chi nhánh mới khai trương ở quận 6 có nói hay chất lượng đồ ăn vẫn như ngày nào nghe Hello thịt luộc Cà Pháo chấm mắm tôm món thứ hai mà để ăn no là cơm cháy gà roti nửa con 199 cạnh hai ba người cân bằng ống giọt bên ngoài bên trong hạt cơm tôi không có bị khô tí mặn ngọt hài hòa vừa miệng lắm ăn nó đã Hôm nay đi đâu có nên gọi thêm cơm niêu cá diêu hồng chiên mắm xoài cái nước mắm nó vừa vị kẹo lì lắm nha thêm xoài chua ngọt hài hước giòn tan 95 cạnh Hòn Ngang với cả ở đây có bước sóng nước mơ chua chua ngọt ngọt hết lá canh cua rau đay rất là nhiều cua mà chỉ có 89 cành ngoài cơm thử đây còn rất là nhiều loại lẩu Hôm nay tôi chọn lẩu gà lá giang quá chừng là gà luôn đó mấy bà hình như là gà ta đó mọi người rất là chắc thịt ngan nước lẩu thịt Thanh chua thơm mùi lá vàng lá có cả rau và bún riêu mà chỉ có 229000 đợt này tôi đi lúc buổi chiều buổi tối đông lắm chi nhánh quận 6 nha mấy bà máy bay,https://www.tiktok.com/@7163686821477729306/video/7355836157940354305
7163686821477729306,7355774408260177168,Dạ Em khẳng định là kem bơ ở trạm là kem bơ được làm từ bơ nguyên chất túi còn nghe nói thêm mới đây làm thủ công nên nói với bà còn cái này là sinh tố bơ ngay một cái đặc sản khi đến Đà Lạt đó bà phải thử đó chính là kem bơ và khi mà thưởng thức kem ở trạm Tôi cảm thấy rất là hài lòng và có sự khác biệt kem đặc biệt tới tận 4 cấp bên gồm có trân châu trắng Miss Farm bơ dừa sấy nữa kem bơ chạm có tận hai chi nhánh tôi đi chi nhánh số 8 Hòa Bình là ngay cái view chợ Đà Lạt luôn không gian 2 tầng rất là rộng rãi và chỉnh chu mấy bà có thể sống ảo diệu lắm à nghen Hello Kitty là mụ đi ăn đây nhìn cái không gian chạm khá là phức tạp cho mọi người ngoài kem bơ ở đây còn có kem trà cổ thụ uống kèm với trà sữa khá đậm đà thơm nên bất cứ giờ nào mấy bà đến đây cũng phù hợp luôn đó vừa có cà phê trà rồi kem bơ kem bơ thì một ly giấy tờ 35 nghìn có li đặc biệt của tôi là 59 em vừa mạnh dẻo không có trong đá đâu được thêm một cái rất là lâu tan Ăn một miếng cảm nhận được độ béo mịn thơm ai mà mua cà phê có luôn nha bên dưới thì cà phê hòa quyện cùng lớp nhưng sao bên trên kết hợp thêm kem bơ chịu nha viên này là 45 cạnh với cả không ai thích thưởng trà thì nhớ thổi trà cân của thụ ngay như vậy là 59 cành bánh quá trời mà kết hợp với kem bơ thì dính chứ Sao nhìn cầu kỳ vậy thôi Chỉ có 45 cạnh nào mấy bà còn một chi nhánh Chư Sê nữa Nguyễn Trãi nói nhanh báo cho tin vui luôn nè hơn một tháng nữa trạm sẽ có mặt tại Sài mấy bà đoán thử xem là khu vực nào ngang máy bay,https://www.tiktok.com/@7163686821477729306/video/7355774408260177168
7163686821477729306,7355470873341529361,một cái quán ốc chỉ từ 29 đồng hải sản ở đây rất là đa dạng có 4 chi nhánh gò Hôm nay tôi phát hiện có chi nhánh Thứ năm chi nhánh thứ 5 Nè hát một bài hát như vậy mỗi người chỉ tầm 200 món tôm sú đút lò phô mai với con này nè 129 ngành chất lượng lắm nha đến đây mà không được ốc hương sốt trứng muối là thiếu xót lắm luôn đó 59 thành một phần Hà chưa đâu đi bốn người còn được Đã nửa ký Bào Ngư rồi ăn kem đã tiến lên là có thiệt nha quán bảo vệ đam mê đúng không ạ Tôi có thắc mắc hỏi chị chủ nếu mà ăn óc chất lượng ốc có vấn đề gì thì sao tính ra chị chủ có tâm rơi tôi là tôi ôm rồi đó 79 Thành,https://www.tiktok.com/@7163686821477729306/video/7355470873341529361
7163686821477729306,7355408110053281040,có phải là mấy bà khi mà lên Đà Lạt muốn ăn một cái lẩu bò trắng nhưng mà nhìn đâu cũng thấy lẩu bò ba ta không những mấy bà hoang mang tôi cũng đau đầu y chang Nhưng mà đợt này về đây với nhiều mối quan hệ của người Đà Lạt thì tôi đã tìm được cái lẩu bò ba toa tránh gió cách trung tâm tầm 5 phút chạy xe à từ vòng xoay chợ Đà Lạt đi thẳng vào đường ánh sáng Vật ngã ba Ba Tháng Hai thì quẹo trái đi chút xíu sẽ thấy đường Nguyễn Thị Định mấy bà nhớ rẽ phải liền nha con đường này đều là lẩu bò ba toa nhưng mà mấy bà nhớ nước nhanh hơn mấy cái quán đó nghe và đây là cái quán mà tôi muốn review cho mấy bà nè không gian sạch sẽ chỉnh cho máy lắm đó là buổi đi ăn đây nồi này là ba người ăn 300k không Dính thì thôi luôn đó gân bò ngoài công dụng có rất nhiều collagen nhưng mà xào với cải xanh như vậy tao nói nó hợp lý lắm luôn vừa cay thơm đậm vị chịu nha chấm với nhau cũng ok lắm 180 km còn gọi thêm một dĩa gỏi bao tử tổ ong trộn chua ngọt hài hòa ăn kèm với nước mắm chanh ớt quá đã mà không có bị ho vài giây đâu nha 160 cần một phần rồi bây giờ lên đây mà không biết ăn lỗ bỏ đâu thì nhớ thử chỗ này nhanh máy bay,https://www.tiktok.com/@7163686821477729306/video/7355408110053281040
7163686821477729306,7355097891012087041,thường thì mấy cái quán nướng lẩu mà có cái view đẹp như vậy mọi người suy nghĩ đồ ăn không có Ok đúng không Cái đó là quán nào tôi không biết chứ còn ở đây view nhà lầu còn được ngắm cả xe lửa chạy chưa đâu nha Bị hôm nay mưa đá nên tôi đã bỏ lỡ một buổi ngắm hoàng hôn rồi mặc dù rất là tiếc nhưng mà món ăn làm tôi khá hài lòng nên bỏ qua đó nghen Hello tạo có Hữu là muội đi ăn đây menu ở đây khá đa dạng Tao nói hai cái miếng sườn Tải này nè phải thử một lần trong đời mấy bà có thấy gia vị thấm đều không Bởi vậy Ăn một miếng là muốn ăn thêm miếng thứ hai giữa cái thời tiết bằng se se lạnh như vậy Ăn đồ nướng là hợp lý lắm luôn nào là tôm bạch tuộc bò cuộn kim châm mỗi phần dao động chỉ từ 120 km mấy con tôm nướng chín lên nó thơm phức à thêm hai con bạch tuộc nó dịu lắm à nghen chưa kể là nước chấm ở đây theo công thức của quán nước chấm nó dính lắm có thêm một rổ rau xanh để ăn kèm nữa nè nhưng cuốn cỡ này tự nhiên thấy thèm nghe luôn đó mấy bà Quan trọng là cái nước sốt nó đậm vị hài hòa ăn kèm với mì nước nào uống thử luôn cơ mà thịt bò rất là mềm nên yên tâm mà ăn tôi còn gọi thêm một món cũng khá là Ok luôn nha mấy bà ơi bà có cơm lam dẻo dẻo à Rồi con cá ăn với muối mà chưa đâu còn một món ăn nữa với cái món khoai tây chiên chấm cùng ba loại sốt tao nói nó đã cái nuôi dê ngoài tới đây chủ yếu là để ngắm hoàng hôn vừa chia vừa ăn lẩu cũng hợp lý vì nhớ trộn vừa chín tới thôi nha cá Nhưng tôi thấy nước lẩu Thanh và thơ người tầm hơn 200.000 vừa được ngắm nhà lồng vừa được ngắm hoàng hôn thì rất là dễ dàng ngang tùy thuộc vào đó Bye bye,https://www.tiktok.com/@7163686821477729306/video/7355097891012087041
7163686821477729306,7355033175992667409,150 nhưng mà hôm nay nó là 179 thành phần nguyên của học có thay đổi luôn từ đuôi bò Thăng Long lá sách rồi cân nặng tiêu chuẩn cho mấy bà chưa kể là còn có khoai môn và tàu hũ nữa Hôm nay qua đây kiểm chứng lại cho mấy bà đó Hello bà có ngủ là buổi đi ăn đây ngoài cái phần lỗ tai đỏ 179 Thành Còn cái nào là dễ thương của lẩu nè ăn kèm với rau mì bánh phở bò Mông Cổ này là tôi gọi thêm tôi còn xếp ngay ngắn cho mọi người hình dung nữa nè Cái viên bò rất là to nhưng nhiều bên dưới là Tôi đụng Rau đó mọi người nhưng mà cũng Ê hề topping không có khác gì đâu Ai mà ăn nguyên bào Mông Cổ thì 75 cạnh 1 lạng giang mai cái tết bên này tôi hóa chấm chao nó dịu lắm mấy bà ơi nước lẩu thì Thanh là vừa ăn nè lai rai bò viên chiên chấm cùng với tôi nó chỉ có 79 ca món này là mấy bò trái vả chấm mắm ruốc mấy bà nhớ thử cái món này nha nó lạ mà dính lắm nha 119 thành phần còn sườn bò rang sả ớt có 149 cành nó giòn giòn thơm sả thích lắm luôn Cái này là gỏi bắp bò ngâm mắm 119,https://www.tiktok.com/@7163686821477729306/video/7355033175992667409
7163686821477729306,7354661846969814288,đầu tiên ở Sài Gòn tết tết quá 180 phút mà tôi mới biết được cái máy này có cái món tôm tôm tép mỡ da giòn với cái nước sốt không có giống ai vừa đậm đà vừa thơm béo nhẹ nhẹ thêm tóp mỡ da giòn sần sật ăn nóng kèm bánh mì là đã tới nơi luôn con tôm thì to và rất là tươi mà nhớ ăn liền tao mở cho nó giòn giòn chấm thêm bánh mì là nó đọc nó nghe chưa đâu ăn một con tôm mà bán một con luôn đó mấy bà mà món này thì con theo lại nghen 49 cạnh một lạng ở đây thì ngoài cái món này ra Ốc Hương sốt trứng muối cũng chịu khó lắm nha mấy bà 49 canh một lạng mà con khá là to tôi cái sốt ở đây nó kẹo đó mấy bà ơi nó vừa bú Bùi Thơm đây đây cái con ốc hương nó bảo cho bố cái này nè Coi vậy chứ chấm thêm bánh mì ngon lắm à nghen vua ai mà béo là khoái khoái khoái liền không gian thì thoáng mát máy bay như thế này mấy bạn có thích không Hello Bạn có hỏi là muội đi ăn đi chứ đâu có nguyên cái view cm luôn mấy con ốc bươu nướng tiêu xanh nó thơm quá trời mà con ốc cũng không có bị két 69 trên một dĩa nè chấm thêm nước mắm tao nói đã chín chưa đâu sò huyết sốt Thái chua cay tê tái 99 cạnh 1/4 dọc cũng bỏ ngang lai ra thành phố Nghe hát Thái cho ấm bụng nè Tôi còn gọi thêm gỏi củ dừa hải sản 89 cạnh dĩa trộn rất là vừa vị chua ngọt hài hòa mà quán hơn 200,https://www.tiktok.com/@7163686821477729306/video/7354661846969814288
7163686821477729306,7354583649704004865,Hôm nay thằng Tây nó báo nữa tự nhiên vợ mày thích ăn bò nướng ngói rồi Mắc gì dẫn tao đi ăn chỗ này nó nói ở đây Hạt dễ chảy từ 39 thành phố thích ăn bò nướng nói ở chỗ sau khi chín nó vẫn giữ được mùi thơm chưa đâu Còn có chân gà rút xương có cả bạch tuộc mà bị ướt ở đây rất là vừa bò nấu món mà chỉ có 399 gam dung dịch có 39 Thành Hà dễ thương ba thì 793 sản xuất phô mai hay là trứng muối tiêu đen là 99 km càng đã có nuôi luôn lâu lắm rồi tôi mới ăn lại nước ngọt như vậy đó Hello Tại tớ hỏi là muội đi ăn đây khi mà chạy theo thời đại cái chỗ có nước ngọt như vậy nè ít lắm mà công nhận thơm phức cả mấy bà mùi thơm đặc trưng mà Thân Quen lắm nha Ăn thử cái bò cụng mà nó béo lắm Được một cái ở đây rất là nhiều loại bò có cả lỗi ba bò Mỹ rồi bò ba chỉ cuộn xuyên bò sốt phô mai thì bán lại kéo nó đã tôi khẩu vị mỗi người có cả số trứng muối và tiêu đen nữa nhưng mà cái chén chấm này dính lắm nha hài hòa cái nhẹ chấm Cái gì cũng với cả ra giấy tờ 39 cạnh nó thoải mái bay,https://www.tiktok.com/@7163686821477729306/video/7354583649704004865
7163686821477729306,7354291077630709008,Pokémon là 600 km ở đâu thì tôi không biết ở đây 200 càng hai người ăn thề luôn đó Bởi vậy cách tra vô lông đen à ngay khu Hòa Bình luôn nè tao nói hay nấm ăn rất là nhiều quan trọng là ở đây được sử dụng gà ta mà ở cái xứ lạnh như thế này ăn lẩu gà lá é giải cảm là hợp lý luôn đó Hello tất cả Hữu lại là muội đi ăn đây là đồ ăn rồi mà còn ăn thêm trứng non rồi Ngọc kê nó chứa 100 thành phần mà nghe nói cái lẩu gà lá é này xuất xứ ở tỉnh Phú Yên nhưng mà trên Đà Lạt có rất nhiều quán hồi đó tôi hay suy nghĩ ở quán nào cũng là tao ngộ nhưng nếu mà mấy bà tìm được cái quán chính gốc cái vị nước lèo sẽ rất là thanh Nha thơm đậm đà chấm với cái chén muối ớt xanh này nè Trời ơi tao nói đã cái nuôi lắm luôn mà thôi mấy bà đừng tìm nữa tôi chỉ luôn nè cái quán tôi ăn là ở số 2 Phan Như Thạch nước lẩu thơm thanh đậm đà gà thì da chắc thịt với cả măng không có bị chua bởi vậy còn tốt Tốt quá 180 phút mới tìm được một cái quán ưng ý như vậy để mà nhâm nhi thì cũng có trứng cút luộc nè mà chấm tương ớt là bá cháy luôn Tôi chỉ sương sương đường cho mấy bà đi vô nghe thấy cái mũi tàu 3 tháng 2 thì đi thẳng luôn nè Chạy thẳng chút xíu thấy ngã ba Nam Kỳ Khởi Nghĩa mấy bà nhớ Quẹo phải vô ngay rồi đi thẳng chút xíu sẽ sang cho sạch bên tay phải quay xe rẽ phải liền cho tôi nghe quán cũng nằm bên phải luôn đó tôi là tôi Ưng cái quán này là ngon bye bye,https://www.tiktok.com/@7163686821477729306/video/7354291077630709008
